id,reviewedAt,rating,isMarkedHelpful,reviewText,productCompleted,mostHelpfulVoteCount,users,user_id
95126682~COURSE!~1nl7NTHlEeyJLwrWUTXNdQ,1644452260705,3,0,​interesting...i just took it for interest and it was definately different,0,0,Elaine H,95126682
6513486~COURSE!~1nl7NTHlEeyJLwrWUTXNdQ,1674271582537,4,0,Did much to clarify the national ambiguity caused by these heroic and tragic passages.,0,0,Joseph Gretsch,6513486
112860770~COURSE!~1nl7NTHlEeyJLwrWUTXNdQ,1671288051501,4,0,Excellent content and presentation.  Truly gifted professor.  Would have given it 5 stars had he not been so liberal with his leftist views on the Palestinian issue ,0,0,KIP BROWN,112860770
60421895~COURSE!~1nl7NTHlEeyJLwrWUTXNdQ,1672583536952,5,0,"Very interesting, fast-paced,  light-hearted course! .  The Professor and his videos were great, I highly recommend this course. I didn't know anything about any conspiracy theories, until the pandemic changed everything. (Right now it's Jan 1, 2023, in the USA).   Unfortunately, now it seems like a good idea to know some of the most prevalent and violent ones out there.   :(After taking this course, I'm not sure I feel better about the conspiracy theories circulating here in the USA!   But I do strangely feel relieved that conspiracies have always attracted a certain audience, and have been around for a long time, and the world didn't end, so we might all be ok after all.Peace, and hoping 2023 is better than 2022 for everyone!",0,1,Kathy Conner,60421895
56830836~COURSE!~1nl7NTHlEeyJLwrWUTXNdQ,1661711000188,5,0,Very informative and entertaining course!,0,0,Mary Ellen,56830836
108507474~COURSE!~1nl7NTHlEeyJLwrWUTXNdQ,1655432093850,5,0,"very good thank you University of California, Santa Cruz  and Matthew Lasar ",0,0,Greg Howell,108507474
