id,reviewedAt,rating,isMarkedHelpful,reviewText,productCompleted,mostHelpfulVoteCount,users,user_id
61454229~COURSE!~dcPCP4NeEeu82xKTBdGGow,1638989143048,3,0,Sean mas claros para el uso de estrategias de emprendimiento y agregar ejemplos en cada tema de las lecciones y dar puntos claves en practica ,0,2,Elizabeth Nina Calle,61454229
90268735~COURSE!~dcPCP4NeEeu82xKTBdGGow,1669874647862,5,0,"Bien innovador, buenos expositores.",0,0,Johanna Kattan,90268735
85014386~COURSE!~dcPCP4NeEeu82xKTBdGGow,1656694637611,5,0,Muy completo y con buenas ideas y prácticas para llevarlas a cabo.Necesario cambiar la forma de subir la tarea. Muchos tuvims dificultad para lograrlo,0,0,Salvador Servando Icazbalceta Ocampo,85014386
96065339~COURSE!~dcPCP4NeEeu82xKTBdGGow,1638424248109,5,0,"QUE GRAN CURSO, ME DEJO CON UN APRENDIZAJE ENORME Y MUCHOS CONCEPTOS POR APLIUCAR EN MI EMPRESA.",0,0,Francisco Jasso Meza,96065339
94269120~COURSE!~dcPCP4NeEeu82xKTBdGGow,1635805558153,5,0,excelente ! ,0,0,Sandra Mercado,94269120
69090024~COURSE!~dcPCP4NeEeu82xKTBdGGow,1635686249263,5,0,"Con este curso aprendí que es posible tener éxito en tu emprendimiento y gracias a los conocimientos adquiridos en este curso, ahora tengo las herramientas, para seguir avanzando y profesionalizar mi negocio, estoy muy agradecida con Coursera.",0,0,Marcela R. Gonzalez,69090024
5033833~COURSE!~dcPCP4NeEeu82xKTBdGGow,1632888597602,5,0,"Cumple expectativas. Se vuelve un reto a quien a dejado de estudiar. Por lo que se vuelve un reto. Así que a estudiar todos los días, por ende todo el tiempo.",0,0,Hugo Reyes,5033833
