id,reviewedAt,rating,isMarkedHelpful,reviewText,productCompleted,mostHelpfulVoteCount,users,user_id
77625884~COURSE!~GzNPRtwWEeqQew6daMPmjw,1652026973749,1,0,IMPOSSIBLE to complete task 2.3,0,0,Nihat Musazade,77625884
97702354~COURSE!~GzNPRtwWEeqQew6daMPmjw,1639637009234,1,0,"Невозможно получить сертификат из-за ошибки в составлении курса. Задание 2.3 не засчитывается. Проходите оригинальный курс, не переведенный на русский. ",0,0,Daria Pozharska,97702354
115989486~COURSE!~GzNPRtwWEeqQew6daMPmjw,1676737371288,5,0,Excelent cours for beginer programmers,0,0,Гедиков Виктор Алексеевич,115989486
118151150~COURSE!~GzNPRtwWEeqQew6daMPmjw,1676044905394,5,0,Сourse material is clear even to an accountant  :),0,0,Lena Zhirkova,118151150
50715255~COURSE!~GzNPRtwWEeqQew6daMPmjw,1661573303920,5,0,"This is a great course in programming language. Dr. Chuck loves his work and with all his love helps us to become t provide the foundation and give a further path for the development of students. Charles Russell Severance treats his work with full dedication, with excellent quality, with a fire in his heart and a little humor. This all hangs up interest in learning, helps students not to stop halfway, but to go and develop further.",0,1,Вірченко Леонід Анатолійович,50715255
61287745~COURSE!~GzNPRtwWEeqQew6daMPmjw,1641836616862,5,0,Thank you the course was milestone for my programming career,0,0,Nuriddin Samatov ,61287745
