id,reviewedAt,rating,isMarkedHelpful,reviewText,productCompleted,mostHelpfulVoteCount,users,user_id
40953999~COURSE!~HkJsxW0yEeWEewoyD2Bc5Q,1567518355155,3,0,"The project description could have been a lot more descriptive for what we were supposed to do. Otherwise, I had a lot of fun with this section.",0,0,Daniel DeWaters,40953999
5294998~COURSE!~HkJsxW0yEeWEewoyD2Bc5Q,1565279279950,3,0,"This is a very brief course, many of the topics deserve a much more thorough explanations. This part of the data analysis (i.e. data cleaning and acquisition) is in fact a complex subject and subjects are not covered in this course. There were also technical issues. For instance, the audio quality of lectures by prof. Jeff Leek is very poor. And the other major problem that I had with this course is the ambiguity of the requirements, although it wasn't difficult to finish. But if you are planning on taking this course, be ready to spend considerable amount of time on understanding the structure of the final submission's materials.",0,0,Anton Kasenkov,5294998
42022122~COURSE!~HkJsxW0yEeWEewoyD2Bc5Q,1561052018279,3,0,It needs an update on some libraries. ,0,0,Ivo Giuliano Giulietti Vega,42022122
33097287~COURSE!~HkJsxW0yEeWEewoyD2Bc5Q,1557770102639,3,0,There's too much of a jump from the theory to the practice. I had a difficult time understanding what was being asked of me. ,0,27,Mohammad Amir Aghaee,33097287
28712821~COURSE!~HkJsxW0yEeWEewoyD2Bc5Q,1552525050910,3,0,"The material in this course is very condensed. Data Table lecture was very much a copy of someone else' information on the web and was so terse, I would imagine even people from programming backgrounds had had to listen to it many times just to understand what was going .  Expect to put in good 8-10 hours a week into this course if you want to become proficient in course' material.",0,7,Moshe Pilsky,28712821
36278501~COURSE!~HkJsxW0yEeWEewoyD2Bc5Q,1552348954419,3,0,"This is really R part 2, getting into file/API handling, data frames, regular expressions etc.  The specialization focuses on data frames though little coverage of data tables needed for the capstone.  Some of the ordering of the materials was confusing e.g. this course revisits date/time handling which was started in the previous course.  Assignments are interesting and Swirl exercises are useful.  All in all, the combination of these R courses gets you up to speed.",0,0,Paul Ringsted,36278501
38077580~COURSE!~HkJsxW0yEeWEewoyD2Bc5Q,1549338888239,3,0,"This course was too hard for me compared to the first two in the program. Not sure whether it is because of my limited background in the subject area, or because of the abrupt shift in level from course 2 to 3.",0,0,Ehab H Abdelhamid,38077580
12210157~COURSE!~HkJsxW0yEeWEewoyD2Bc5Q,1548967463729,3,0,Ups and Downs.Some presented functions are deprecated according to official documentation...,0,0,Felix Ruecker,12210157
37385664~COURSE!~HkJsxW0yEeWEewoyD2Bc5Q,1547451153621,3,0,"Some of the lectures on loading data were very dry, but I guess that can't really be helped. Also the final course project's requirements were on the vague side. ",0,0,Yuqi Jiang,37385664
35130065~COURSE!~HkJsxW0yEeWEewoyD2Bc5Q,1540355808478,3,0,Mostly just R programming with data science in passing.,0,0,Ryan Wood,35130065
35745084~COURSE!~HkJsxW0yEeWEewoyD2Bc5Q,1540210548384,3,0,"I think some concepts could have been taught better with simple examples first, and then gradually move to more complex ones, but using noisy data blur the learning objective , and again... the instructors are just showing up a slide.. I think the power of video and illustrations could have been better utilized ",0,0,Tareq Rabadi,35745084
695717~COURSE!~HkJsxW0yEeWEewoyD2Bc5Q,1539323778150,3,0,"first two week need an update, because many thing on the videos dint work easy on the computer, is not bad to look for more information about the subject on the web, but at least made that the examples on the videos work fine went anybody run the scripts on theirs computers, last two week are good a brief summary of R, and how to work with data, love those 2 weeks",0,0,Alexis Caballero,695717
26438054~COURSE!~HkJsxW0yEeWEewoyD2Bc5Q,1537183809677,3,0,The assignments required A LOT of help outside the information provided in the lectures.,0,0,Nathan Heng,26438054
22393248~COURSE!~HkJsxW0yEeWEewoyD2Bc5Q,1533743792752,3,0,"The quality of this course is much better than the earlier two. Although this course still has the problem of feeling like a disjointed series of topics on singular functions, there is much more of a cohesive overall theme and structure so it feels a bit more like you're building towards an overarching goal. The final project directly relates to the lectures and felt like a solid way to connect most of the ideas to a project on real data.",0,0,Kai Pak,22393248
27313381~COURSE!~HkJsxW0yEeWEewoyD2Bc5Q,1532790914505,3,0,"I thought the course project grading was supposed to focus on what we learned in class, not almost entirely on creating readme and codebook files. Also, the explanation of what was expected for the project was NOT CLEAR,",0,0,Andrew Goldman,27313381
28525550~COURSE!~HkJsxW0yEeWEewoyD2Bc5Q,1530519042973,3,0,"Amazing, Kindly update the versions always.",0,0,Dr. Mohammed Hassan A. Jawad ,28525550
23730771~COURSE!~HkJsxW0yEeWEewoyD2Bc5Q,1529989272720,3,0,Vague instructions in many of the quizes and the final assignment.,0,0,finbar kiddle,23730771
32317945~COURSE!~HkJsxW0yEeWEewoyD2Bc5Q,1527731385709,3,0,It would be better if we had practice problems along the way. This course seemed to have a lot of commands that didn't stick until I put them into practice. ,0,0,Samantha Hummer,32317945
18435159~COURSE!~HkJsxW0yEeWEewoyD2Bc5Q,1527471871116,3,0,Average. Not useful even to tackle its own quizes and assignment.,0,0,Lee Chee Wei,18435159
29353742~COURSE!~HkJsxW0yEeWEewoyD2Bc5Q,1527414062485,3,0,"You will learn valuable tools, techniques and concepts but be prepared to feel overwhelmed (if you have no computer science background whatsoever) by quizzes and the assignment which require you to do research stuff outside of this course. ",0,0,Dominic Horinek,29353742
1502612~COURSE!~HkJsxW0yEeWEewoyD2Bc5Q,1526436412094,3,0,I felt I had to teach myself in this course.  I feel I would have had the same learning experience if I had purchased a good R book.,0,0,Paul Morlen,1502612
32652089~COURSE!~HkJsxW0yEeWEewoyD2Bc5Q,1525969661874,3,0,A lot of things covered in this course in a short time.  Probably should have been 8 weeks with more homework done step by step.  ,0,0,Richard Conaway,32652089
25667267~COURSE!~HkJsxW0yEeWEewoyD2Bc5Q,1521505879038,3,0,Not as clear and straightforward as R Programming. But definitely a worthwhile course to look at. ,0,0,Minh Lam,25667267
19049261~COURSE!~HkJsxW0yEeWEewoyD2Bc5Q,1520168026652,3,0,"This is an important course, but many updates will be needed. There are only a few exercise task, there could be more. The swirl part of the course is good.",0,0,András Hosznyák,19049261
7094242~COURSE!~HkJsxW0yEeWEewoyD2Bc5Q,1518234539069,3,0,"While the available content is good, I expected this course to take me to a more detailed level.",0,0,teena george,7094242
30913608~COURSE!~HkJsxW0yEeWEewoyD2Bc5Q,1517544352880,3,0,Useful.Too much  talking. Not enough integrated exercises.,0,0,Andrew Taylor,30913608
30431239~COURSE!~HkJsxW0yEeWEewoyD2Bc5Q,1516898900619,3,0,"The most challenging so far of the 9 courses on the Data Scientist track. Would like to see some errors removed from slides.  Some parts of the lectures seemed rushed. Would like to see some of the non-self-evident usage of some functions to be described a little better in more detail. I found myself having to look at multiple online areas to really understand some of the functions that were glossed over. Otherwise, this was a very helpful course that should be taught to all disciplines involving any amount or type of data.",0,0,Luis Ponce,30431239
29051408~COURSE!~HkJsxW0yEeWEewoyD2Bc5Q,1515485884005,3,0,The non-clickable links in the pdf are a major problem. You need to figure it out. Create a link reference field for each video or something.,0,0,Teodor Ivanov,29051408
2379373~COURSE!~HkJsxW0yEeWEewoyD2Bc5Q,1513371062277,3,0,This course really gets you working with R. The swirl exercises are great.,0,0,Derek Reeves,2379373
19472869~COURSE!~HkJsxW0yEeWEewoyD2Bc5Q,1512991647431,3,0,"The course is teaches you some principles of tidy data and cleaning data but it's very messy.There is no systematic approach to plyr and dplyr libraries. The teachers peak some functions from one and some functions from other library, but without any clear principle. It looks that prof. Leek and prof. Peng are presenting their favorite functions without consulting each other. They are doing it in the right way, though very confusing. On the other hand loading data is approached very encyclopedically.Assignments not only check what was taught in the videos but also sometimes require new skills and going through stackoverflow etc. (e.g. codes to read fortran files). This is not the way how you construct good coursers.Additionally some instruction in the final  assignment are provided in submission part! (Expected names of the files should be provided in the assignment description, not on the submission page).Prof. Peng and prof. Leek are very skilled, they know their job, but they don't know how to teach efficiently. Nonetheless if you are motivated to learn, this course may be very helpful. ",0,0,Tomasz Jankowski,19472869
28068504~COURSE!~HkJsxW0yEeWEewoyD2Bc5Q,1512819899843,3,0,"Useful, but a little boring.",0,0,Mario Previdi,28068504
835882~COURSE!~HkJsxW0yEeWEewoyD2Bc5Q,1511745858418,3,0,The professor Leak is not as gifted (in terms of teaching skills) as R. Peng. In some of the lectures he just reads what it's in the presentations but he does not go very deep into them.,0,0,Rigoberto Álvarez Escobar,835882
28210917~COURSE!~HkJsxW0yEeWEewoyD2Bc5Q,1509514201790,3,0,Explanation could be more elaborated like the earlier courses,0,0,Denis Singh Chingakham,28210917
11532986~COURSE!~HkJsxW0yEeWEewoyD2Bc5Q,1509050816557,3,0,"Need more lectures on R packages and newly added packages like reshape, dplyr etc.  ",0,0,Himanshu Raj,11532986
28164837~COURSE!~HkJsxW0yEeWEewoyD2Bc5Q,1508907886223,3,0,"The course fits nicely in the specialisation, and I enjoyed the Swirl exercises, which are massively useful. The structure, though, is a bit chaotic, with loads of topics touched only briefly. Perhaps less is good here. Also, I found that the Swirl exercises were repeated across Weeks, and sometimes they didn't have codes to earn extra credits.",0,0,Andrew Michael Telford,28164837
27424858~COURSE!~HkJsxW0yEeWEewoyD2Bc5Q,1508778321517,3,0,"This course was quite challenging in comparison with the first two. I felt that the material provided by the instructors was not enough to approach the quizes and assignments, so it's necessary to spent a lot of time researching for your own in other sources. I struggled with the Course Project Assignment because I didn't understand what I was supposed to do exactly. Fortunately, the forum threads were really helpful. Nevertheless, the course's intention is very valuable and if you are patient and go all the way through it you will improve your data science skills, learn very useful techniques and habits, specially if you're a beginner. But I strongly suggest the instructors to make the course contents more explicit and helpful.",0,0,Guillermo Arteaga Gaona,27424858
14880796~COURSE!~HkJsxW0yEeWEewoyD2Bc5Q,1505060174175,3,0,the course is good in terms of the knowledge but it is very unstructured. A lot of topics are treted just superficialy and the activities do not address the content of que lectures completelly.,0,0,Pedro Ramon Almeida Oiticica,14880796
8121648~COURSE!~HkJsxW0yEeWEewoyD2Bc5Q,1504386366073,3,0,Course touches points very superficially. Need to have better reference material.,0,0,Samidha Singh,8121648
24541665~COURSE!~HkJsxW0yEeWEewoyD2Bc5Q,1502278780760,3,0,"I would have given the course 4 stars if it wasn't for the last assignment which relies on other students to review your coursework. I understand that it is difficult to find another way of grading the assignments but the results of the process here are just too subjective and people influence your grade based on their subjective view on things, which I think is just wrong. Otherwise the course was good",0,0,Christoph Jindra,24541665
25331390~COURSE!~HkJsxW0yEeWEewoyD2Bc5Q,1501892247977,3,0,Great class for an important piece of data analytics and data science.  One issue I've been noticing with R compared to using Anaconda/Python is that a lot of the libraries required for the class aren't explicitly mentioned.  That's fine if you're experienced with these environments and able to read error codes with familiarity.  Minor annoyance to me when I run a script and realize I don't have a library installed.I'd imagine though its extremely frustrating for beginners who may have written perfectly good code but haven't figured out that they simply need to install certain packages to answer quiz or homework questions.  Perhaps having a full library or package list for Course 1 of this series will be helpful. ,0,0,John Y,25331390
25446553~COURSE!~HkJsxW0yEeWEewoyD2Bc5Q,1500885032989,3,0,"I have 2 key concerns with this course.  First, I don't feel like the material presented adequately prepares you for the quizzes.  For at least 2 of the 4 quizzes, I had to spend a substantial amount of time locating and reviewing other resources to answer the questions.  My second concern is that for the final course assignment, there is a lack of specificity with the instructions.  Not being able to answer a question is vastly different from not understanding what the question is asking and I found myself spending more time doing the latter (which is wasteful) and less time with the former.  ",0,0,Rashaad Jones,25446553
25659260~COURSE!~HkJsxW0yEeWEewoyD2Bc5Q,1500700879914,3,0,its so hard for beginner to,0,0,KIM DO HYUNG,25659260
26672880~COURSE!~HkJsxW0yEeWEewoyD2Bc5Q,1500371920522,3,0,"Quite disappointed at 'Getting data' part because of lack of explanation(I only had to learn extra sources to understand) but satisfied with 'Cleaning data' part. It would have been more useful if course described how to use GitHub, at the ",0,0,sunsik kim,26672880
23440892~COURSE!~HkJsxW0yEeWEewoyD2Bc5Q,1500041482452,3,0,"I did learn a lot, but I thought the first half of the course (getting the data) was very challenging.What does annoy me though is that links aren't clickable, sometimes they're wrong, there are typos on the slides etc. The response to these complaints in the forums is that these lectures were recorded a while ago and it takes time to change things and so on - but for $50 a month, I don't think it's too much to ask that the course materials be kept up to date! So honestly, I feel like I'm being ripped off a bit here.I did really enjoy the course project though.",0,0,Angela Wiesberg,23440892
23726307~COURSE!~HkJsxW0yEeWEewoyD2Bc5Q,1496192235282,3,0,"Difficult course, I had to complete it over two sessions. I came into the Data Science track with no knowledge of computer language, which has made learning R particularly difficult; however, after the previous classes I am finally able to search for the information I need to complete the assignment. The other reviewers are correct that the final assignment is a doozy - it took me several hours to complete.",0,0,Jake Thomas Taylor,23726307
23784985~COURSE!~HkJsxW0yEeWEewoyD2Bc5Q,1496129470126,3,0,needs little more real time scenario examples..,0,0,BIBHUTI BHUSAN PRAHARAJ,23784985
19754969~COURSE!~HkJsxW0yEeWEewoyD2Bc5Q,1494672758617,3,0,The assignment was tough.,0,0,Dinesh Baid,19754969
8487830~COURSE!~HkJsxW0yEeWEewoyD2Bc5Q,1493304159730,3,0,"To get value from the class, I used other on-line materials to understand the topic.  Thus, I spent about 20 hours/week on this class.",0,0,Nishi Gupta,8487830
23242130~COURSE!~HkJsxW0yEeWEewoyD2Bc5Q,1492060935711,3,0,"brought up some good concept inside, like ""tidy data"", but not in detail, how to grab data from different source shouldn't be difficult. should have more focus on talking about data.table, ""tidy data"" principles etc.",0,0,Justin zhang,23242130
16686338~COURSE!~HkJsxW0yEeWEewoyD2Bc5Q,1491606940260,3,0,"Would have preferred if there were programming assignments that incorporated reading from data sources on the web.For those planning to take the course, note the following:*The course covers reading data from a myriad of sources, but largely in passing superficial detail. These sources include  XML files, mySQL databases, HDF5 files, csv files, txt files with various formats (for example fixed-with files), JSON objects, and web API. However, the course project only involves reading data from several txt files and combining them into a single R dataset. Course topic order: In the first two weeks of the course, a lot of information is glossed over in passing- this information involves reading from the various file formats mentioned above. Week 3 involves subsetting, sorting, reshaping and merging data. Some of this may be review for you if you've taken the R programming course or the ""R Programming Environment"" course in the ""Mastering Software Development in R"" specialization. Week 4 involves string manipulation, regular expressions and working with the Dates. A lot of this is covered in Roger Peng's ebooks ""R Programming for Data Science"" and ""Mastering Software Development in R"" (both are freely available- google them).Assessments: The only assessments in the course are 4 quizzes- each of which involves about 5 short programming exercises- and a final project which only involves topics from weeks 3 and 4 (specifically- subsetting data, sorting data, reshaping data, and working with regular expressions). So you can do the course project without understanding anything covered in weeks 1 and 2 of the course. Mentor David Hood is fantastic for providing valuable resources to aid you with each assessment and so is Xing Su for providing a complete set of course notes. USE THE DISCUSSION FORUMS IF YOU GET STUCK!",0,1,Raw Noob,16686338
22634856~COURSE!~HkJsxW0yEeWEewoyD2Bc5Q,1487864570855,3,0,Materials (video and written) only partially prepare the student for the quizzes and course projects.,0,0,John Grasham,22634856
23746142~COURSE!~HkJsxW0yEeWEewoyD2Bc5Q,1487200860341,3,0,"Lectures add very little to what you get simply by looking at the slides on your own.  Facilitators are expert biostatisticians, not R programmers, and sometimes their explanations of R functionality is superficial and imprecise.  The assignments are rigorous and challenging, however, and if you take the time to go through all of the exercises you will gain valuable knowledge.",0,0,Edward Cox,23746142
21788716~COURSE!~HkJsxW0yEeWEewoyD2Bc5Q,1486311719615,3,0,The course isn't that hard but there is a lot of content to assimilate. ,0,0,Jean-Francois Joly,21788716
11342948~COURSE!~HkJsxW0yEeWEewoyD2Bc5Q,1483214783012,3,0,"decent enough but this is a heavy subject and really it is not that interesting although clearly necessary. I feel maybe it could have been organized better to make it more interesting  Also reading some of Haldey wickhams book he deliberately keeps this part of Data Science away from new learners as it can be a bit dreary, so my recommendation would be to do some of the other courses first. ",0,0,Tim jones,11342948
21925249~COURSE!~HkJsxW0yEeWEewoyD2Bc5Q,1478756101911,3,0,"This course provides a lot of methods and strategies about reading data, manipulating data. But I think some important issues in the real world are not discussed enough here, like how to treat missing values, how to deal with messy format data.",0,0,Bangda Sun,21925249
14900946~COURSE!~HkJsxW0yEeWEewoyD2Bc5Q,1478688476697,3,0,"Course is too simple, should be more extensive.",0,0,Pedro Vitor Quinta de Castro,14900946
18989122~COURSE!~HkJsxW0yEeWEewoyD2Bc5Q,1474422680823,3,0,The best course so far (though that's not saying much). This course would be better as a follow up to an example workflow showing an end to end analysis.,0,0,Andrew Cocker,18989122
10610702~COURSE!~HkJsxW0yEeWEewoyD2Bc5Q,1472926129532,3,0,Interesting but too simple.,0,0,Antoine Dusséaux,10610702
17227668~COURSE!~HkJsxW0yEeWEewoyD2Bc5Q,1472675834156,3,0,good course. but some concepts are hard to understand for newbies. so felt it was a bit advanced in parts.,0,0,Archana Ravi,17227668
1872190~COURSE!~HkJsxW0yEeWEewoyD2Bc5Q,1471594700112,3,0,Very usefull but can be technical and discouraging,0,0,Thomas GARGOT,1872190
17842996~COURSE!~HkJsxW0yEeWEewoyD2Bc5Q,1471057708250,3,0,"Contents in first half weeks are very superficial, have low depth so that do not help me do some meaningful studies. But later ones are good for understanding the structure of data.",0,0,Deleted Account,17842996
2664647~COURSE!~HkJsxW0yEeWEewoyD2Bc5Q,1470487492797,3,0,Not well explained.... Previous module was better structured.,0,0,JP Bogers,2664647
19772334~COURSE!~HkJsxW0yEeWEewoyD2Bc5Q,1469672215529,3,0,"
Topics were OK but the focus on R and no other tools is frustrating
",0,0,Doug Ellis,19772334
19165986~COURSE!~HkJsxW0yEeWEewoyD2Bc5Q,1466687367670,3,0,"The content of the course is good, but it seems abandoned - some links are outdated or don't work. I think it would be a much better experience for students if these first courses in the specialization got more love from the instructors.",0,0,Fabiana Glenn,19165986
17948723~COURSE!~HkJsxW0yEeWEewoyD2Bc5Q,1465721309711,3,0,"I liked it, but I had the impression it wasn't as prepared as the other courses. Especially with the course assignment I had a bit trouble to understand, what was wanted.",0,0,Christoph Grund,17948723
14421956~COURSE!~HkJsxW0yEeWEewoyD2Bc5Q,1464691816365,3,0,Peer reviewed assessment with students who are unsure of the correct answers = unsure if solution is correct.  Perhaps a formal process (same as previous course where a SHA commit is submitted and source is automatically downloaded (and plagiarism detected) & run to verify the output that columns / data meet an acceptable criteria,0,0,chris,14421956
380800~COURSE!~HkJsxW0yEeWEewoyD2Bc5Q,1464418126016,3,0,less hands-on exercises and this course covers too much topics without details. More like general intro to each tool and data sources. Swirl is still a great package for practice.  ,0,0,Shuwen Yu,380800
17912911~COURSE!~HkJsxW0yEeWEewoyD2Bc5Q,1462043606553,3,0,This course is of lower  quality than the preceding courses. The final assignment instructions are not clear. The forums helped but I have the impression that they are not really followed by the mentors.,0,0,Sven Brüssow,17912911
18395730~COURSE!~HkJsxW0yEeWEewoyD2Bc5Q,1461623849167,3,0,"The evaluation part of the course needs some fixing.  Otherwise, very good course!",0,0,Juan Arturo Silva Ordaz,18395730
17420664~COURSE!~HkJsxW0yEeWEewoyD2Bc5Q,1461160099887,3,0,"There were a lot of good nuggets in here, but overall this course felt somewhat disjointed compared to the others. It would be nice to have more practice with some of the different formats (e.g., JSON) and for exercises to loop back to some of the early content. I did like that the final exercise required a fair amount of investigation into understanding the documentation and relationship between the files before undertaking to code.",0,0,Mary Shelley,17420664
10867685~COURSE!~HkJsxW0yEeWEewoyD2Bc5Q,1460670185571,3,0,Toughest class in the offering.  There really could've been 2 classes for cleaning data.  I struggled with the lecturer's style (spoke too fast).,0,0,Paymon Hashemi,10867685
11943057~COURSE!~HkJsxW0yEeWEewoyD2Bc5Q,1459654448009,3,0,"The content of the course is too general, with too brief introduction of some commands in the lecture notes(slides), I don't think it would be very helpful for the students to deal with some real complicated problems.",0,0,Wentao Bai,11943057
9962492~COURSE!~HkJsxW0yEeWEewoyD2Bc5Q,1457862096731,3,0,"Hi all, Course provides interesting insight to getting and cleaning data. However, the course misses practical examples (not only showing the code in the slides, but also presenting how it works in R or RStudio). ",0,0,Bekhzod Atakhanov,9962492
5848369~COURSE!~HkJsxW0yEeWEewoyD2Bc5Q,1457196271880,3,0,very nicely made course providing a good hands on with R language. Thanks!,0,0,ISH GUPTA,5848369
3290848~COURSE!~HkJsxW0yEeWEewoyD2Bc5Q,1457109640575,3,0,Sometimes is hard to follow,0,0,Liliana Badillo Sánchez,3290848
4312355~COURSE!~HkJsxW0yEeWEewoyD2Bc5Q,1456850949326,3,0,"The materiel covered in the course was great, but more assignments instead of quizzes should be added.",0,0,Sudarshan Choubey,4312355
9790739~COURSE!~HkJsxW0yEeWEewoyD2Bc5Q,1455995045080,3,0,"In some weeks only about an hour of input where several topics have already been covered in R Programming. That's very little value for money.The final course project again feels like it's done in a rush and without another review: The submitted dataset should be automatically checked. It's simply impossible to derive from it whether the student did everything right, but it could be easily done programmatically. Some of the questions have wording and grammar issues that make it hard to understand. Also there is slightly contradicting instructions between the task and review description.",0,0,Constantin Scholl,9790739
