id,reviewedAt,rating,isMarkedHelpful,reviewText,productCompleted,mostHelpfulVoteCount,users,user_id
120866596~COURSE!~HkJsxW0yEeWEewoyD2Bc5Q,1674424537607,1,0,"Unfortunately this course had lots of potential but it turns out to have just a lot of flaws. The material presented is so dense that it would have needed a much more detailed discussion: getting data from the web in CVS format, XML, JSON, databases, etc. All these different aspects should have been discussed in much more detail. The second and most important flaw is the fact that virtually all data are out of date, and it is often impossible to follow along with the code, because the data is no longer available. Since the material presented is so much, it would have been useful to follow along, keeping the code for further analysis and for understanding what is actually going on, but that has not been the case, which is very disappointing.Finally, some of the packages, like plyr, are presented so quickly and the code explained sometimes doesn't work as expected. Another example is xlsx, that does not work with MAC and requires some personal google research to fix the issues. I had lots of expectation for this course, as I was curious to understand better data scraping and the link between R and databases, but the course has been a total disappointment. Once I have finished the specialisation, I will have to find some other courses to complement this, which is also extremely disappointing. From such a prestigious university, I'm afraid I had expected more.",0,0,Andrea Carpignani,120866596
116498364~COURSE!~HkJsxW0yEeWEewoyD2Bc5Q,1666622617459,1,0,"T​he swirl package can't be loaded due to old dependencies, so do the course; using very old version of R.T​he lectures are very hard to follow as the examples in videos  removed from web. which was very disappointing.",0,0,Borin Sroy,116498364
107317309~COURSE!~HkJsxW0yEeWEewoyD2Bc5Q,1661586700203,1,0,"The peer review is very frustrating. Sometimes the peers appear to not understand the assignment and you cant contest the decision. Many reviewers write only ""you can do better"" as they give you low scoring, with no further explanation of whats wrong. The information taught in this course is equivalent to a couple of tutorials you can find online for free, paying for this is a waste of money. Sadly, having certificates looks good, even if they mean nothing.",0,0,Zdeněk Šimůnek,107317309
29338197~COURSE!~HkJsxW0yEeWEewoyD2Bc5Q,1655923197704,1,0,"I received my certificate and it states the following: ""This certificate does not af_rm that this learner was enrolled as a student at Johns Hopkins University. It does not confer a JHU grade, course credit or degree; establish a relationship between this learner and JHU; enroll or register this learner at JHU or in any course offered by JHU; or entitle this learner to access or use resources beyond the online courses provided by Coursera.""Does this mean has no validation? ",0,0,Andrés Peñaloza,29338197
29230~COURSE!~HkJsxW0yEeWEewoyD2Bc5Q,1652452969673,1,0,"Once again, the projects are way beyond the skill level or tasking in the previous lessons.The lectures are ALL powerpoint; the instructor does not open R.The lectures are based on R as it was 10-15 years ago, when it was 3.0.  Nobody at Hopkins can update the lectures, or do an errata sheet?I can't believe my company is spending money for this.",0,1,Paul Younes,29230
91933523~COURSE!~HkJsxW0yEeWEewoyD2Bc5Q,1652391596976,1,0,"This course was the final straw for me on Coursera. I will not be continuing my subscription if this is the quality of instruction I can expect to receive, which is none. The disconnect between the lectured material and what is expected on the quizzes with no instruction in between is just mind-boggling. And to see that students have been complaining about these issues in the forums FOR YEARS and the instructors have done nothing to update or change their material has put me off entirely.",0,1,Daniel Gusmer,91933523
61438559~COURSE!~HkJsxW0yEeWEewoyD2Bc5Q,1651165969999,1,0,"T​his course is terrible. Outdated videos (recorded in 2013!), impossible quiz questions, installing huge numbers of packages into R with no real support or feedback. Terrible waste of time.",0,1,Greg York,61438559
83819720~COURSE!~HkJsxW0yEeWEewoyD2Bc5Q,1650656336810,1,0,"DON'T DO THIS COURSE!!!THIS IS A SHAME OF COURSE, A LOSS OF TIME AND MONEY. THE TEACHERS ARE NOT PRESENT IN THE FORUM, THE ASSIGMENTS ARE IN A WHOLE DIFFERENT LEVEL OF DIFFICULTY AND YOU HAVE TO SEARCH A LOT THROUGH THE INTERNET TO FIND SOLUTIONS TO EACH QUETION. THE EXAMPLES ARE TOTALLY OUTDATED AND GIVE TONS OF BUGS AND IT'S SO FRUSTRATING TO SEARCH IN PROGRAMMING FORUMS AND FIND OTHER STUDENTS WITH THE SAME QUESTIONS, BECAUSE THE MATERIAL GIVE PREHISTORICAL GUIDES. DEFINITELY A FRAUD.",0,1,Laura García Martínez,83819720
102633502~COURSE!~HkJsxW0yEeWEewoyD2Bc5Q,1647526271506,1,0,"A​wfull outdated material.
The packages mentioned do not work with the current RStudio version.
The presentation sheets are protected (all pictures) instead of extractable text.",0,0,Javier Gallardo,102633502
26577615~COURSE!~HkJsxW0yEeWEewoyD2Bc5Q,1635514636925,1,0,"C​ourse content is ok except for the week 2, quite confusing. Not very detail. Quite a few slides asking you to read up yourself from other sources.A​nd for the quizzes, mostly beyond the scope of the course. P​roject wise, coding part is fine. The part that is totally not fine is the project requires you to prepare codebook and README, without any guidance in any videos in this course, or courses prior to taking this course. All you need is to read up yourself from other sources. The community are assuming people who are taking these courses have good knowledge in programming related work.",0,0,Ryan Ng,26577615
86237227~COURSE!~HkJsxW0yEeWEewoyD2Bc5Q,1634842819003,1,0,This entire program is an atrocious waste of time and resources. Get a book on Learning R from your local library and you'll be better off. ,0,0,Brian Mcelroy,86237227
86254021~COURSE!~HkJsxW0yEeWEewoyD2Bc5Q,1623866107948,1,0,"This was, by far, one of the worst courses I've ever taken. Considering that I have three degrees and completed military PME, I've taken many. The content of the course was significantly out of date. If you're going to teach a course in computer science or on a programming language, you should be updating your lectures at least annually. The websites referenced in the lectures here were either missing or they had changed to the point that the ""examples"" that were presented were useless. That means that at best, those lectures were a waste of time. If I wanted to spend hours and hours on the web trying to figure out what you meant to do, then I could have bought a book and taught myself this material. Secondly, some languages (including R) are actively being developed; this means that because the lecture material was so dated, the methods presented were (in some cases) obsolete. From a presentation point of view, the lectures were sub-optimal because the slides themselves were just images. Having to re-type long lines of code where you can easily make ""fat finger"" mistakes isn't helpful; those slides should contain text that can be copied and pasted into either notes or into an R session. I'd also suggest a better microphone or better sound levels, but that's minor compared to the terrible content.",0,1,Anthony B Kaye,86254021
67008457~COURSE!~HkJsxW0yEeWEewoyD2Bc5Q,1620088328994,1,0,"So much of the material is out of date. As other people in the forums have mentioned, the course doesn't cover the necessary information needed to succeed and is also at a much higher level than listed (course says beginner level, but it's not). I have since switched to a different course and there are so many basic things that were explained that never were in this course. Even after taking a different intro level course, this course is still too difficult for me. This should at least be listed in the information so that people don't waste their time and money.",0,1,Ash Summers,67008457
2125901~COURSE!~HkJsxW0yEeWEewoyD2Bc5Q,1617054498380,1,0,"I did not get anything out of this course. This course was pointless because it wasn't really a course just a random scavenger hunt. If I wanted to wander around the Internet aimlessly trying to solve random problems by hacking away, I could have just done that on my own. I signed up for the class because I was looking for a structured way to learn the content and get in some exercises to practice & drill in the skills learned. This course is a waste of time -- if you are interested in learning R, go through some tutorials online. If you want to learn data science principles, try one of the other Data Science specializations. If you want to mimic this class but have more fun, pick some problems that you are interested in, find some data that could help you solve those problems, and try to clean that data.",0,2,Maria Stoica,2125901
7364827~COURSE!~HkJsxW0yEeWEewoyD2Bc5Q,1616706828738,1,0,Online course design at its worst.   ,0,1,Najib Bouhout,7364827
18013300~COURSE!~HkJsxW0yEeWEewoyD2Bc5Q,1616557475203,1,0,"It was difficult to understand and no enough exercises, in addition, the questions are very hard to answer and need a lot of digging to find the correct way to answer, personally, I am not happy with this course and not intend to continue the DS program because materials are old and not reflect the exam questions.",0,1,Mohamed Alsharkawy,18013300
8845357~COURSE!~HkJsxW0yEeWEewoyD2Bc5Q,1616021465363,1,0,"Horrible lectures which have not been updated even though the websites that are referenced may have changed and options on those websites for data required for the course  may have changed.. for example, there is no way to download as excel using ""download.file"" a file that is only available as .csv since the excel option was removed from the time these lectures were made. I finished the first 2 courses and had high expectations from this one... started off well but in the middle of week 1, we realize this can be a very frustrating experience////well, the pdfs could have been revised and updated.. but this is probably the same material from 7 years ago with the same websites references from then. Worst course I have encountered on Coursera till date. ",0,1,Yusof Ahmad,8845357
72258283~COURSE!~HkJsxW0yEeWEewoyD2Bc5Q,1612717352409,1,0,"Packages and code shown is outdated, different file formats are shown very briefly, without any attempt to communicate understanding. If I have to reproduce code that does not work and then spend hours googling solutions to problems I would not have if this course was done properly, I prefer not doing the course at all. Waste of time.",0,0,Daniel Lemmer,72258283
71633986~COURSE!~HkJsxW0yEeWEewoyD2Bc5Q,1602842830589,1,0,"almost all the videos from week 1 are outdated making it  impossible to follow the course,i will propably drop it,this is something that should be addressed by coursera.",0,0,sotiris koutsogiannis,71633986
22864444~COURSE!~HkJsxW0yEeWEewoyD2Bc5Q,1602580390245,1,0,"If you are wondering is it worth paying - the answer is ""NO"".Course is badly outdated, lectures are useless and even do not help to complete quizzes. Too much of a real life - information is old or incomplete or wrong and you need to sort out dozens of additional sources looking for an answer.  I suppose that that the reason why we want to learn before going for real tasks is that it is much more productive to go step-by-step, using reliable instruments, and proceed to troubleshooting only with the good knowledge of working solutions. This is not the case with this cource, here you need to troubleshoot from the very beginning. That is an exercise in frustration and googling, seriously.I was going to take the entire specialization, but I changed my mind and stop now.",0,1,Mariia Dronova,22864444
465062~COURSE!~HkJsxW0yEeWEewoyD2Bc5Q,1599496324101,1,0,"The instructor did not devote his time to teaching. Slides were poorly prepared. Links are not working. Although many students have raised the issues, nothing has been done for years.",0,0,Minh Vo,465062
66257656~COURSE!~HkJsxW0yEeWEewoyD2Bc5Q,1596540277412,1,0,I may not able to submit the peer graded assignment. please help me to solve this. My progress is pending because of this assignment,0,0,R.Sangeetha,66257656
61937196~COURSE!~HkJsxW0yEeWEewoyD2Bc5Q,1595446115301,1,0,This course is not for beginners. Much of the what is expected in the assessments is not covered in the lectures.,0,7,Jennifer Sargent,61937196
38537987~COURSE!~HkJsxW0yEeWEewoyD2Bc5Q,1594954740126,1,0,The course material was not of much help. Felt lost while doing the assignments.  The instructor keeps forgetting that this is a beginners level course,0,0,Jayasree Kulothungan,38537987
2669615~COURSE!~HkJsxW0yEeWEewoyD2Bc5Q,1593667478206,1,0,"I have to date completed the first  2 courses in Data Science: Foundations using R Specialization. Today I have cancelled my subscription for the following reasons:1 Poor course design and deliveryLesson contents inadequately covered and sourced, lecturers deliver a fast paced recordings with very little examples and references making it hard for beginner students to keep pace and find themselves unprepared for the required quizzes and exams.2 Course materials needs to be updated and presented to facilitate learning , eg. often times students are referred to static links and too many many times new and un-familiar concepts/ functions are rushed thru with no introduction or explanation.",0,0,Abdulaziz Mohammed A Al-Khater,2669615
25972626~COURSE!~HkJsxW0yEeWEewoyD2Bc5Q,1592409165969,1,0,"The peer grading looks weird. I got a comment on my original work ""seemed to be not written by me"".",0,0,Sreevalsan Menon,25972626
59301992~COURSE!~HkJsxW0yEeWEewoyD2Bc5Q,1591731040678,1,0,"The first two courses in this specialization were good, but the third course, Getting and Cleaning Data, was honestly very disappointing.  The lectures are extremely out of date (made in 2013, and it's already June 2020...), and a lot of the code in the lectures and examples no longer works correctly because of this.  Beyond that, the ""updates"" posted by the mentors in the discussion forums are also out of date (2016) and have limited usefulness.  This is a course that is meant to teach you how to acquire and clean data in the R program, and methods and technology from 7 years ago are not the standard that I expected - technology constantly changes and updates, and this course should reflect that (but clearly doesn't).",0,1,Lindsay Elizabeth Martin,59301992
45241962~COURSE!~HkJsxW0yEeWEewoyD2Bc5Q,1586453526780,1,0,"Not helpful, can barely hear lectures, and lectures are outdated. I can't stand this course.",0,7,Autumn Conner,45241962
50037677~COURSE!~HkJsxW0yEeWEewoyD2Bc5Q,1585582784201,1,0,"Its extremely difficult to install the packages. Most of the time the instructions are not clear on what packages to intall in the videos. There should be a pre-read with links and instructions on which packages are needed to be able to work on this course. Extremely frustrating, considering a majority of the time is wasted just trying to figure out how to install packages. If you are serious about success of course takers, you have to make it easier to understand and instructions have to be clear.",0,0,Apurva Gupta,50037677
37659445~COURSE!~HkJsxW0yEeWEewoyD2Bc5Q,1584955041794,1,0,There is a big gap between class material and practical exercises.,0,7,Viktor Kusnezh,37659445
10331588~COURSE!~HkJsxW0yEeWEewoyD2Bc5Q,1573267918632,1,0,"No idea what they want for the project and the discussion forum is clogged with people asking for peer reviews. The previous courses at least provided you with a understanding of what the final product should be, in this case it's make tidy data, but with no idea on how that data should look.",0,1,Christian Beisel,10331588
18423394~COURSE!~HkJsxW0yEeWEewoyD2Bc5Q,1567067056406,1,0,"the learning way in this course was bad, to me",0,0,Ahmed Hisham Elsayed,18423394
37333170~COURSE!~HkJsxW0yEeWEewoyD2Bc5Q,1550369297358,1,0,"Swirl practice in for Getting and Cleaning Data in this class is terrible. Most of my code working fine in R and R studio but Swirl would tell me ""That's not the answer I'm looking for, try again"" Then I type ""skip()"" Swirl will give me the exact answers that I just typed earlier.",0,18,THI A ALLGOOD,37333170
35680923~COURSE!~HkJsxW0yEeWEewoyD2Bc5Q,1549052643564,1,0,"There is a huge disconnect with the material and the HAR dataset exercise. I would suggest that there is some help with smaller exercises to help explain how to complete it. Yes, I know you're supposed to do research to help figure out problems, and I have. As a matter of fact, I have taken other courses on data wrangling to be able to figure out this problem. Merging two datasets makes this problem very confusing. Why can't you help guide students through a similar problem, instead of throwing to the fire?",0,47,T M,35680923
38558826~COURSE!~HkJsxW0yEeWEewoyD2Bc5Q,1547091285693,1,0,It is more about R rather than data science ,0,0,BabaK Kobari,38558826
32056485~COURSE!~HkJsxW0yEeWEewoyD2Bc5Q,1543518516817,1,0,Horrible Assignment. So vague. So much puzzling to do. Students cannot waste their time in attempting to understand the loose vague assignment that was made. ASsignment took me 4-5 hrs of pondering and referrinf to online material just to freaking understand partially what the hell is expected of me to do. I hate this part of CoursERA IT is ugly!,0,21,Thej,32056485
7366504~COURSE!~HkJsxW0yEeWEewoyD2Bc5Q,1542500830114,1,0,Unprofessional.,0,7,Javier R Lores Gil,7366504
30855512~COURSE!~HkJsxW0yEeWEewoyD2Bc5Q,1541399208997,1,0,I don't think it's necessary lecture,0,0,JaeHyun Lee,30855512
35536585~COURSE!~HkJsxW0yEeWEewoyD2Bc5Q,1534676114830,1,0,"This was a mix of everything course, nothing was completely explained. It would have been a better idea to just pick a limited options and cover them well. The description of the  final project was a puzzle and the objective behind it was completely vague. I wanted to quit in the middle, but I put time and that is why I finished it!!!",0,0,Pooia Lalbakhsh,35536585
14518468~COURSE!~HkJsxW0yEeWEewoyD2Bc5Q,1533553761307,1,0,"MUito rápido o conteúdo e o fato do suporte ser somente o fórum deixa o curso vago, achei muito fraco os slides e o método de ensino. Poderiam focar mais em exercícios e nos comandos mais difíceis, pois quando chega nos assignments fiquei perdido por não ter conseguido realizar da forma esperada.",0,0,Diogo Miyake,14518468
33007169~COURSE!~HkJsxW0yEeWEewoyD2Bc5Q,1531859407996,1,0,"Prepare to not actually learn anything, rather you're going to go on a journey through google to try and find obscure ways to install packages onto your Windows computer.  Whether it be packages to read Excel files, SQL files, API's and more, you'll rarely have the time or patience to put any of this to practice because you'll struggle to just get packages installed.For the record, I gave the previous two courses in the specialty a good rating, but this is clearly a low effort showing.  It's a shame because I really think this might be the most applicable and useful content in the course.",0,37,Matt Kerns,33007169
14605240~COURSE!~HkJsxW0yEeWEewoyD2Bc5Q,1523556051493,1,0,Terrible! Go to Data Camp and save a bunch of money!!!!,0,0,Ian Heath,14605240
13471591~COURSE!~HkJsxW0yEeWEewoyD2Bc5Q,1518985642504,1,0,First quiz states 10 minutes for a 5 question quiz. I am taking way longer due to errors in loading packages and Java. One of the question is out of date and has not been updated in a year. Quality of this course is lacking when changes are constant. The mentors say it's realistic. I'd considering dropping this course and search for a better updated one. ,0,0,Quoc Nguyen,13471591
25414132~COURSE!~HkJsxW0yEeWEewoyD2Bc5Q,1516634888485,1,0,"Made it all the way to week four and decided to drop this entire specialization. The data set in the final project is poorly referenced (despite the code book provided). The data set comes in 24 text files you have to merge (which isn't a problem in R) but what is a problem is when you don't understand what the variables and observations are. Perhaps if I worked in the medical field these measurements would mean more, but to a business major, they are incomprehensible with the limited documentation provided. So my assumption was, if I am having difficulty understanding what the final data structure should look like, others will be having the same problem......and its peer reviewed. How can I possible grade someone else",0,0,Grant Isaacs,25414132
25907597~COURSE!~HkJsxW0yEeWEewoyD2Bc5Q,1516158765173,1,0,"This course is about getting data from the web and processing it using a computer language and packages in that language that are under active development. There is a github repo with course content and other electronic resources that are made to be easy to update. It has never been updated, even once since the course first went live 4 years ago. There are many broken links, several new features and bugs in packages that make lecture content obsolete or broken, errors found by students, etc. None of these issues have been addressed, even once, in any of the material, including the extremely easy to update content on github. This is disappointing and not very professional. Additionally, many of the notes are not particularly good to begin with. Much of it is essentially cribbed from other online tutorials, examples in the documentation, and in a few cases, someone else's  (also broken) lectures. Take this course if you want a study group (the forums are actually quite useful) to help you go through 4 year old lectures rehashing online tutorials from 4 years ago about a topic that changes pretty quickly. ",0,0,Dan Hall,25907597
26422456~COURSE!~HkJsxW0yEeWEewoyD2Bc5Q,1515954411401,1,0,"Expected more explanation with the teaching part, detailed lecture depicting live examples is needed to explain each and every module of the course. similar examples like Assignments can be taught by hard-coding them with RStudio hoping that these things can change with the next courses which  I'm enrolling ",0,0,Shanmuga Prakash,26422456
6310571~COURSE!~HkJsxW0yEeWEewoyD2Bc5Q,1508971286347,1,0,Very scattered and unfocused course. Sad to say that I learned very little from this one.,0,0,Josh Hilton,6310571
4692542~COURSE!~HkJsxW0yEeWEewoyD2Bc5Q,1504101637052,1,0,Poor teaching! Almost a waste of time.,0,0,Du Zhihong,4692542
5711527~COURSE!~HkJsxW0yEeWEewoyD2Bc5Q,1500571502500,1,0,all the practical things had to be learned by self learning instead of in the course. Peer graded assignment took for ever to pass,0,0,Alexander Timen,5711527
26414366~COURSE!~HkJsxW0yEeWEewoyD2Bc5Q,1499376369368,1,0,"Why are people writing extensive blog posts contemplating the vague wording of the final assignment when you could just *fix the assignment*?  Also, one of the worst explanations of regular expressions I've ever heard.",0,0,Jeffrey Grady,26414366
3229617~COURSE!~HkJsxW0yEeWEewoyD2Bc5Q,1496859083447,1,0,"final project is terribly defined.  Lecturers, Coursera, and Johns Hopkins should all be ashamed.",0,0,Tom,3229617
15233792~COURSE!~HkJsxW0yEeWEewoyD2Bc5Q,1493700432137,1,0,Doesn't worth the effort. You learn the most by searching online tools each time you encounter a problem while solving a quiz problem or following the steps the instructor did.,0,0,Arif Volkan Vural,15233792
1375541~COURSE!~HkJsxW0yEeWEewoyD2Bc5Q,1484361874803,1,0,"For such a terrible course to then change payment terms without my authorisation. Take $64 from my account without telling me clearly amongst all the other junk mail. Coursera have a lot to answer for, and this specialisation is not even worth wasting your time if it was free.Taught without purpose; meaningless instructions given to copy without regard of the bigger picture.",0,0,Deleted Account,1375541
18646178~COURSE!~HkJsxW0yEeWEewoyD2Bc5Q,1481619539192,1,0,lectures are too fast.dropping out.,0,0,Ankit Agarwal,18646178
19161878~COURSE!~HkJsxW0yEeWEewoyD2Bc5Q,1477736520238,1,0,"Basically impossible to complete quizzes and course project using the provided course material. Poor correlation between instruction and testing. Makes one wonder: If I need to solicit others' guidance to complete your tests, why am I paying for your guidance in the first place?",0,0,Michael OBrien,19161878
21613431~COURSE!~HkJsxW0yEeWEewoyD2Bc5Q,1476678166308,1,0,"Lectures and other material just don't cover the information needed in the course project. Majority of the learning has to be done outside of this course, in order to pass the course project.I cannot recommend this course anyone who is not deeply familiar with the topic already. The course project is truly frustrating!",0,0,Antti Suanto,21613431
18739479~COURSE!~HkJsxW0yEeWEewoyD2Bc5Q,1470389688847,1,0,Poorly constracted course!,0,0,Alexandros Theocharous,18739479
