id,reviewedAt,rating,isMarkedHelpful,reviewText,productCompleted,mostHelpfulVoteCount,users,user_id
40001104~COURSE!~HkJsxW0yEeWEewoyD2Bc5Q,1560371935058,5,0,Excellent course.  I've already used some of the techniques learned here.  It's very applicable to those in o,0,0,William Brent Bruffett,40001104
7384643~COURSE!~HkJsxW0yEeWEewoyD2Bc5Q,1560351118177,5,0,Supperb. Exactly what I needed.,0,0,Alex Borges,7384643
30597774~COURSE!~HkJsxW0yEeWEewoyD2Bc5Q,1560350108717,5,0,Nice course to understand the deep insight in understanding the concept of the data cleaning in R. ,0,0,Rohit Anand,30597774
10361128~COURSE!~HkJsxW0yEeWEewoyD2Bc5Q,1560177612063,5,0,Good to play with R for making tidy data.  ,0,0,Robert Jeenchen Chen,10361128
21594153~COURSE!~HkJsxW0yEeWEewoyD2Bc5Q,1559569424120,5,0,Very useful for every day data arrangements and data downloads from Internet.,0,0,Diego Angulo Q,21594153
37892520~COURSE!~HkJsxW0yEeWEewoyD2Bc5Q,1559130280652,5,0,the project is good!,0,0,燕欣,37892520
2213583~COURSE!~HkJsxW0yEeWEewoyD2Bc5Q,1558773933798,5,0,The assignment was quite challenging bu the course overall was very good. The course was structured very well. ,0,0,Amy Binny Philip,2213583
32304535~COURSE!~HkJsxW0yEeWEewoyD2Bc5Q,1558689489213,5,0,"A bit tough course with topics of getting the data since I don't know much about file types, but cleaning part is a must do for every data scientist. dplyr and tidyverse is the base of R and nowadays I only use dplyr for my data wrangling. Highly recommendable course and specialization.",0,0,Nino Požar,32304535
33158742~COURSE!~HkJsxW0yEeWEewoyD2Bc5Q,1558548559670,5,0,"I really liked this course and believe that my work, although seemingly noob-ish, will get much better as I see others works from the peer review and examples noted in the lessons.",0,0,Kelly Schumann,33158742
37139640~COURSE!~HkJsxW0yEeWEewoyD2Bc5Q,1558128408072,5,0,This course was very helpful and easy to follow.,0,0,Marina Kingsbury,37139640
39965344~COURSE!~HkJsxW0yEeWEewoyD2Bc5Q,1558009502705,5,0,C,0,0,Ловягина Юлия Алексеевна,39965344
18031991~COURSE!~HkJsxW0yEeWEewoyD2Bc5Q,1556863299174,5,0,Coursera gives me the flexibility I need to take courses on my own time ,0,0,Bushra Waheed,18031991
37088954~COURSE!~HkJsxW0yEeWEewoyD2Bc5Q,1555903509069,5,0,good,0,0,Santi Mailoungkard,37088954
40912473~COURSE!~HkJsxW0yEeWEewoyD2Bc5Q,1555882553120,5,0,"I wholeheartedly enjoyed this course. It goes from very simple, to pretty advanced stuff at the end. ",0,0,Muhammet Agar,40912473
39638656~COURSE!~HkJsxW0yEeWEewoyD2Bc5Q,1555357764428,5,0,"Forums! Use the forums. Read them before you start the week's lectures because they often include pinned topics that correct minor errors like broken links and outdated commands, as well as interesting and thoughtful supplementary material. Overall this was a very enjoyable course, Dr. Leek's lectures are straightforward and full of useful examples. I learned about just some of the power of ""The Tidyverse"" through this course and I'm very grateful for that. ",0,0,Joe DiNoto,39638656
39578352~COURSE!~HkJsxW0yEeWEewoyD2Bc5Q,1555070616171,5,0,Great course and easy to understand for a beginner. ,0,0,Akansha Kapoor,39578352
26200853~COURSE!~HkJsxW0yEeWEewoyD2Bc5Q,1554899687999,5,0,Really constructive and nice course,0,0,Diego Berriel,26200853
35764651~COURSE!~HkJsxW0yEeWEewoyD2Bc5Q,1554835594519,5,0,"Muy interesante, bastante información y todo muy bien explicado",0,0,María Andreina Da Silva Cabral,35764651
2900360~COURSE!~HkJsxW0yEeWEewoyD2Bc5Q,1554587514672,5,0,Great Course for you to learn in more detail how data processing works in Data Science.  ,0,0,Patrícia Alves Fernandes,2900360
10866062~COURSE!~HkJsxW0yEeWEewoyD2Bc5Q,1554129308631,5,0,This course is one important step towards becoming a Data Scientist.,0,0,Atman Brahmachari,10866062
39470644~COURSE!~HkJsxW0yEeWEewoyD2Bc5Q,1552691565210,5,0,Excellent course,0,0,Rodrigo Olivares,39470644
8571700~COURSE!~HkJsxW0yEeWEewoyD2Bc5Q,1551898137692,5,0,A very practical and useful course!,0,0,Greg Verissimo,8571700
38382450~COURSE!~HkJsxW0yEeWEewoyD2Bc5Q,1551713526919,5,0,Very good course.  Dr. Peng did a nice job of presenting the material.  The projects and quizzes were challenging as well as educational.,0,0,Glenn Walters,38382450
38792254~COURSE!~HkJsxW0yEeWEewoyD2Bc5Q,1551317821565,5,0,Excellent course on using R for getting and cleaning data.,0,0,Andrew,38792254
28806948~COURSE!~HkJsxW0yEeWEewoyD2Bc5Q,1551103306535,5,0,Nice course.,0,0,Tushar Mishra,28806948
11021455~COURSE!~HkJsxW0yEeWEewoyD2Bc5Q,1551049236565,5,0,"This course is a nice introduction to the complex process of getting and cleaning data in R.  It introduces you to some fundamental tools in the area, such as the dplyr and tidyr packages, and touches upon the most important aspects of data gathering and transforming.  The final project is an interesting mix of technical challenges with a touch of intelligent practices in data handling and sharing. Whatever your level in R programming and data science, this course is an enjoyable hands-on experience. ",0,2,Nelson Muriel,11021455
5055452~COURSE!~HkJsxW0yEeWEewoyD2Bc5Q,1550708080595,5,0,The course material is helpful enough to deploy skills in my research,0,0,jagadeesh puvvula,5055452
30438706~COURSE!~HkJsxW0yEeWEewoyD2Bc5Q,1550516185538,5,0,thanks,0,0,sirajsebhatu@gmail.com sebhatu,30438706
32077454~COURSE!~HkJsxW0yEeWEewoyD2Bc5Q,1550393955598,5,0,Great learning! Thank you.,0,0,Jagat Ram Semwal,32077454
38603514~COURSE!~HkJsxW0yEeWEewoyD2Bc5Q,1550077064139,5,0,"Useful general course on tidying data and learning to import into R from various sources. Doesn't get into sequencing data import, but looks at other common ones",0,0,Nimalka Weerasuriya,38603514
37758712~COURSE!~HkJsxW0yEeWEewoyD2Bc5Q,1549710561875,5,0,A very Important course for working with R and data science in general.,0,0,Hathairat Wittayapusagul,37758712
7073747~COURSE!~HkJsxW0yEeWEewoyD2Bc5Q,1549338963211,5,0,"Better than R Programming. Still very hard, but worthwhile.",0,0,David Searl,7073747
30094536~COURSE!~HkJsxW0yEeWEewoyD2Bc5Q,1549332021246,5,0,Fantastic course!,0,0,Parker Oakes,30094536
26671665~COURSE!~HkJsxW0yEeWEewoyD2Bc5Q,1548844147678,5,0,"Just Amazing, one should take this course for betterment",0,0,Aman Ullah,26671665
34778204~COURSE!~HkJsxW0yEeWEewoyD2Bc5Q,1548759700439,5,0,this course is a hands of this specialization in R.this hands use to play with a raw and tidy data in R.,0,0,Jigar Panchal,34778204
38050324~COURSE!~HkJsxW0yEeWEewoyD2Bc5Q,1548693415484,5,0,"More challenging than the ""R Programming"" course.  The instructions for the final project were a little vague, but I think maybe this was intentional to promote discussion.  Definitely give yourself plenty of time to complete the final project if you take this course.  The principles of a tidy data set might seem like common sense, but in practice it's more challenging than you might think.  I highly recommend taking this course even if you think you know what a tidy data set is.",0,2,Kris Barrett,38050324
38172666~COURSE!~HkJsxW0yEeWEewoyD2Bc5Q,1548454237302,5,0,Great course. I really enjoyed it!,0,0,Klever Mera,38172666
37615058~COURSE!~HkJsxW0yEeWEewoyD2Bc5Q,1548431005837,5,0,I learned so much in this course!,0,0,Cynthia Mcgowan Poole,37615058
8073069~COURSE!~HkJsxW0yEeWEewoyD2Bc5Q,1548045867197,5,0,Love quizzes and a course project. Working on them develops you as a data scientist,0,0,Abay Jumabayev,8073069
7842119~COURSE!~HkJsxW0yEeWEewoyD2Bc5Q,1547800840203,5,0,"Useful, the course is as much an introduction to R- part 2 as about cleaning data",0,0,Thor Russell,7842119
32914692~COURSE!~HkJsxW0yEeWEewoyD2Bc5Q,1547750672533,5,0,  EXCELENTE!!!  ,0,0,gerson de oliveira,32914692
24385661~COURSE!~HkJsxW0yEeWEewoyD2Bc5Q,1546981084115,5,0,"I think this course is really good, the instructors give you a lot of tools to handle data bases! I would recomend this course to any person that wants to learn about this.",0,0,Luis Eduardo Barajas Prieto,24385661
17365402~COURSE!~HkJsxW0yEeWEewoyD2Bc5Q,1546965766178,5,0,"The class was very interesting and useful, although I would have liked more opportunities to do web scraping  in the problem sets.",0,0,Andrew Chastain,17365402
303728~COURSE!~HkJsxW0yEeWEewoyD2Bc5Q,1546835903761,5,0,I liked the course project!,0,0,Farah Nazifa,303728
1260749~COURSE!~HkJsxW0yEeWEewoyD2Bc5Q,1546757026076,5,0,"Great course with detailed exercise about what's most important task in Data Science, ""Cleaning Data""",0,0,Enlik,1260749
37353585~COURSE!~HkJsxW0yEeWEewoyD2Bc5Q,1546406028135,5,0,It was pretty hard for someone like me who has a weakness in programming but it provided sufficient exposure and tasks for me to learn within my capabilities. I did enjoy its challenges. ,0,0,Anna Melissa  D. Comendador,37353585
35835430~COURSE!~HkJsxW0yEeWEewoyD2Bc5Q,1546266118688,5,0,"The course project was really helpfull in understanding how the data is presented to datascientists. Now to get the jist of the data we have to go through assembling, cleaning and cutting the data.. It was a challenged to understand the data.. assembling the data was a lot of fun in R..",0,0,Sudheergouda Patil,35835430
29957974~COURSE!~HkJsxW0yEeWEewoyD2Bc5Q,1546182440580,5,0,This course is great.   The tactical skills in R you really need on the job.  ,0,0,Scott Dayer,29957974
37314380~COURSE!~HkJsxW0yEeWEewoyD2Bc5Q,1546006853487,5,0,Very challenging but very fulfilling when completed,0,0,Justin Angelo Bantang,37314380
6954503~COURSE!~HkJsxW0yEeWEewoyD2Bc5Q,1545967807707,5,0,Thanks!!! It opened a whole new world to me!,0,0,Janet Aguayo Reyes,6954503
28777755~COURSE!~HkJsxW0yEeWEewoyD2Bc5Q,1544116026128,5,0,It is great time. The course content was amazing. I learnt lot of new things.,0,0,Siva Mani,28777755
37203102~COURSE!~HkJsxW0yEeWEewoyD2Bc5Q,1543880715439,5,0,Really helpful course,0,0,Johannes Kirchner,37203102
23285308~COURSE!~HkJsxW0yEeWEewoyD2Bc5Q,1543416095820,5,0,"This course was very good, I learned a lot of useful things about R and how processed data should look.",0,0,Francisco Miguel Rivas Ortega,23285308
15221836~COURSE!~HkJsxW0yEeWEewoyD2Bc5Q,1543092413802,5,0,greaat,0,0,Lisa Noor Arida,15221836
30080411~COURSE!~HkJsxW0yEeWEewoyD2Bc5Q,1542741106733,5,0,A must take course for data science carrer... Very good concept explaination with really good hands on with Swirl.,0,0,Vipin Jose,30080411
1777985~COURSE!~HkJsxW0yEeWEewoyD2Bc5Q,1542500225869,5,0,It was really a good course. ,0,0,Vibhutesh Kumar Singh,1777985
24917635~COURSE!~HkJsxW0yEeWEewoyD2Bc5Q,1542259545132,5,0,Fun course!,0,0,Koen Vermeulen,24917635
25763264~COURSE!~HkJsxW0yEeWEewoyD2Bc5Q,1542239454752,5,0,Fantastic course. Highly recommended,0,0,Silas Santana,25763264
6982419~COURSE!~HkJsxW0yEeWEewoyD2Bc5Q,1542007872690,5,0,Excellent course!,0,0,Anitha Guruprasad,6982419
13336597~COURSE!~HkJsxW0yEeWEewoyD2Bc5Q,1541679790476,5,0,"This course was very intense and not easy but over all, after doing all the work! Oh man I feel I have way more confidence in my R skills and Data understanding. ",0,0,Ayas Shaqour,13336597
18864022~COURSE!~HkJsxW0yEeWEewoyD2Bc5Q,1541455545103,5,0,The course has amazing exercise in every week. You can learn a lot with them.,0,0,Joseph Gonzalez Nowak,18864022
35340726~COURSE!~HkJsxW0yEeWEewoyD2Bc5Q,1541397273685,5,0,Very nice presentation of concepts,0,0,Raghu Parasuram Macharoutu,35340726
9856750~COURSE!~HkJsxW0yEeWEewoyD2Bc5Q,1540323247384,5,0,Excellent knowledge and instructor,0,0,Gustavo Castilhos Garcia,9856750
32927916~COURSE!~HkJsxW0yEeWEewoyD2Bc5Q,1540176950868,5,0,Very helpful,0,0,Razib Ahamed Khan,32927916
28318263~COURSE!~HkJsxW0yEeWEewoyD2Bc5Q,1539933369811,5,0,"The journey through the entire course was quite exceptional for me. It was great to hone the skills of programming and especially in this digital world where data is key for every analysis, inference, prediction and  what not! When everyone looks at neat and tidy data that one can rely on, it is extremely important to understand and know the finer nuances of what it takes to get a nice and efficient dataset and that is the essence of this course. ",0,0,Chetan Thaker,28318263
27591223~COURSE!~HkJsxW0yEeWEewoyD2Bc5Q,1539503052614,5,0,Great course with great materials. Easy to understand and to learn.,0,0,Bojan Brajkovic,27591223
18612946~COURSE!~HkJsxW0yEeWEewoyD2Bc5Q,1539304759655,5,0,good,0,0,Sangdon Choi,18612946
36490735~COURSE!~HkJsxW0yEeWEewoyD2Bc5Q,1539281531568,5,0,Very useful content and challenging assignments,0,0,Royce Sin,36490735
34675231~COURSE!~HkJsxW0yEeWEewoyD2Bc5Q,1538977181734,5,0,This is a very good course describing basic data ext,0,0,Avizit Chandra Adhikary,34675231
7890191~COURSE!~HkJsxW0yEeWEewoyD2Bc5Q,1538714262901,5,0,excellent course to get started with to learn the basic concepts of data tidying.,0,0,Raunak Shakya,7890191
16038742~COURSE!~HkJsxW0yEeWEewoyD2Bc5Q,1538406970676,5,0,This course gives a great insight on how capable and versatile R language.,0,0,Mahmoud Elshiekh,16038742
3529947~COURSE!~HkJsxW0yEeWEewoyD2Bc5Q,1538361743630,5,0,This course taught me the importance of tidying data suitable for analysis. ,0,0,Jesson Pagaduan,3529947
29671803~COURSE!~HkJsxW0yEeWEewoyD2Bc5Q,1538102190338,5,0,Excellent course with some great exercises put together that are very practical.,0,0,Premkumar Siddharth,29671803
23016116~COURSE!~HkJsxW0yEeWEewoyD2Bc5Q,1538033448690,5,0,Helped a lot form my understanding of a good workflow for data collection and processing.,0,0,Сетдеков Кирилл Раильевич,23016116
3554322~COURSE!~HkJsxW0yEeWEewoyD2Bc5Q,1537790721948,5,0,The most crucial part of statistical inference or machine learning is tidy data and this course provides the basic tidy data rules!,0,0,George Papadopoulos,3554322
10724905~COURSE!~HkJsxW0yEeWEewoyD2Bc5Q,1537669982175,5,0,Great project course challenge,0,0,Mohd Irwan Sophan,10724905
18938623~COURSE!~HkJsxW0yEeWEewoyD2Bc5Q,1537647990785,5,0,How to get a clean the data is a very important knowledge for the future data scientist and data analyst. For me this course was very important I very recommend take this course.,0,0,John Bedoya,18938623
3741713~COURSE!~HkJsxW0yEeWEewoyD2Bc5Q,1537032462718,5,0,good,0,0,Anup Kumar Mishra,3741713
35358817~COURSE!~HkJsxW0yEeWEewoyD2Bc5Q,1536156921338,5,0,lovein' it!,0,0,LIWANGZHI,35358817
33409477~COURSE!~HkJsxW0yEeWEewoyD2Bc5Q,1536111327416,5,0,Nice Course.,0,0,Ganesh Rajasekaran,33409477
33340248~COURSE!~HkJsxW0yEeWEewoyD2Bc5Q,1535961056834,5,0,Great course covering a wide range of data types likely to be encountered in the field of data science. Well explained. ,0,0,David Robinson,33340248
12951088~COURSE!~HkJsxW0yEeWEewoyD2Bc5Q,1535899211107,5,0,Good course!,0,0,César Sotres,12951088
21352124~COURSE!~HkJsxW0yEeWEewoyD2Bc5Q,1535534682440,5,0,I learned so much! Great course.,0,0,Olga Sholderer,21352124
27078269~COURSE!~HkJsxW0yEeWEewoyD2Bc5Q,1535519271771,5,0,I really liked this course. This course helped me to understand the data wrangling. ,0,0,Ajendra Sharma,27078269
34875619~COURSE!~HkJsxW0yEeWEewoyD2Bc5Q,1535269801951,5,0,its the best course for the data science students and it will help all the student who are going to join or who want to start their career in data science.,0,0,Savitri,34875619
26555899~COURSE!~HkJsxW0yEeWEewoyD2Bc5Q,1534628129753,5,0,good course.,0,0,shashwat khare,26555899
32307153~COURSE!~HkJsxW0yEeWEewoyD2Bc5Q,1534499987183,5,0,Nice course,0,0,Dan Berdikulov,32307153
238638~COURSE!~HkJsxW0yEeWEewoyD2Bc5Q,1534484675274,5,0,All Ok,0,0,Alexander Omelanuk,238638
18757049~COURSE!~HkJsxW0yEeWEewoyD2Bc5Q,1534219218847,5,0,Good course and pace,0,0,Anand Sharma,18757049
18517651~COURSE!~HkJsxW0yEeWEewoyD2Bc5Q,1533672494740,5,0,It was really an enriching course. I learnt a lot about the raw data formats and tools and techniques to get the best out of that raw data. Highly recommended,0,0,Yash Gupta,18517651
418637~COURSE!~HkJsxW0yEeWEewoyD2Bc5Q,1533585591164,5,0,Great course teaches intermediate and andvanced skills to manipullate and clean data. Begginers should make an extra effort ,0,0,Sebastian Ospina Valencia,418637
30248719~COURSE!~HkJsxW0yEeWEewoyD2Bc5Q,1533027772895,5,0,Thanks for the excellent course,0,0,Bora Aslan,30248719
34973045~COURSE!~HkJsxW0yEeWEewoyD2Bc5Q,1533014161319,5,0,Great lecture and help understanding concepts throughout the lecture,0,0,Ji Hoon Woo,34973045
4613398~COURSE!~HkJsxW0yEeWEewoyD2Bc5Q,1532562887465,5,0,Good one for beginners,0,0,swethakn,4613398
33752654~COURSE!~HkJsxW0yEeWEewoyD2Bc5Q,1532288421341,5,0,"This course was very useful, informative and interesting.  However, I did feel that the course assignment seems to be, perhaps purposefully, but a bit unnecessarily vague.",0,0,Satish V,33752654
30918748~COURSE!~HkJsxW0yEeWEewoyD2Bc5Q,1531764941883,5,0,Exellent,0,0,Shahnawaz Hussain,30918748
15668125~COURSE!~HkJsxW0yEeWEewoyD2Bc5Q,1531141392850,5,0,"Excellent survey of data cleaning methods, good grounding in tidyverse tools, builds nicely on previous 2 courses.",0,0,Philip Stablein,15668125
32672295~COURSE!~HkJsxW0yEeWEewoyD2Bc5Q,1530917848530,5,0,Excellent once again. I'm running out of superlatives. Great job Coursera.,0,0,Jamie McLaughlin,32672295
30164623~COURSE!~HkJsxW0yEeWEewoyD2Bc5Q,1530863355965,5,0,"good. however, volume of the video is very low, not audible without external speakers on some PCs. request to improvise. spoken language is also very fast.",0,0,Rizwan Mohamed,30164623
32565238~COURSE!~HkJsxW0yEeWEewoyD2Bc5Q,1530529097317,5,0,"Very nice course, and clear how to do it. I like it very much!",0,0,Ellen Bayens,32565238
27515159~COURSE!~HkJsxW0yEeWEewoyD2Bc5Q,1530446068985,5,0,Valuable Course !,0,0,"T, Karthik",27515159
14262945~COURSE!~HkJsxW0yEeWEewoyD2Bc5Q,1530257514862,5,0,"The course is very helpful when it comes to exploring commonly used R packages and learning certain best practices involved in data cleaning. I'd definitely recommend it to any data science enthusiasts. One area with slight scope for improvement could be the final project. The instructions are quite open to interpretation, which means that the final grade which you get via peer review is always going to be debatable. Other than that, I have no complaints whatsoever :)",0,1,Narin Pratap Dhatwalia,14262945
11707386~COURSE!~HkJsxW0yEeWEewoyD2Bc5Q,1530060770552,5,0,"This course was challenging, interesting and essential.",0,0,Dale Ossip Johnson,11707386
3207183~COURSE!~HkJsxW0yEeWEewoyD2Bc5Q,1530045779303,5,0,Lot of useful information.,0,0,carl wilburn,3207183
33264182~COURSE!~HkJsxW0yEeWEewoyD2Bc5Q,1529745680029,5,0,I started with this course to understand the logic of ordering of the series.,0,0,Raphael Poli,33264182
20038781~COURSE!~HkJsxW0yEeWEewoyD2Bc5Q,1529720006488,5,0,A great course and you learn exactly what the title says . I found it fun to work on It,0,0,reem zurnaji,20038781
32111707~COURSE!~HkJsxW0yEeWEewoyD2Bc5Q,1529602000388,5,0,I loved it.,0,0,Sherifat Akintunde-Shitu,32111707
9348459~COURSE!~HkJsxW0yEeWEewoyD2Bc5Q,1529192221932,5,0,A very nice course!,0,0,Milton Arica Andrade,9348459
32874909~COURSE!~HkJsxW0yEeWEewoyD2Bc5Q,1529184490324,5,0,"Excellent course, and quizzes and lecture were very teaching. But some materials needs to be updated up to date , like subsetting columns in data.table the slides were absolute.",0,0,Mohammad Abuarar,32874909
28824357~COURSE!~HkJsxW0yEeWEewoyD2Bc5Q,1528994140537,5,0,Great experience..,0,0,akshay dalal,28824357
27703666~COURSE!~HkJsxW0yEeWEewoyD2Bc5Q,1528434293123,5,0,needs improvement and upgradation,0,0,Rajat Vimal,27703666
790031~COURSE!~HkJsxW0yEeWEewoyD2Bc5Q,1528303599770,5,0,"was a hard module for whose isn't a programmer, but was well done structureted to easy learning with hard studying",0,0,Matheus Lazzari Nicola,790031
14462256~COURSE!~HkJsxW0yEeWEewoyD2Bc5Q,1528286917535,5,0,  Very Good Course  ,0,0,Joseph Mathew Padannamackal,14462256
23542834~COURSE!~HkJsxW0yEeWEewoyD2Bc5Q,1527546208180,5,0,Excellent course! ,0,0,Deleted Account,23542834
1096991~COURSE!~HkJsxW0yEeWEewoyD2Bc5Q,1526738666677,5,0,Great Course,0,0,P Ramya Sree,1096991
14901553~COURSE!~HkJsxW0yEeWEewoyD2Bc5Q,1526492732179,5,0,great job!,0,0,Wentao Hu,14901553
27940477~COURSE!~HkJsxW0yEeWEewoyD2Bc5Q,1526491464083,5,0,Good Course. It gives an idea on how to prepare tidy data set.,0,0,Sanjay Lonkar,27940477
1477976~COURSE!~HkJsxW0yEeWEewoyD2Bc5Q,1526330062711,5,0,"Loved the structure of the course. Learned a lot. The course project seemed a little funky , especially creating the codebook for an already existing set of data but was a useful teaching aid.",0,3,Asit Rairkar,1477976
2784089~COURSE!~HkJsxW0yEeWEewoyD2Bc5Q,1525989837411,5,0,"Not the most exciting course but has been so, so useful.",0,0,Ben Hicks,2784089
27243339~COURSE!~HkJsxW0yEeWEewoyD2Bc5Q,1525682731945,5,0,It was challanging and informative.,0,0,Bilinclizihin,27243339
27892713~COURSE!~HkJsxW0yEeWEewoyD2Bc5Q,1525142450546,5,0,Good course,0,0,Ganapathi Nayak K,27892713
21492894~COURSE!~HkJsxW0yEeWEewoyD2Bc5Q,1524913803705,5,0,"Excellent course to learn about data pre-processing techniques and data science. Really helpful, if you wish to become a data scientist.",0,0,Gowtham Behara,21492894
31062929~COURSE!~HkJsxW0yEeWEewoyD2Bc5Q,1524515757052,5,0,Perfect,0,0,CABIOCH Nicolas,31062929
24719929~COURSE!~HkJsxW0yEeWEewoyD2Bc5Q,1524487285120,5,0,Very  useful class for someone like me who be a beginner of data science,0,0,陈颐欢,24719929
30445738~COURSE!~HkJsxW0yEeWEewoyD2Bc5Q,1524083353650,5,0,"Many tricks and tips tools, many good functions. its really way completing my need on R at initial level i needed. ",0,0,ayush jha,30445738
30692326~COURSE!~HkJsxW0yEeWEewoyD2Bc5Q,1523762868121,5,0,"Very good course and lectures. However, it would be good to have a book covering all of the material in this course. That would make work on final project much easier. In my opinion, it is impossible to finish final project in just 2 hours. ",0,0,Oleksandr Kuznetsov,30692326
29448067~COURSE!~HkJsxW0yEeWEewoyD2Bc5Q,1523502503265,5,0,A little bit hard for newbie,0,0,卢君,29448067
10440442~COURSE!~HkJsxW0yEeWEewoyD2Bc5Q,1522733281824,5,0,Very useful course on how to prepare data so it can more easily be analyzed.,0,0,Jessica Roland,10440442
169329~COURSE!~HkJsxW0yEeWEewoyD2Bc5Q,1522440283495,5,0,Great!!!,0,0,Olawunmi George,169329
31616268~COURSE!~HkJsxW0yEeWEewoyD2Bc5Q,1522303215646,5,0,This is a major basic skill to be acquired. The course does great job at introducing various methods and makes us practice with the quizzes and assignments.,0,0,Bhargava Bokka,31616268
13696467~COURSE!~HkJsxW0yEeWEewoyD2Bc5Q,1522264940625,5,0,Very simple and introductory course that teaches the concepts really well. Forms a brilliant specialization course.,0,0,Suryadipta Das,13696467
30587132~COURSE!~HkJsxW0yEeWEewoyD2Bc5Q,1522122523492,5,0,Excellent course,0,0,Javier Eslava Schmalbach,30587132
6930133~COURSE!~HkJsxW0yEeWEewoyD2Bc5Q,1521992248057,5,0,good course for learning about tidy data. But have to say that the instructions for the coursework is not exactly very clear.,0,0,KELVIN HWEE,6930133
6546072~COURSE!~HkJsxW0yEeWEewoyD2Bc5Q,1521986096377,5,0,The volume of vice sounds to low. ,0,0,icu,6546072
28919984~COURSE!~HkJsxW0yEeWEewoyD2Bc5Q,1521895869614,5,0,Very interesting but a bit tough and time consuming with a lot of work on your own... but that's probably how you develop real life hacking behavior!,0,0,Guillaume Soufflet,28919984
25418047~COURSE!~HkJsxW0yEeWEewoyD2Bc5Q,1521894754929,5,0,"nice course for the cleaning data using R, ",0,0,lotfi Raghib,25418047
15391530~COURSE!~HkJsxW0yEeWEewoyD2Bc5Q,1521775660988,5,0,Good class. Learn a lot from it. ,0,0,Xiuyuan Li,15391530
406436~COURSE!~HkJsxW0yEeWEewoyD2Bc5Q,1521301218557,5,0,So knowledgeable  and interesting course. I have learned much about data cleaning and getting from different sources. Finally thanks to coursera team for giving us the opportunity.  ,0,0,Sudhin Biswas,406436
31077462~COURSE!~HkJsxW0yEeWEewoyD2Bc5Q,1520862087070,5,0,great class for anyone learning the R language and data analytics,0,0,Wellintton Perez,31077462
27035651~COURSE!~HkJsxW0yEeWEewoyD2Bc5Q,1520835538241,5,0,This course is absolutely fantstic education. More practice tasks will make it better in my opinion. ,0,0,Keidzh Sergei,27035651
23033793~COURSE!~HkJsxW0yEeWEewoyD2Bc5Q,1520776671841,5,0,very good ,0,0,Saurabh Singla,23033793
31642290~COURSE!~HkJsxW0yEeWEewoyD2Bc5Q,1520695747591,5,0,"Good, like other courses of this specialization",0,0,Laro Navamuel Puente,31642290
2618139~COURSE!~HkJsxW0yEeWEewoyD2Bc5Q,1520370119975,5,0,This is a very useful course on How to use R to prepare the data you need to analyze! highly recommended for both beginner and advanced data analysts!,0,0,Hernan Solano,2618139
25657643~COURSE!~HkJsxW0yEeWEewoyD2Bc5Q,1520309564849,5,0,It's very awesome course,0,0,Alzum Shahadat Miazee,25657643
27097806~COURSE!~HkJsxW0yEeWEewoyD2Bc5Q,1520099456377,5,0,"I really really loved this course. Some of courses before were outdated because there are lots of changes in packages or others. However, materials in this course were not changed that much.  ",0,0,현 허,27097806
9480848~COURSE!~HkJsxW0yEeWEewoyD2Bc5Q,1520075618901,5,0,"Amazing, you get to see almost every aspect of data science.It is true that you won't get deeepeeeer, but this course allow you to not fear any kind of data science. That's amazing.",0,0,BOUZENNOUNE Zine Eddine,9480848
23668869~COURSE!~HkJsxW0yEeWEewoyD2Bc5Q,1520069995759,5,0,Very helpful source. Introduce the basic and important concept of tidy data.,0,0,吴昊,23668869
23175380~COURSE!~HkJsxW0yEeWEewoyD2Bc5Q,1519716971587,5,0,Excellent!,0,0,Zito Relova,23175380
