id,reviewedAt,rating,isMarkedHelpful,reviewText,productCompleted,mostHelpfulVoteCount,users,user_id
56594198~COURSE!~ICHUM2UiEeaspg4CA9Hi1w,1588649324482,5,0,"This course helped me to generate interactive
classroom through the use of multimedia tools, student collaboration activities,
and formative assessment and feedback.",0,1,Aashish Gandigude,56594198
54310415~COURSE!~ICHUM2UiEeaspg4CA9Hi1w,1588087066617,5,0,I really enjoyed the course with practical tools that you can implemented and enhance your teaching and student learning experience. Recommend this course to anyone that needs to engage in online learning,0,6,Yolanda Stevens ,54310415
30694881~COURSE!~ICHUM2UiEeaspg4CA9Hi1w,1587598833978,5,0,Great course for teachers and other practitioners who use technology to teach or communicate effectively!,0,1,Maria Rafaela Michalopoulou,30694881
4380000~COURSE!~ICHUM2UiEeaspg4CA9Hi1w,1587398261374,5,0,"USEFUL COURSE WITH A VERY PRACTICAL AND WELL-STRUCTURED LAYOUT. CLEAR VIDEOS AND MANY USEFUL RECOMMENDATIONS, LINKS AND TOOLS.",0,1,Cristina Cela Gutiérrez,4380000
50541198~COURSE!~ICHUM2UiEeaspg4CA9Hi1w,1587375391552,5,0,The course was interesting. I learned a lot of new things and developed previous skills. Thank you!,0,1,Khrystyna Dumych,50541198
55848757~COURSE!~ICHUM2UiEeaspg4CA9Hi1w,1587370363176,5,0,I completed the course successfully. The tasks were interesting and exciting. Thank you! ,0,1,Zhuldyz Zhardimgalieva,55848757
51141001~COURSE!~ICHUM2UiEeaspg4CA9Hi1w,1587136564018,5,0,It's awesome ,0,1,Esraa Osama Tawfik Elgamal,51141001
1953291~COURSE!~ICHUM2UiEeaspg4CA9Hi1w,1586711811671,5,0,"Improving my course with the technologies discussed in the course, made my classes much more interesting.",0,1,Carlos Jonnatan Pimentel Barros,1953291
53512754~COURSE!~ICHUM2UiEeaspg4CA9Hi1w,1586230074688,5,0,"Its one of the best course to use digital multimedia in modern teaching practices. Every science teacher should do this course and apply concept of collaborative learning in teaching.  Thanks, team of course and Coursera. ",0,4,Dr. Kailas Mali,53512754
43144984~COURSE!~ICHUM2UiEeaspg4CA9Hi1w,1586027066463,5,0,"A brilliant course, which helps understand basic VLE. I get qiute fascinated by all the tasks and methods! This course asissted me a lot in my occupation, that is connected with teaching! ",0,3,Alexandra Khorosh,43144984
48587268~COURSE!~ICHUM2UiEeaspg4CA9Hi1w,1585298957580,5,0,"This course is extremely practical.  Highly recommend - the course provides a diverse range of topics, all of which equip the learner with a great toolkit.",0,1,Judi Rose,48587268
36737602~COURSE!~ICHUM2UiEeaspg4CA9Hi1w,1584813909057,5,0,I like the way we got involved into practice by setting goals which are a bit challenging yet we want to achieve successfully.I am grateful to have the chance to participate in an online course like this!,0,4,Roberto Jorge Valles Pusare,36737602
40732648~COURSE!~ICHUM2UiEeaspg4CA9Hi1w,1584256632966,5,0,"Request more such courses on latest tools and application to teach, learn, train ",0,1,anitha,40732648
25763603~COURSE!~ICHUM2UiEeaspg4CA9Hi1w,1583927703038,5,0,"This course was what I needed to push my teaching into the next level. Everything was really clear and useful, and full of interesting contents. ",0,1,Alba Ramirez Saiz,25763603
43550038~COURSE!~ICHUM2UiEeaspg4CA9Hi1w,1581833924607,5,0,Thanks,0,1,Muhammad Zunnurain Hussain,43550038
39703535~COURSE!~ICHUM2UiEeaspg4CA9Hi1w,1580850299482,5,0,"

I benefited greatly from this wonderful experience. I thank the professors very much  ",0,1,abderrahman elaabd,39703535
46423024~COURSE!~ICHUM2UiEeaspg4CA9Hi1w,1578588772277,5,0, I thank coursera for providing the opportunity to learn about practical teaching with Technology. I have learnt new techniques to teach.,0,2,Lakshmi Anusha Kadimisetti,46423024
41335567~COURSE!~ICHUM2UiEeaspg4CA9Hi1w,1575268197861,5,0,"Great course, very interactive, even though this course challenged me, I enjoyed every part! ",0,1,Marike Buys,41335567
27609469~COURSE!~ICHUM2UiEeaspg4CA9Hi1w,1574085705835,5,0,The course has introduced me to various tools that are very useful to my training. I could explore using them to make my lesson more interactive.,0,5,Joann Chen,27609469
43064715~COURSE!~ICHUM2UiEeaspg4CA9Hi1w,1572951560351,5,0,This is a wonderful course,0,1,Ebi Ang Chiew Har,43064715
37971574~COURSE!~ICHUM2UiEeaspg4CA9Hi1w,1570500311464,5,0,This is an interesting course and teaches me many multimedia platform I can leverage when doing my lesson plan.,0,1,Ivan Sum,37971574
32882068~COURSE!~ICHUM2UiEeaspg4CA9Hi1w,1569201941328,5,0,"A very informative course. I learn a lot from the course, and I would like to apply it in the course of my work.",0,1,Mohammed Abdul Aziz,32882068
37073919~COURSE!~ICHUM2UiEeaspg4CA9Hi1w,1568885658533,5,0,V,0,1,Muhammad Firdaus Bin Rahim,37073919
36207153~COURSE!~ICHUM2UiEeaspg4CA9Hi1w,1568783865026,5,0,Very fruitful.... Learning,0,2,Aziz Bin Ismail,36207153
10987289~COURSE!~ICHUM2UiEeaspg4CA9Hi1w,1566933218054,5,0,"This course gives a comprehensive view of the main resources that you can use to design virtual courses. I loved the discussion forums, and all professors showed a high level of expertise and professionalism. Highly recommended!",0,3,Maria Berrios Camacho,10987289
36935240~COURSE!~ICHUM2UiEeaspg4CA9Hi1w,1566910403401,5,0,I have learnt to get interactive through practical teaching with technology. The new ways of teaching  using different platforms allow learners to discover the answer themselves by a forum discussion and explore how to use tools such as videos to become more independent learners.,0,3,Nordeen bin Osman,36935240
13551521~COURSE!~ICHUM2UiEeaspg4CA9Hi1w,1566858910520,5,0,"Really loved the fact that this course offered me an opportunity to realise, explore and apply a range of technology based software, platforms and tools that can aid in making my students' learning experience more engaging in the future.",0,5,RAJESH IYER,13551521
7025713~COURSE!~ICHUM2UiEeaspg4CA9Hi1w,1556294781368,5,0,V,0,1,Mustafa Mas'ood,7025713
16112251~COURSE!~ICHUM2UiEeaspg4CA9Hi1w,1555704037011,5,0,"Excelente, me ayudó a conocer muchas nuevas herramientas para mejorar mis cursos e-learning.",0,1,Rodrigo Farias Veloso,16112251
17585465~COURSE!~ICHUM2UiEeaspg4CA9Hi1w,1553249992743,5,0,"Its interactive, well organised with many practicals",0,1,Mniko Simon,17585465
38174430~COURSE!~ICHUM2UiEeaspg4CA9Hi1w,1553129072501,5,0,This is a very well organized online teaching technology skill - building course.,0,5,Jane Igbibo Alamina,38174430
34209354~COURSE!~ICHUM2UiEeaspg4CA9Hi1w,1551444158228,5,0,wonderful,0,1,Mohd Alwi Bin Mohd Tajudin,34209354
27388853~COURSE!~ICHUM2UiEeaspg4CA9Hi1w,1548949848076,5,0,Loved the course! Activities and teachers were on point! Highly recommended ,0,1,Garota Decores,27388853
2863800~COURSE!~ICHUM2UiEeaspg4CA9Hi1w,1548928726892,5,0,"I 

I really enjoyed the discussion tables. Thank you  ",0,1,marisa caria,2863800
34646253~COURSE!~ICHUM2UiEeaspg4CA9Hi1w,1531752628057,5,0,"First of all, it's a great honor to be part of this special course. I learned a lot, really. I'm an ICT teacher for technology although we don't have the best technology in the Philippines but we can absolutely use the tools you've provided and taught us. I enjoyed this course sooooooooo much. Maybe I took the assignment too seriously and put a lot of effort on them but that only shows how engaging this course is. It's a little sad =). I'd like to thank my peers, and MOST ESPECIALLY OUR INSTRUCTORS AND TRAINERS. Ms Sherman, Dr. Weiz and Dr Kennedy, I thank you so much!!!!!!!!!!",0,8,Edison Acelajado Gabrido,34646253
17965604~COURSE!~ICHUM2UiEeaspg4CA9Hi1w,1527145976126,5,0,Excellent array of interactive and learning design tools. Three assignments with peer review that ensure deep learning. ,0,1,Kerstin Kapsberger,17965604
25911545~COURSE!~ICHUM2UiEeaspg4CA9Hi1w,1526894431016,5,0,Very interesting and engaging course - highly recommended!,0,1,Sonya Powney,25911545
21220916~COURSE!~ICHUM2UiEeaspg4CA9Hi1w,1526410675705,5,0,Very interactive and practical course for educators. ,0,1,Simone Theuma,21220916
33605571~COURSE!~ICHUM2UiEeaspg4CA9Hi1w,1526214381593,5,0,It's useful course for learning how to blend and develop learning and teaching experience to be more interactive with the help of multi-technology ,0,6,Nattida Srisaracam,33605571
4650728~COURSE!~ICHUM2UiEeaspg4CA9Hi1w,1525527011938,5,0,"I am enriching and enhancing my professional and personal development Way to go! Thanx!  Sandra Goronas, Argentina",0,1,Sandra Goronas,4650728
10651225~COURSE!~ICHUM2UiEeaspg4CA9Hi1w,1524095981233,5,0,Excellent course! I loved applying what I learned each week with my students!,0,1,Meibis González Vega,10651225
439989~COURSE!~ICHUM2UiEeaspg4CA9Hi1w,1514818995673,5,0,Full of useful information on practical tools and meaningful activities that can enhance any class. ,0,1,Analia Carrio,439989
1857274~COURSE!~ICHUM2UiEeaspg4CA9Hi1w,1507555800633,5,0,A good opportunity to review new and exciting tools to spice up your class and online courses !!!,0,1,Roberto Castañeda Sarabia,1857274
25856242~COURSE!~ICHUM2UiEeaspg4CA9Hi1w,1501270340116,5,0,Fun course with enthusiastic tutors. The interactivity is great and a sense of community among the participants grew over the 3 weeks.I learnt a lot and saw some really practical but interesting ideas for using the apps that we met.,0,3,sarah crabbe,25856242
25910112~COURSE!~ICHUM2UiEeaspg4CA9Hi1w,1495193464627,5,0,I learned a lot! A good pace and some fun activities. I am already implementing some of this stuff in my teaching.,0,4,Richard Prince,25910112
