id,reviewedAt,rating,isMarkedHelpful,reviewText,productCompleted,mostHelpfulVoteCount,users,user_id
63172000~COURSE!~JWd4VXqhEeaDmw5QsxT7tQ,1637384814293,5,0,"This Positive Psychology course has been a great experience for me, I have learned a lot and it has served me a lot since I am currently doing my professional psychology practice with some first-time students who have motivation difficulties to continue with their studies and I have created thanks to this course with what they learned some activities for students to learn about the PERMA model about their strengths, the gratitude journal, and the importance of Self-motivation among other important topics, and they have told me that it has helped them a lot to move forward with his studies and build his life project. I can only thank you for such a wonderful course, which has not only helped me enrich my personal part and as a future psychologist, but has also allowed me to help other people who need it to acquire this valuable knowledge.",0,0,KELLY JOHANA SOLER RUIZ,63172000
75527340~COURSE!~JWd4VXqhEeaDmw5QsxT7tQ,1636579115063,5,0,Un excelente curso que te proporciona mucha información nueva y aplicaciones prácticas para mejorar tu vida y ayudar a otros. ,0,0,Luis Ramirez,75527340
96560142~COURSE!~JWd4VXqhEeaDmw5QsxT7tQ,1636127935159,5,0,s​o great!,0,0,Nora Möhlmeyer,96560142
65119252~COURSE!~JWd4VXqhEeaDmw5QsxT7tQ,1635897592099,5,0,"G​ood Course and helpful,  will recommend to others",0,0,Renz Melvin Rodriguez,65119252
84229007~COURSE!~JWd4VXqhEeaDmw5QsxT7tQ,1635819905702,5,0,This course give the framework and history of Positive Psychology from the person who built it.  The examples are practical and compelling.  I've decided to do the entire specialization.,0,0,Loice Swisher,84229007
87538979~COURSE!~JWd4VXqhEeaDmw5QsxT7tQ,1635755346763,5,0,This course provides great foundation knowledge from where Positive Psychology started and also the latest evolvement and development.  Dr. Martine Seligman's sharing is inspiring for sure and I specially appreciate his clear tracked style of teaching combining academic discoveries with personal experience.  Really enjoy taking this course. ,0,0,Joy Shen,87538979
21087971~COURSE!~JWd4VXqhEeaDmw5QsxT7tQ,1635481298397,5,0,"Fantastic. Informative, meaningful, and engaging.  ",0,0,Audri Villalon,21087971
23020631~COURSE!~JWd4VXqhEeaDmw5QsxT7tQ,1635224471592,5,0,"This course has completely changed my mind about optimism, well being and its applicability to every day life. I really enjoyed it, learned, and put to use the new tools and knowledge applied. Thank you!!!",0,0,Alvaro Collas,23020631
45294687~COURSE!~JWd4VXqhEeaDmw5QsxT7tQ,1635104225181,5,0,"The course is well named. Martin E. P. Seligman's Visionary Science truly is both visionary and a science. The visionary part starts with Professor Seligman's revolutionary insight into the inherent negativity bias of 20th Century institutional psychology. If you imagine a state of ""normal,"" ""disease-free,"" or ""healthy"" as the the objective, much of psychology was about getting people from a state of below-the-goal to the the goal. Seligman asked the question, what about ""better than normal?"" He revisualized the spectrum as encompassing more than zero and negative numbers, including the entire range of positive outcomes as well. How can healthy people improve their mental health, resilience, disease resistance and flourishing? How can we shift the whole curve so that everyone is happier and healthier and fewer people fall into illness? How can we apply a rigorous and empirical scientific method to these questions which have interested philosopher, wise people, and spiritual leaders down through the ages? You will learn much more than the big picture here. You'll take away life-changing, research-tested and proven skills. Great course!",0,0,Mark DiMassimo,45294687
95735355~COURSE!~JWd4VXqhEeaDmw5QsxT7tQ,1635078084819,5,0,good,0,0,Nguyễn Thái Huỳnh Như,95735355
79863057~COURSE!~JWd4VXqhEeaDmw5QsxT7tQ,1635074318894,5,0,I have a new way of viewing the world around me,0,0,DIMITRA ROUSSA,79863057
38091307~COURSE!~JWd4VXqhEeaDmw5QsxT7tQ,1634961326638,5,0,A rewarding course on the introduction of Positive Psychology. Lot's of hands on tasks to practice and engage in and real life examples of implementing strategies that improve positive wellbeing. ,0,0,Ning (Nicole) Qian,38091307
54173298~COURSE!~JWd4VXqhEeaDmw5QsxT7tQ,1634506103242,5,0,"The best course I have ever taken! After taking this course, I can see the world differently, think differently, and sleep better, The best part is my well-being is improved! Highly recommended.",0,0,Asuka Watanabe,54173298
93721610~COURSE!~JWd4VXqhEeaDmw5QsxT7tQ,1634433359862,5,0,p​erfect amount of time and assignments. Super interesting and loved it!,0,0,Lynne B,93721610
93466983~COURSE!~JWd4VXqhEeaDmw5QsxT7tQ,1634419278593,5,0,This has been life changing for me. It is inspiring me to dive deep and let go of some things that have been holding me back.,0,0,autumn decesare,93466983
79146583~COURSE!~JWd4VXqhEeaDmw5QsxT7tQ,1634231298835,5,0,peet,0,0,Büşra Yıldırım,79146583
92986737~COURSE!~JWd4VXqhEeaDmw5QsxT7tQ,1633951862852,5,0,very eye opening ,0,0,Ola Serag,92986737
95128366~COURSE!~JWd4VXqhEeaDmw5QsxT7tQ,1633782717602,5,0,This course is very thought-provoking,0,0,Sicheng Chen,95128366
37030808~COURSE!~JWd4VXqhEeaDmw5QsxT7tQ,1633572681059,5,0,Thanks for All,0,0,WEFA QUEDAS DE WRESTLING,37030808
69674663~COURSE!~JWd4VXqhEeaDmw5QsxT7tQ,1633499397289,5,0,"I would highly recommend this course to my family, friends and business associates.  Not only is it helpful for personal growth, it will also help in our relationships and personal and professional interactions.",0,0,Marianne Hontiveros,69674663
92265124~COURSE!~JWd4VXqhEeaDmw5QsxT7tQ,1633258612483,5,0,"The course is very interesting, also when you already have a basic knowledge about positive psychology. I am really looking forward to the next ones.",0,0,Martina Wollenzien,92265124
66611379~COURSE!~JWd4VXqhEeaDmw5QsxT7tQ,1633025449310,5,0,Lots of information! Worthwhile to take. Provides different ideas.  Even how they use data from social media.,0,0,TyAnn S Rolph,66611379
17245748~COURSE!~JWd4VXqhEeaDmw5QsxT7tQ,1632889657164,5,0,​the course has inspired me to delve deeper into positive pyschology.  ,0,0,Amy Eisner Warshaw,17245748
80027588~COURSE!~JWd4VXqhEeaDmw5QsxT7tQ,1632800843155,5,0,Its amazing and a good learning i would say .....Applying the concepts that we learnt her in life would seriously help life time,0,0,Sravya Teja Avutapalli,80027588
45895033~COURSE!~JWd4VXqhEeaDmw5QsxT7tQ,1632222679385,5,0,Fascinating study! Very interesting to watch and learn as well. ,0,0,Sian Visser,45895033
88597784~COURSE!~JWd4VXqhEeaDmw5QsxT7tQ,1632138544045,5,0,Very much enjoyed the candid no non-sense approach o Professor Seligman - thank you,0,0,Wayne Brown,88597784
37140775~COURSE!~JWd4VXqhEeaDmw5QsxT7tQ,1632133229583,5,0,Its a great overview of what Positive Psychology is and how its related to the overall health of a person. It challenged my perception that Positive Psychology is about an individual person. I learnt how Positive Psychology can be applied in almost all fields from Journalism to Defense Forces.,0,0,Sonia Seth,37140775
16615740~COURSE!~JWd4VXqhEeaDmw5QsxT7tQ,1632104368618,5,0,This is a fascinating course! ,0,0,Cindy Swanson,16615740
2635493~COURSE!~JWd4VXqhEeaDmw5QsxT7tQ,1631941634703,5,0,"Absolutely superb lectures, readings and the way the course has been designed. Learnt so many different ways of looking at life e.g. Health being a skill or positive gerontology or responding to life's troubles with positivity and grit etc., and scientifically proven. ",0,0,Vishesh Sahai,2635493
56226515~COURSE!~JWd4VXqhEeaDmw5QsxT7tQ,1631778638606,5,0,I gain a lot of new perspective views of life. Recommend this course to everyone. ,0,0,Benjaphon usombatchai ,56226515
58994355~COURSE!~JWd4VXqhEeaDmw5QsxT7tQ,1630591437283,5,0,I am really thankful for this course as it opened another view in my mind to see how positivism actually works. Great!!!,0,0,Nesibe Gunaydin,58994355
85781639~COURSE!~JWd4VXqhEeaDmw5QsxT7tQ,1630536672695,5,0,In taking this course I was surprised at how much data is being collected on how to achieve well-being. It is much more of a scientific field than I realized.  The course was easy to understand and made me think of ways to apply it to help myself and others live a life that will serve them better. ,0,0,Denise Wozniak,85781639
28346235~COURSE!~JWd4VXqhEeaDmw5QsxT7tQ,1630405953753,5,0,Loved this course - and it's got lots of practical applications to life,0,0,Kate Seal,28346235
89138803~COURSE!~JWd4VXqhEeaDmw5QsxT7tQ,1630182560840,5,0,I have been interested in this field of Psychology for a long time. This introductory course covered so much new material that I was not even aware of and made me want to learn more. I highly recommend taking the class if you have any interested in Positive Psychology. ,0,0,,89138803
34104892~COURSE!~JWd4VXqhEeaDmw5QsxT7tQ,1629949016570,5,0,"Dear Dr. Seligman,The course opened a lot of opportunity for me to reflect my helping activities  in empowering people anywhere.  Thank you for guiding me in my advocacy.  More power, and looking forward to work on with my project.",0,0,Cherry May Rotas Palacio,34104892
92039627~COURSE!~JWd4VXqhEeaDmw5QsxT7tQ,1629718936059,5,0,"Beautiful, interesting and revealing!",0,0,Bianca Mircea,92039627
52018440~COURSE!~JWd4VXqhEeaDmw5QsxT7tQ,1629584156936,5,0,"Really enjoyed this class.  I have taken a Positive Psychology class during my undergrad and the well being course by Laurie Santos on Coursera; however, I learned even more during this course. The big data was very interesting while the optimism and helping others not a surprise. Very much liked the content all the way around.",0,0,Lisa Houck,52018440
84650375~COURSE!~JWd4VXqhEeaDmw5QsxT7tQ,1629450621851,5,0,An absolutely great course that I am so grateful to have taken!,0,0,Oğuz Can Olğaç,84650375
43654718~COURSE!~JWd4VXqhEeaDmw5QsxT7tQ,1629427880499,5,0,It is an eye opening course and helped me with my struggles at work and at home.,0,0,Zhen Wu,43654718
89213288~COURSE!~JWd4VXqhEeaDmw5QsxT7tQ,1629023270916,5,0,"It opens my eyes to see how I can practice being positive to increase my well-being in my daily life (learnt optimism, PERMA, ACR).",0,0,Dorothy Chiong,89213288
90217767~COURSE!~JWd4VXqhEeaDmw5QsxT7tQ,1629011079975,5,0,Very influential and informative! I'm extremely delighted to finish this course. I believe this course has enabled me to embark on huge positive movement world wide. Very excited to part of this mission.,0,0,Fahad Baglain,90217767
88898197~COURSE!~JWd4VXqhEeaDmw5QsxT7tQ,1628809506409,5,0,I absolutely loved it!,0,0,Christel Horst,88898197
89670961~COURSE!~JWd4VXqhEeaDmw5QsxT7tQ,1628779451125,5,0,"thank you very much for the knowledge you shared while I was taking this course, I am very happy that my views and knowledge have increased",0,0,Dea Rizky Aroya,89670961
88375039~COURSE!~JWd4VXqhEeaDmw5QsxT7tQ,1628010018949,5,0,I really enjoyed this course. I felt like I was learning from the best! ,0,0,Margaret Forbush,88375039
89789200~COURSE!~JWd4VXqhEeaDmw5QsxT7tQ,1627841018649,5,0,"Loved it. Informative, insightful and thought provoking.",0,0,Raghad Alawneh,89789200
90375619~COURSE!~JWd4VXqhEeaDmw5QsxT7tQ,1627785311079,5,0,Very ​importent topic,0,0,Ahmed Mohamed,90375619
43510550~COURSE!~JWd4VXqhEeaDmw5QsxT7tQ,1627544899463,5,0,Thank you for this wonderful course,0,0,Reema,43510550
27903994~COURSE!~JWd4VXqhEeaDmw5QsxT7tQ,1627437105110,5,0,"Hermoso curso, agradezco esta maravillosa posibilidad y a todos los involucrados en que se expanda el bienestar de las personas gracias al gran Marty y a coursera por hacerlo posible",0,0,Nicolas Contreras diaz,27903994
88114935~COURSE!~JWd4VXqhEeaDmw5QsxT7tQ,1627317189089,5,0,Very engaging and informative.,0,0,Oswald John B. Teneza,88114935
50199871~COURSE!~JWd4VXqhEeaDmw5QsxT7tQ,1627141344753,5,0,The course felt like remembering what we all know is true at a depth that inspires me to apply these ideas at every opportunity. I am blown away.,0,0,Callan Sturgis,50199871
76498096~COURSE!~JWd4VXqhEeaDmw5QsxT7tQ,1627133754631,5,0,Super!!,0,0,Миронов Родион Валерьевич,76498096
55273542~COURSE!~JWd4VXqhEeaDmw5QsxT7tQ,1626949157289,5,0,"Amazing course. Filled with good-presented information, interesting topics and world-changing approaches!!",0,0,Anastasia Usanova,55273542
82427100~COURSE!~JWd4VXqhEeaDmw5QsxT7tQ,1626606838489,5,0,"It was really educational and useful. Furthermore, it enables you to alter yourself and your way of thinking in a short period of time.",0,0,Reha Gül,82427100
52170408~COURSE!~JWd4VXqhEeaDmw5QsxT7tQ,1626472064739,5,0,This is a life-changing course!,0,0,Marcia Rhode,52170408
85346038~COURSE!~JWd4VXqhEeaDmw5QsxT7tQ,1626289487440,5,0,So exciting to get into a course that is immediately applicable to everyone.  Marty is an excellent presenter and the information is dosed out in bit sized nuggets.,0,0,Robert Atkinson,85346038
7224952~COURSE!~JWd4VXqhEeaDmw5QsxT7tQ,1625751222450,5,0,"Thanks for this course, though I had no opportunities to finish the whole. That lectures were great.",0,0,Maxim Suharkov,7224952
88337712~COURSE!~JWd4VXqhEeaDmw5QsxT7tQ,1625750266697,5,0,positive is not just happy.,0,0,Chan Hku,88337712
85532792~COURSE!~JWd4VXqhEeaDmw5QsxT7tQ,1625496682101,5,0,I took this course because I was really intrigued by this new field in psychology and it was definitely really a fascinating and amazing course. It provided a very insightful and in-depth teaching of positive psychology. All the activities were really engaging and I had a very fun time doing them. I liked that they brought in different researches for certain topics and even their explanations were thorough. There was a lot of learning and mental exercises involved and a lot of valuable lessons and knowledge I can take away from this course so overall it was a really great experience.,0,0,Gouthami s Kaimal,85532792
85947474~COURSE!~JWd4VXqhEeaDmw5QsxT7tQ,1625466798290,5,0,Amazing course by an enchanting Professor and Visionary.,0,0,Garima,85947474
86057653~COURSE!~JWd4VXqhEeaDmw5QsxT7tQ,1625254852932,5,0,Loved this course,0,0,Lorena Patricia Mora Flores,86057653
83363712~COURSE!~JWd4VXqhEeaDmw5QsxT7tQ,1625091313002,5,0,Excellent introductory course.,0,0,Hans Jardine,83363712
86826005~COURSE!~JWd4VXqhEeaDmw5QsxT7tQ,1624997437287,5,0,g,0,0,Francois Laporte,86826005
86481116~COURSE!~JWd4VXqhEeaDmw5QsxT7tQ,1624804726509,5,0,"This course was really an eye opener.  All the findings are based on research, and will change the way you view the world around you.  I believe it is time well spent because my learnings can be used in my personal life, irrespective of my career choices.  ",0,0,Rajiv Koghar,86481116
58593021~COURSE!~JWd4VXqhEeaDmw5QsxT7tQ,1624704547927,5,0,Thanks for the wonderful course,0,0,BIKRAMJIT KONWAR,58593021
42913243~COURSE!~JWd4VXqhEeaDmw5QsxT7tQ,1624703326545,5,0,I really loved this course.,0,0,Miriam Allen,42913243
86537985~COURSE!~JWd4VXqhEeaDmw5QsxT7tQ,1624630675777,5,0,Loved this curse. I was enthusiastic and engaged the whole way through and feel like I have learnt a lot. I can´t wait to start the second one. Thank you for bringing positive psychology to the world.,0,0,Marie Fielding,86537985
77313940~COURSE!~JWd4VXqhEeaDmw5QsxT7tQ,1624624826156,5,0,Absolutely fascinating! Recommended for everybody who wants better life and better understanding of self.,0,0,Ina Front,77313940
88321845~COURSE!~JWd4VXqhEeaDmw5QsxT7tQ,1624405093814,5,0,Insightful and enriching. Worth the time going through the materials which i am sure will benefit me significantly ,0,0,Wu Wenjie,88321845
86641996~COURSE!~JWd4VXqhEeaDmw5QsxT7tQ,1624302203283,5,0,It was probably one of the courses that most changed my perspective on living in this world and how positive psychology is sorely needed in all areas for a worldwide well-being.,0,0,Janus Loy Mezavila Da Costa,86641996
69870003~COURSE!~JWd4VXqhEeaDmw5QsxT7tQ,1623937072832,5,0,I​ would like to thank all teachers that made this course available.A​bsolutely loved it.,0,0,Natalia Lupu,69870003
61209321~COURSE!~JWd4VXqhEeaDmw5QsxT7tQ,1623860628889,5,0,​This has been a great eye opener for me. Will definetly recommend this course for family and friends. ,0,0,Ifeoma Toki,61209321
81903183~COURSE!~JWd4VXqhEeaDmw5QsxT7tQ,1623632058091,5,0,There is a great deal of information in this course. I felt like I was back in Uni. ,0,0,Mary M. Russell,81903183
50901812~COURSE!~JWd4VXqhEeaDmw5QsxT7tQ,1623598392980,5,0,"E​xcellent introduction to Positive Psychology - great opportunity to learn from Dr Marty Seligman, truly a visionary for a new approach to well-being, and to addressing life's challenges!  This online course kept the process engaging, with interspersed exercises and quizzes, to facilitate learning. I hope to incorporate many of its principles and strategies in my daily work ... as well as in my personal life!",0,0,Maureen Strohm,50901812
39499735~COURSE!~JWd4VXqhEeaDmw5QsxT7tQ,1623293664843,5,0,"The course is excellent! It made me think about new perspectives of professional performance, as well as helping me to reflect on my character strengths.",0,0,prof Daniel Andrade Psicólogo,39499735
75937719~COURSE!~JWd4VXqhEeaDmw5QsxT7tQ,1623255459868,5,0,Fascinating course. Grateful there was no filler. It's an empirical take on mental health and I want to push it for my fellow first responders especially.,0,0,Virginia Kerr,75937719
80513743~COURSE!~JWd4VXqhEeaDmw5QsxT7tQ,1623183944569,5,0,"Thank you for your thoughtful attention of incorporating various approaches to learning during this course. This has been fascinating and relevant to my work and personal passions. It took me quite a bit longer than anticipated, since I ended up taking 36 pages of notes! What an enriching learning experience - and to have the opportunity to learn from the actual gurus in these fields has been an incredible privilege. Thank you to all involved in this course!",0,0,glenys jenkyns,80513743
54658536~COURSE!~JWd4VXqhEeaDmw5QsxT7tQ,1623002038458,5,0,E​xcellent lecturs and course organization!,0,0,Ralph Baber,54658536
85321371~COURSE!~JWd4VXqhEeaDmw5QsxT7tQ,1622889077805,5,0,"​Kept me interested, and sometimes excited about what I was learning.  The course is well paced and can be fitted in around a busy work schedule.  Felt it was worthwhile and I want to go on to do the other programs in the series.",0,0,Robert Whittaker,85321371
46226251~COURSE!~JWd4VXqhEeaDmw5QsxT7tQ,1622669042828,5,0,it was an excellent that really change my mind and made me think. thank you Dr. martin Seligman.,0,0,ZAKARIYA ALI,46226251
12592065~COURSE!~JWd4VXqhEeaDmw5QsxT7tQ,1622373187347,5,0,Excellent presentation and composition,0,0,Muhammad Subhan Iswahyudi,12592065
85397800~COURSE!~JWd4VXqhEeaDmw5QsxT7tQ,1622018851216,5,0,"I am very much happy to have been taken this course by Martin Seligman. I am always inclined to learn and read more about human behaviors, emotions, thoughts and well-being. Well, this course has been an wonderful start to my inclinations. I am also quite interested to make a world a better place by whatever ways I can and I am pretty sure positive psychology will make a great difference in my life ahead. Thanks!",0,0,Sourav Badu,85397800
13047186~COURSE!~JWd4VXqhEeaDmw5QsxT7tQ,1621698530668,5,0,very nice course,0,0,Satish Santhanam,13047186
34668246~COURSE!~JWd4VXqhEeaDmw5QsxT7tQ,1621617702432,5,0,"I Love this course, it is allowing me to apply, expand and use these tools on the go, while sharing them and giving me a more optimistic outlook as I move forward. I am so grateful and feel privileged today to be here verses when I started, I was totally pessimistic not understanding that optimism and resilience can be learned at anytime!Infinite Gratitude and Love",0,0,LaCre' Hamlet,34668246
69339814~COURSE!~JWd4VXqhEeaDmw5QsxT7tQ,1621592726694,5,0,It was an honour to have the course from the leader of positive psychology. I feel so distinguished. thank you.,0,0,Ahmet Nacar,69339814
44629684~COURSE!~JWd4VXqhEeaDmw5QsxT7tQ,1621344403683,5,0,Really enjoyable and very relevant for my next venture in life! Thank you,0,0,Mark Freer,44629684
13789972~COURSE!~JWd4VXqhEeaDmw5QsxT7tQ,1621264960105,5,0,I love it!,0,0,Jedalia de Sousa Irmao,13789972
78440129~COURSE!~JWd4VXqhEeaDmw5QsxT7tQ,1621232166036,5,0,"  The course is very enlightening, because learning Positive Psychology is not only about theory, it's always encourage the students to practice it to themselves first, and even we can create bigger impact. I have always been a Positive Psychology enthusiast since I was in university. I took the course and fell in love with it instantly.This opportunity is amazing, I learned from Martin Seligman, the founder of Positive Psychology. How exciting is that!! It is very insightful, knowing how Positive Psychology has been very impactful for people around the world. The potential of its research is huge. I am intrigued, I will find a way to get a degree on this!  ",0,0,Nadiyah Afifah,78440129
315312~COURSE!~JWd4VXqhEeaDmw5QsxT7tQ,1621175316981,5,0,"Exceptional course, clear insights to better habits and a more complete life experience ",0,0,John Mather,315312
74927620~COURSE!~JWd4VXqhEeaDmw5QsxT7tQ,1621118885657,5,0,Well presented with engaging lecturers.,0,0,James Strait,74927620
70930643~COURSE!~JWd4VXqhEeaDmw5QsxT7tQ,1621111052874,5,0,It changes your whole perspective of how to deal with not just your mental but physical well-being and your point of view on a lot of things in life,0,0,Sonia Kusiima,70930643
14499925~COURSE!~JWd4VXqhEeaDmw5QsxT7tQ,1620983493855,5,0,Amazingly clear and exhaustive!,0,0,"Claudio, Jr. Bellin",14499925
81596413~COURSE!~JWd4VXqhEeaDmw5QsxT7tQ,1620847801932,5,0,"Positive Psychology makes the difference between thriving and drooping. I LOVE this coursework and its impact on my personal and professional life. I am an avid learner and devour bodies of work like this to support my Benefit Corporation, Superpower School Inc. If it wasn't for Dr Seligman, I would not have been able to formalize and legitimize my optimism as a superpower. Now, with science backed research, I can say that part of what makes me tick as an unusually optimistic woman is my resiliency, as well as my top five superpowers: 1. Love. 2. Perspective. 3 Appreciating beauty and excellence 4. Humor. 5. Creativity tied with Gratitude.  Watch out world! Kindness trumps meanness any day of the week!",0,0,Yvette Troyna,81596413
35804105~COURSE!~JWd4VXqhEeaDmw5QsxT7tQ,1620431924544,5,0,Finest Course on Psychology. Highly Recomended,0,0,Abdul Salam,35804105
79965676~COURSE!~JWd4VXqhEeaDmw5QsxT7tQ,1620355676666,5,0,"Excellent , Thanks for such a great experience",0,0,narda Alvelo,79965676
1116412~COURSE!~JWd4VXqhEeaDmw5QsxT7tQ,1620315460275,5,0,"This is not a course for educational purposes only.  This course will change the way you look at yourself and your relationship with society forever.  Take it, and encourage your friends to do the same.",0,3,Janet Kemp,1116412
53576233~COURSE!~JWd4VXqhEeaDmw5QsxT7tQ,1620229603284,5,0,Excellent investment! This is a very good course for you that want learn more about Positive Psychology.,0,0,Ana Carolina Snége,53576233
49279331~COURSE!~JWd4VXqhEeaDmw5QsxT7tQ,1620094601481,5,0,"Não tenho palavras para descrever a satisfação que foi terminar o Positive Psychology : Martin E. P. Seligman´s Visionar Science , Me  ajudou a compreender que o  estado de felicidade e otimismo pode ser genuíno e duradouro. Desenvolver habilidades como empatia, altruísmo, gratidão  nos levam a um futuro mais leve e que todas essa habilidades e outras mais estão dentro de nós. Martin Seligman é sensacional e não tenho como expressar minha gratidão ! ",0,0,Vivianne Oliveira Abrahão,49279331
83547750~COURSE!~JWd4VXqhEeaDmw5QsxT7tQ,1619886816977,5,0,Dr. Seligman is the best lecturer I've had the experience of learning from. His speaking style was really effective for my learning style. And the content fascinated me. This course is excellent. I found the pop-up questions and assignments to be really reinforcing for learning the material and keeping my attention focused on the content. I am so grateful for the opportunity to learn directly from Dr. Seligman and his excellent collaborators. I plan to take the other courses in the applied positive psychology series. Thank you for making this available in this format!,0,0,Brandee Gerke,83547750
35022907~COURSE!~JWd4VXqhEeaDmw5QsxT7tQ,1619868407675,5,0,The course was excellent and very impactful and positive for me.Many thanks to the coursera group and dear Martin Seligman,0,0,nazanin pirhayati,35022907
30017279~COURSE!~JWd4VXqhEeaDmw5QsxT7tQ,1619486694048,5,0,Positive Psychology helps you understand character strengths and virtues. Spot factors that can impact someone's health and lifespan.  Loved the course.positive psychology,0,0,Natalie Smith,30017279
59724309~COURSE!~JWd4VXqhEeaDmw5QsxT7tQ,1618993475521,5,0,Thank you for sharing all the development in PP.  ,0,0,Chong Lin Lin,59724309
84798934~COURSE!~JWd4VXqhEeaDmw5QsxT7tQ,1618952863786,5,0,:D,0,0,Laura-Diana Ciobanu,84798934
18248797~COURSE!~JWd4VXqhEeaDmw5QsxT7tQ,1618730768240,5,0,Excellent course!,0,0,Alan Aguilar,18248797
73331608~COURSE!~JWd4VXqhEeaDmw5QsxT7tQ,1618667933838,5,0,"Great course! Very good students engagement in discussions, thank you all! Also I love the research talks from graduate students. ",0,0,Brighid McCarthy,73331608
81324905~COURSE!~JWd4VXqhEeaDmw5QsxT7tQ,1618431320047,5,0,Very interesting and informative. A great intro to the basis of Positive Psych as a science. ,0,0,Irene Ruby Flesher,81324905
