id,reviewedAt,rating,isMarkedHelpful,reviewText,productCompleted,mostHelpfulVoteCount,users,user_id
43128865~COURSE!~JWd4VXqhEeaDmw5QsxT7tQ,1591695127688,5,0,"I had a wonderful time learning about Positive Psychology. I really enjoyed the way Dr. Seligman explains about the subject. I have a feeling that what i will learn thrugh the specialisation is going to be life transforming for me. Those small small gaps in my life that were just there, inconspicuous but restraining ....they are going to be filled in....making my life more meaningful for myself and for the people around me. I will finally be able to make the changes in my life that uptill now kept slipping from my hands......Thank you.  ",0,0,Hetal Merchant,43128865
49967711~COURSE!~JWd4VXqhEeaDmw5QsxT7tQ,1591643627741,5,0,Excellent course. I already knew a great deal about positive psychology and found this an excellent review. ,0,0,William Bailey,49967711
62872690~COURSE!~JWd4VXqhEeaDmw5QsxT7tQ,1591622310453,5,0,"The course is very well shot, every point made has an example followed. It is easy to understand and links to every module. ",0,0,Jasmine Joseph,62872690
53066681~COURSE!~JWd4VXqhEeaDmw5QsxT7tQ,1591621450702,5,0,"Great course. InspiringAdding Knowledge, Skill and Awareness.",0,0,Heru Yuwono Liem,53066681
59145896~COURSE!~JWd4VXqhEeaDmw5QsxT7tQ,1591588875259,5,0,"I learned a lot and it is very useful. As a psychology student, I would like to highlight the importance of this kind of content. I wish we had more of it in school, but unfortunately that's not the case. This course is actually my favorite course of all my career so far.",0,0,Camila Ruiz Raya,59145896
58770669~COURSE!~JWd4VXqhEeaDmw5QsxT7tQ,1591561055132,5,0,Very insightful,0,0,Anyck Marie-Claire Turgeon,58770669
56809988~COURSE!~JWd4VXqhEeaDmw5QsxT7tQ,1591525145797,5,0,Good visionary in the world of psychology. These concepts and skills should be taught in every classroom and are a great path for anyone looking to improve their overall life experience. I wish I had learned all of this sooner. Awesome!  ,0,0,Madubashini Sachini,56809988
60526934~COURSE!~JWd4VXqhEeaDmw5QsxT7tQ,1591395767577,5,0,The information presented was very interesting and given by many different perspectives and people. ,0,0,Terry Bolinger,60526934
11823374~COURSE!~JWd4VXqhEeaDmw5QsxT7tQ,1591387438006,5,0,"Un curso ágil, claro, serio, muy dinámico en sus actividades y ciertamente un lujo poder escuchar al creador mismo de la Psicología Positiva dar clases. Ha sido un honor!",0,0,Marlene Dorigoni,11823374
60830559~COURSE!~JWd4VXqhEeaDmw5QsxT7tQ,1591325169302,5,0,"EASY TO FOLLOW, EXCELLENT INFORMATION",0,0,Marie Carmen Colon,60830559
51173824~COURSE!~JWd4VXqhEeaDmw5QsxT7tQ,1591313414866,5,0,"This is an excellent course with clear, expert lectures, interactive assignments, guest lecturers, a variety of research and intervention examples, and loads of practical application to daily well-being.",0,0,E. M.,51173824
4284592~COURSE!~JWd4VXqhEeaDmw5QsxT7tQ,1591299439100,5,0,Thank you for the learnings! It changed my life! I will use this to help people have a positive outlook in life especially during this COVID-19 pandemic,0,0,Harold Gardon,4284592
60553955~COURSE!~JWd4VXqhEeaDmw5QsxT7tQ,1591280512175,5,0,Excellent,0,0,Nethuvi Gunathillake,60553955
42764196~COURSE!~JWd4VXqhEeaDmw5QsxT7tQ,1591263815987,5,0,Amazingly done and it's very simple to understand everything which is mentioned. Good perspective. ,0,0,Pasindhu Mendis,42764196
54247777~COURSE!~JWd4VXqhEeaDmw5QsxT7tQ,1591183310310,5,0,"First of all, I want to Express my deepest gratitude to You for your faith in me. For the opportunity to take your course. Your course has helped me during this difficult period of life that we all go through, related to the COVID-19 epidemic.What makes my life worth living? – good question, it's like thinking about the meaning of life. I think the meaning of life is just to live. I enjoy every moment of it, I must try to be here and now, so as not to miss the smallest details of every beautiful moment. The past is an experience, the future is not known. You should try to enrich your life with beautiful moments, a positive attitude, help other people, and be a spiritual person. Take care of our neighbors and our little brothers. He treats nature with love and saves it as much as possible.What does it mean for me to live a good life? Kindness, justice, joy, health, happiness, friendship, relationships, and much more fill our lives and make them wonderful.What strengths and practices you will now be able to develop in order to create an upward spiral of prosperity in your life and for those you love? – I will try to find pluses in everything, take care of my mental state, help people, try to be more positive and good-natured.",0,2,Петрова Юлия Павловна,54247777
45468125~COURSE!~JWd4VXqhEeaDmw5QsxT7tQ,1591111758426,5,0,"One of the best course that I have taken, thank you !",0,0,Lim Kai Boon James,45468125
40334083~COURSE!~JWd4VXqhEeaDmw5QsxT7tQ,1591084118375,5,0,Martin and his team are a true inspiration. What an insight into the great aspects of positive psychology.,0,0,Rowena Bracken,40334083
28357393~COURSE!~JWd4VXqhEeaDmw5QsxT7tQ,1590982103298,5,0,"Proud to be a part of it, learnt a lot.",0,0,Mairaj abid,28357393
45694522~COURSE!~JWd4VXqhEeaDmw5QsxT7tQ,1590963738636,5,0,"Great information. Great delivery...easy to learn this way. Fabulous instructors.  I mean we're learning from Martin Seligman himself.  Seriously, what could be better!",0,0,Ellen F,45694522
46057310~COURSE!~JWd4VXqhEeaDmw5QsxT7tQ,1590938282905,5,0,Excellent course that I would wholeheartedly recommend to anyone!,0,0,Veera Niskanen,46057310
59295511~COURSE!~JWd4VXqhEeaDmw5QsxT7tQ,1590925601859,5,0,The perfect introduction to an exciting aspect of Psychology. Positive Psychology complements with the tools to better oneself and help your own personal development as well as the vision for a better world.,0,0,Francesca Tomasetig,59295511
49154761~COURSE!~JWd4VXqhEeaDmw5QsxT7tQ,1590914366021,5,0,Learning from the creator of Positive Psychology is a life learning highlight for me. I highly recommend this course. ,0,0,Peter J Rimel,49154761
37132092~COURSE!~JWd4VXqhEeaDmw5QsxT7tQ,1590831777218,5,0,"Amazing course! Very practical. Easy to understand, easy to follow and easy to achieve well-being. I am so glad that I took this course. Highly recommend to people who want to be happier.",0,0,Brenda L.,37132092
33707968~COURSE!~JWd4VXqhEeaDmw5QsxT7tQ,1590790137024,5,0,"It is a excelent course, because change us by inside first to inspire and help people to change after that. I am very grateful for the opportunity that Penn State gave me. It is really useful knowledge to help us, the people around us and even the world. I am using that the best way I can. Beside that it share with the maximum people that I can.",0,0,Joan Silveira de Oliveira Leite,33707968
59348621~COURSE!~JWd4VXqhEeaDmw5QsxT7tQ,1590776862114,5,0,The best cours in my life! Thank you!,0,0,Blaj Cristina Eveline,59348621
55490329~COURSE!~JWd4VXqhEeaDmw5QsxT7tQ,1590763098472,5,0,"I loved the course, it was very clear, concise and well explained. It is a very complete course. Congratulations and thank you for giving me the opportunity to be here.",0,0,Dunia Dubon,55490329
9785658~COURSE!~JWd4VXqhEeaDmw5QsxT7tQ,1590730408863,5,0,An excellent introduction to the development of Positive Psychology as a specialist field. ,0,0,Suzette Jackson,9785658
51656266~COURSE!~JWd4VXqhEeaDmw5QsxT7tQ,1590730210935,5,0,I learnt a lot on positive psychology and I am ready to learn more on the other 4 courses of this specialization. ,0,0,Silvia Giuseppina Cortese,51656266
27653006~COURSE!~JWd4VXqhEeaDmw5QsxT7tQ,1590726147326,5,0,"The content and the videos are sufficiently simple for those who do not have the background in the related fields. The videos and the assignments are also meant for you to think about yourself and the surroundings, deepening your understanding of self and thoughts.",0,0,Pitshaporn Leelaarporn,27653006
55535134~COURSE!~JWd4VXqhEeaDmw5QsxT7tQ,1590701011669,5,0,Excellent - simply excellent.,0,0,John Worne,55535134
19612304~COURSE!~JWd4VXqhEeaDmw5QsxT7tQ,1590700959030,5,0,Excellent course. Well-organized and stimulating. ,0,0,Georgeta,19612304
57352148~COURSE!~JWd4VXqhEeaDmw5QsxT7tQ,1590649144788,5,0,A course that makes you want to deepen your knowledge of Positive Psychology and especially to experiment for yourself and others. Thank you.,0,0,Jean Luc THOMAS,57352148
28693782~COURSE!~JWd4VXqhEeaDmw5QsxT7tQ,1590620870576,5,0,"This was a great course. It was designed very well. There was a good mix of videos, readings, and discussion prompts, and assignments. The content was truly life changing. This course can be made even better by adding some more up to date content from the last four to five years. Thank you.",0,0,Nil Demircubuk,28693782
53866191~COURSE!~JWd4VXqhEeaDmw5QsxT7tQ,1590607560400,5,0,"Muito bom o curso, foi muito pertinente ao que estava estudando e buscando. Obrigado!",0,0,Diógenes Alexandro Marques,53866191
57198388~COURSE!~JWd4VXqhEeaDmw5QsxT7tQ,1590591970984,5,0,Very interesting course! I have learned a lot from the discussions. ,0,0,Patricia Placides,57198388
6385235~COURSE!~JWd4VXqhEeaDmw5QsxT7tQ,1590491634092,5,0,"Really good course, especially in the time of COVID-19.",0,0,C Verschuur,6385235
53161265~COURSE!~JWd4VXqhEeaDmw5QsxT7tQ,1590451462800,5,0,"Great, easy language but very deep knowledge!",0,0,Luiza Wille Augustin,53161265
40578927~COURSE!~JWd4VXqhEeaDmw5QsxT7tQ,1590410533427,5,0,"I really enjoyed the content, very helpful, than you all.",0,0,Noreen Crowley,40578927
58013798~COURSE!~JWd4VXqhEeaDmw5QsxT7tQ,1590362271446,5,0,"I enjoyed the course, it was a good reintroduction to study after many years of not.  I find it exciting that at last there is a positive use for psychology, including scientific methods and I look forward to learning more.",0,0,Vanessa Buck,58013798
18070958~COURSE!~JWd4VXqhEeaDmw5QsxT7tQ,1590355350425,5,0,Es un curso que de manera practica te enseña los principios de la psicología positiva ,0,0,Diana Velandia,18070958
27077243~COURSE!~JWd4VXqhEeaDmw5QsxT7tQ,1590336119390,5,0,Excellent in so many ways. Impactful and life-changing.,0,0,Leo Cuison Eusantos,27077243
22987067~COURSE!~JWd4VXqhEeaDmw5QsxT7tQ,1590292726538,5,0,It was more of a reflective journey on myself that I took during this course. I think for me it gave a new way of looking at life positively. ,0,0,iresha chamindi,22987067
56963389~COURSE!~JWd4VXqhEeaDmw5QsxT7tQ,1590283866312,5,0,"It is truly awe inspiring to learn about this field and all it can offer us.  Dr. Seligman is just an astonishing individual, loved the entirety of the course.",0,0,nancy prieto,56963389
37763560~COURSE!~JWd4VXqhEeaDmw5QsxT7tQ,1590280215012,5,0,Love this course. Have read some of Dr Seligman's books and am pleased to have now done also part of his courses,0,0,Gabriele Wehler,37763560
39661980~COURSE!~JWd4VXqhEeaDmw5QsxT7tQ,1590258909277,5,0,"Interesting, useful and challenging",0,0,Richard Temple,39661980
29354608~COURSE!~JWd4VXqhEeaDmw5QsxT7tQ,1590240594229,5,0,i liked this course and provided me with good overview and understanding of positive pyschology. good to be able to learn virtually with Dr Martin and fellow colleagues from U. Penn.,0,0,Christina Chan Mei Ling,29354608
21883226~COURSE!~JWd4VXqhEeaDmw5QsxT7tQ,1590220163242,5,0,I learned a lot and my biases and misgivings towards the discipline were cleared. I enjoyed all of the modules and my curiosity was piqued with the researchers presented. ,0,0,KG,21883226
18753458~COURSE!~JWd4VXqhEeaDmw5QsxT7tQ,1590202424062,5,0,I loved the course and I felt it the best program to start your journey of Positive Psychology. Looking forward the other session. ,0,0,devjani Dutta Gupta,18753458
60945539~COURSE!~JWd4VXqhEeaDmw5QsxT7tQ,1590167740273,5,0,This is an eye opener to all people specifically to all Psychology graduate students. ,0,0,Rosyn A. Floranda,60945539
48001959~COURSE!~JWd4VXqhEeaDmw5QsxT7tQ,1590154618417,5,0,Eye opener! Well delivered and lots of topics covered. I was pleased that most lessons were delivered by Dr Martin Seligman himself. Highly recommended this course and the whole Positive Psychology Foundation Course.,0,0,Analia Alvarez,48001959
53167795~COURSE!~JWd4VXqhEeaDmw5QsxT7tQ,1590141812148,5,0,"This course covers a lot of topics in a short amount of time. It is interactive and engaging. I learned a lot, thank you!",0,0,Manon Dangelser,53167795
59130198~COURSE!~JWd4VXqhEeaDmw5QsxT7tQ,1590070275526,5,0,Very practical course with relevant recommendations for improvement to daily living ,0,0,Tan Zuo Ying,59130198
52899411~COURSE!~JWd4VXqhEeaDmw5QsxT7tQ,1590045026709,5,0,"AWSOME, i've learned so much not just about  a possible way to behave but about myself and other people . really reccomended .",0,0,Elena Giannottu,52899411
49566021~COURSE!~JWd4VXqhEeaDmw5QsxT7tQ,1590028030882,5,0,Very good course!,0,0,MARIA LUISA EDWARDS DONOSO,49566021
50514986~COURSE!~JWd4VXqhEeaDmw5QsxT7tQ,1590018164206,5,0,Excelente curso ,0,0,Maria Eugenia Gómez González,50514986
39007416~COURSE!~JWd4VXqhEeaDmw5QsxT7tQ,1590008000995,5,0,I loved participating in this course and learned so much! Thank you!,0,0,Cindy Wright,39007416
54466565~COURSE!~JWd4VXqhEeaDmw5QsxT7tQ,1590007221192,5,0,Excellent course,0,0,Rinaldo Corrazo,54466565
5231426~COURSE!~JWd4VXqhEeaDmw5QsxT7tQ,1589923608939,5,0,"This is a course that I really enjoyed! I founded inspiring and I felt it had a good balance between the lectures, reading, and also on the sharing. It made me take the time to reflect on the content, questioned myself and also review some of the lectures many times as they were very interesting and engaging. Great course. Thank you!",0,0,Alma Escobar,5231426
55008013~COURSE!~JWd4VXqhEeaDmw5QsxT7tQ,1589919181383,5,0,I loved it!,0,0,Judy Ballesteros,55008013
8540945~COURSE!~JWd4VXqhEeaDmw5QsxT7tQ,1589871003267,5,0,"A great practical course where you can learn the topics from the father of Positive Psychology, Three key take
away's from this course are 1) Learned optimism to better health 2)Positive
psychology and healthy ageing 3) Positive psychology , spirituality ,and well
being and their relation",0,0,AKHIL SANTOSH,8540945
25377577~COURSE!~JWd4VXqhEeaDmw5QsxT7tQ,1589775959652,5,0,Fantastic introduction to Positive Psychology.,0,0,Eleanor Carey,25377577
56572861~COURSE!~JWd4VXqhEeaDmw5QsxT7tQ,1589716695357,5,0,"Thank you for this wonderful course not only for myself, but with the hope I can use it to further the well being of others.",0,0,Nina Gross Giannotti,56572861
40654063~COURSE!~JWd4VXqhEeaDmw5QsxT7tQ,1589672499625,5,0,"Very fun., interesting and informative!",0,0,Eden Ford ,40654063
56863050~COURSE!~JWd4VXqhEeaDmw5QsxT7tQ,1589663891869,5,0,"Extremely informative and well done with the right mix of instruction, reading and interactive activities.  ",0,0,Don Eash,56863050
15172258~COURSE!~JWd4VXqhEeaDmw5QsxT7tQ,1589604367700,5,0,"It was an absolute pleasure to learn about Positive Psychology from Dr. Seligman himself...The course was really insightful and helped me understand the basics of Positive Psychology and also areas where it can be applied and the impact thereof. I'm glad I enrolled for this program and am looking forward to attending the other programs in sequence to complete the Foundations of Positive Psychology specialization!Best regards, Vani Vasudeva ",0,0,Vani Vasudeva,15172258
50200283~COURSE!~JWd4VXqhEeaDmw5QsxT7tQ,1589538985269,5,0,I really liked it! Good professors. In the beginning of the course I would love more graphs. However it's very good and I recommend it!,0,0,Thomas Vanhaecht,50200283
56201827~COURSE!~JWd4VXqhEeaDmw5QsxT7tQ,1589471897981,5,0,"Un excelente curso para incrementar el conocimiento sobre los fundamentos de la Psicología Positiva y sus aplicaciones en ámbitos como el periodismo y otros ámbitos profesionales, que podrían ser un aporte en la mayor difusión de este movimiento que ha tenido un notorio incremento en los últimas décadas.Asimismo, aporta investigaciones que permiten profundizar en los conceptos de esta ciencia para su desarrollo.",0,0,Franco Andrés Beiza Silva,56201827
2681914~COURSE!~JWd4VXqhEeaDmw5QsxT7tQ,1589465021605,5,0,Life Changing,0,0,Christine Bulandus,2681914
53992515~COURSE!~JWd4VXqhEeaDmw5QsxT7tQ,1589462235279,5,0,"So incredibily interesting. When working in a corporate world, there is little to none information on positive psychology. This is just an added tool, which I will be using to my skill set, it is the way forward!",0,0,Feline van der Sluijs,53992515
1520350~COURSE!~JWd4VXqhEeaDmw5QsxT7tQ,1589410644585,5,0,"I was delighted, stimulated, and excited that I  could have the opportunity to take this wonderful course online and not have to go to Philadelphia. I learned a lot and was very interested in all the applications of positive psychology in our society. I am taking course two and am enjoying it as well.But of course I wouldn't know of this course if I hadn't take Martin E.P's Seligman's Visionary Science course .",0,0,Elizabeth Fader,1520350
58148030~COURSE!~JWd4VXqhEeaDmw5QsxT7tQ,1589391372269,5,0,"What a great experience to enroll into this class. Positive Psychology has been my lifetime application but I have only been able to learn the theory after real-life practice.  I hope I have chances to apply what I have learned to my community, my children. ",0,0,Lin King,58148030
55446528~COURSE!~JWd4VXqhEeaDmw5QsxT7tQ,1589317988342,5,0,Very comprehensive foundation that leaves one curious to learn more!,0,0,Eva Lesniak,55446528
58974900~COURSE!~JWd4VXqhEeaDmw5QsxT7tQ,1589282145518,5,0,Really good stuff presented in a easy-to-understand manner,0,0,Kennet Hammerby,58974900
49344746~COURSE!~JWd4VXqhEeaDmw5QsxT7tQ,1589279907898,5,0,Great learning.  Highly relevant to my work.,0,0,Su Yin Quah,49344746
52814120~COURSE!~JWd4VXqhEeaDmw5QsxT7tQ,1589257611388,5,0,Martin Seligman's life-long commitment to psychology is admirable. I feel honored to have been able to take his course. I hope one day to be able to meet him in person.,0,0,Alexis Prieto,52814120
6799290~COURSE!~JWd4VXqhEeaDmw5QsxT7tQ,1589169105979,5,0,This has been a great course that has served me as a personal therapy and as a tool to improve my relationships with others. I would highly recommend to anybody needing to focus more in the positive outlooks in life and how to be a better you.,0,0,Danilea Marie Carmona Matos,6799290
26651976~COURSE!~JWd4VXqhEeaDmw5QsxT7tQ,1589167469487,5,0,Excellent context and approach.learnt a lot ,0,0,Andres Pena,26651976
52680224~COURSE!~JWd4VXqhEeaDmw5QsxT7tQ,1589116041891,5,0,"This course was amazing. I have learnt so much from this. This course not only gives you insight into positive psychology, but also helps you grow as a person. Martin Seligman is a wonderful teacher and has really taken alot of time and consideration to make this course interesting and fruitful.",0,0,Tanvi Abrao ,52680224
819619~COURSE!~JWd4VXqhEeaDmw5QsxT7tQ,1589105416898,5,0,"Everyone should take this course. Knowing positive psychology gives you knowledge how to evaluate your emotional state and get to know what exercise you can practice to improve your well-beings and help others around you. After  this course, you will also know the application of positive psychology before and now, and work in process which will flourish in the future. These applications has changed and will keep affecting people in the world with or without our recognition. Positive psychology influences individuals, brings changes to communities  and hopefully will play a role in policies making and education. ",0,0,Michelle Tsai,819619
52419682~COURSE!~JWd4VXqhEeaDmw5QsxT7tQ,1589104640023,5,0,"It is a course of hope. It brings you positive emotion during you are taking the course, learning through it and finished it. I am happy I did it. Dr Seligman is a wonderful tutor. He brings me a new angle to see the future. This course is amazing with a good explanation of what positive psychology is and what we can do better with it. ",0,0,WONG MAN HAN ,52419682
53298560~COURSE!~JWd4VXqhEeaDmw5QsxT7tQ,1589099671480,5,0,"To me it was a great
introduction into positive psychology, its foundations, interests, scope,
future and applications…from individual assistance to community behaviour and broad
media communication, to me it portraits an idea of how to look at your life and
your world, proposing deep insights and ongoing exercises to enhance ownership
to our own and our society’s wellbeing.    ",0,0,Liliana Gelonch,53298560
37882935~COURSE!~JWd4VXqhEeaDmw5QsxT7tQ,1589092490152,5,0,"This course provides the theory, science, data based approach in building well-being and human flourishing. When you understand the theory and practice them and develop them as your habits you really get the benefit from this course.",0,0,Vinod Virmani,37882935
27135573~COURSE!~JWd4VXqhEeaDmw5QsxT7tQ,1589072802737,5,0,Excellent ! loved it all the way !!,0,0,edouard Steinthal,27135573
38934392~COURSE!~JWd4VXqhEeaDmw5QsxT7tQ,1589063314272,5,0,Excellent course full of fascinating information about the emerging field of Positive Psychology.  Dr. Seligman is a terrific instructor and it was an honor to learn from him.,0,0,Debra Kalinosky,38934392
12609360~COURSE!~JWd4VXqhEeaDmw5QsxT7tQ,1589050479564,5,0,I feel blessed by learning and knowing more about positive psychology,0,0,Andre Gunawan,12609360
7189784~COURSE!~JWd4VXqhEeaDmw5QsxT7tQ,1589049598897,5,0,"Very useful, I love it.",0,0,Fermín García Fueyo,7189784
36587359~COURSE!~JWd4VXqhEeaDmw5QsxT7tQ,1588979420810,5,0,Love it!,0,0,Nicolás Giraldo Arenas,36587359
56998299~COURSE!~JWd4VXqhEeaDmw5QsxT7tQ,1588978993563,5,0,I loved this course and would have happily done a longer note in depth coursesI look forward to starting my next course tomorrow! I’m looking at resilience as a follow up. Thank you for all that has been offered. I am grateful. ,0,0,Mira khreino,56998299
30435811~COURSE!~JWd4VXqhEeaDmw5QsxT7tQ,1588971234542,5,0,Thank you Dr. Seligman! This online journey with you is so valuable and I've learned so much in many different ways. Can't wait to share positive phycology with more friends!,0,0,Sobuha Lin,30435811
46882870~COURSE!~JWd4VXqhEeaDmw5QsxT7tQ,1588965061643,5,0,Really enjoyed this course. Well thought out to maximise the learning and connect aspects of positive psychology & applications. Appreciated the additional resources. ,0,0,Eva,46882870
6704966~COURSE!~JWd4VXqhEeaDmw5QsxT7tQ,1588961950538,5,0,"It was very much fruitful, there are applicable practices for well-being in daily life. You also broaden your horizon learning different aspects of  ‘positive psychology’. I look forward to enrolling the next courses. ",0,0,Rahime Belin AKSU,6704966
19122322~COURSE!~JWd4VXqhEeaDmw5QsxT7tQ,1588950788928,5,0,"Absolutely wonderfull""",0,0,Pablo Roca Morales,19122322
53747462~COURSE!~JWd4VXqhEeaDmw5QsxT7tQ,1588941703161,5,0,excellent programme - ,0,0,nicolas lefevre,53747462
1349166~COURSE!~JWd4VXqhEeaDmw5QsxT7tQ,1588881433434,5,0,I cant wait to learn more about the use of Positive Psychology and well-being in my private counseling and coaching practice.,0,0,Matthew D. Miller,1349166
58461441~COURSE!~JWd4VXqhEeaDmw5QsxT7tQ,1588880658020,5,0,I found this introductory level to the course very exciting and thorough! It has certainly awakened my thinking of how I could incorporate this into my everyday work and life. ,0,0,Denise Meade-Hill,58461441
7615489~COURSE!~JWd4VXqhEeaDmw5QsxT7tQ,1588842658396,5,0,This course gave a broad and fundamental overview of positive psychology and was highly engaging!,0,0,daimei,7615489
54153501~COURSE!~JWd4VXqhEeaDmw5QsxT7tQ,1588834128117,5,0,So great. ,0,0,Sikolohistang Gala,54153501
55988680~COURSE!~JWd4VXqhEeaDmw5QsxT7tQ,1588812566965,5,0,The information in this course was revelation after revelation and really inspired with the knowledge of its practical applications out there in the wide world. Personally I also gained lots of knowledge and found the activities useful in restoring my own experience of PERMA daily. Thank you Dr Martin Seligman and colleagues for all of the wonderful contributions you are making to humanity.,0,0,Sin Mariani,55988680
35990722~COURSE!~JWd4VXqhEeaDmw5QsxT7tQ,1588786068917,5,0,Excellent content and easily appliable in daily life. ,0,0,Sabrina Chacin,35990722
18514966~COURSE!~JWd4VXqhEeaDmw5QsxT7tQ,1588719523158,5,0, while they are the best professors in the field of positive psychology it was easy for a beginner like me to understand the information in the course in a very smooth way ,0,0,Sherein Abo El Goukh,18514966
56030650~COURSE!~JWd4VXqhEeaDmw5QsxT7tQ,1588679406281,5,0,"El mejor curso on line, fascinada de las clases con el dr. Seligman y de las personas que lo apoyaron.  Quiero saber más acerca de esta ciencia. Excelente curso",0,0,Alejandra Duarte,56030650
606431~COURSE!~JWd4VXqhEeaDmw5QsxT7tQ,1588650407143,5,0,Great course with wonderful concepts and stories to make it a better world. The course was easy to follow and do well in a limited period of time. Thank you Dr. Seligman and the team for putting it together so nicely and making it available on Coursera.  ,0,0,Anil Maheshwari,606431
52161218~COURSE!~JWd4VXqhEeaDmw5QsxT7tQ,1588646219531,5,0,Excelente curso!! Entrega una visión completa de la psicología positiva y los profesores manejan muchos datos para basar sus conclusiones en hechos reales. Lo recomiendo 100%,0,0,Pamela Canepa,52161218
54658390~COURSE!~JWd4VXqhEeaDmw5QsxT7tQ,1588611012232,5,0,I believe Positive Psychology should be a required general education call in all colleges. ,0,0,Brittany Halstead,54658390
