id,reviewedAt,rating,isMarkedHelpful,reviewText,productCompleted,mostHelpfulVoteCount,users,user_id
1752330~COURSE!~JWd4VXqhEeaDmw5QsxT7tQ,1540719890136,5,0,Fantastic course! I really have benefited from this course in my current job. I am excited to continue and work towards my PHD in psychology after this course. ,0,0,Gloria I Gerard,1752330
37115395~COURSE!~JWd4VXqhEeaDmw5QsxT7tQ,1540511728504,5,0,"I support this science based psychology. I use this and I build organizations built on this.  Doc, knows his stuff and it works. Coming from the military and being Master Resilient trainer for the Army. I know this works and have seen the capabilities in it. ",0,0,Jason A Chizek,37115395
35563340~COURSE!~JWd4VXqhEeaDmw5QsxT7tQ,1540137497619,5,0,"Excellent course, well presented, easy and fun to navigate through.  Great experience. ",0,0,Vivian Perez,35563340
36729701~COURSE!~JWd4VXqhEeaDmw5QsxT7tQ,1539936758450,5,0,"Excellent training and well being for you, your family , your",0,0,Laura ANGIBOUST,36729701
1983873~COURSE!~JWd4VXqhEeaDmw5QsxT7tQ,1539802305267,5,0,Very useful and eye opener course. Thank you,0,0,behice,1983873
36071729~COURSE!~JWd4VXqhEeaDmw5QsxT7tQ,1539570941884,5,0,Simply the best course I have ever made in my entire life and carreer! Thank you all serious researchers that produced It and mainly to Dr Seligman for all his sincere work. Thank you very very much!!!,0,0,Felipe Fernandes Hess,36071729
30628891~COURSE!~JWd4VXqhEeaDmw5QsxT7tQ,1539487531872,5,0,"Una experiencia que se debe de vivir.Una aventura apasionante por este nuevo camino de la psicología, así lo defino. Mejoras tu vida, tus relaciones y tu felicidad. Si hay algo que vale la pena es eso.",0,0,Antonio Sánchez Vásquez,30628891
17455436~COURSE!~JWd4VXqhEeaDmw5QsxT7tQ,1539415473453,5,0,This course is simply excellent. You begin by learning where we have erred in history and then go on to learn about how quickly and easily we can correct this. I took this course as a pre-curser to a Life Coaching course that I want to begin next year and now I just can't wait for it to begin because of what I now know about PP!,0,0,Ash Brassington,17455436
2337148~COURSE!~JWd4VXqhEeaDmw5QsxT7tQ,1539198652921,5,0,Good lectures with interesting homework and assigments that are fun and easy! Loved the research findings that they reported and the new fields that are emerging from Positive Psychology!,0,0,Angeliki Lazaraki,2337148
27822578~COURSE!~JWd4VXqhEeaDmw5QsxT7tQ,1539014603021,5,0,It was a truly helpful course and I strongly recommend it for people who are interested in psychology.,0,0,Francez Fernandez,27822578
6436391~COURSE!~JWd4VXqhEeaDmw5QsxT7tQ,1538770929372,5,0,"Excelente, muchas gracias.",0,0,María del Consuelo Ortiz Reguer,6436391
29712162~COURSE!~JWd4VXqhEeaDmw5QsxT7tQ,1538408599508,5,0,Fantastic!,0,0,Alessandro Garau,29712162
14668224~COURSE!~JWd4VXqhEeaDmw5QsxT7tQ,1538241203228,5,0,Mind opening - a must !,0,0,Αθανασιος Στεργιου,14668224
36071681~COURSE!~JWd4VXqhEeaDmw5QsxT7tQ,1538186533316,5,0,"Excelent. I was really in ""flow"" along the course.. Dynamic, didactic and with practical applicability in everyday life.",0,0,Cecilia Eliane Gagetti Duarte,36071681
6489649~COURSE!~JWd4VXqhEeaDmw5QsxT7tQ,1538046727401,5,0,I thought since I read Dr. Seligman's books I did not need it however I enjoyed the course.Thank you,0,0,Rasha Roshdy,6489649
35827278~COURSE!~JWd4VXqhEeaDmw5QsxT7tQ,1537882986311,5,0,it has just broadened my horizon ,0,0,Saima Qamar,35827278
34628466~COURSE!~JWd4VXqhEeaDmw5QsxT7tQ,1537810882825,5,0,I've learned a lot about positive psychology and I love it. ,0,0,Erandeni Suchil Perez,34628466
35729167~COURSE!~JWd4VXqhEeaDmw5QsxT7tQ,1537649295520,5,0,Fantastic insight into the field of Positive psychology.  I thoroughly enjoyed learning about the applications interventions and the direction into the future.,0,0,Arron Learmond,35729167
1156255~COURSE!~JWd4VXqhEeaDmw5QsxT7tQ,1537238286414,5,0,The Techniques you will learn in the first week will put your life in order.,0,0,Sydney Arouza,1156255
13169305~COURSE!~JWd4VXqhEeaDmw5QsxT7tQ,1537234288041,5,0,"Altamente recomendable, la información es actual y en todo momento la información y actividades propuestas invitan al trabajo personal. Es una excelente oportunidad de aprender y crecer.",0,0,Luz María Rosas Salcedo,13169305
13877832~COURSE!~JWd4VXqhEeaDmw5QsxT7tQ,1537036128047,5,0,Love this course!,0,0,Shan-Jyun Wu,13877832
26857755~COURSE!~JWd4VXqhEeaDmw5QsxT7tQ,1536875514499,5,0,"Absolutely loved this class! It was transformative for me personally, as well as in my work as a therapist. ",0,0,Laura Marie Hogan,26857755
1774932~COURSE!~JWd4VXqhEeaDmw5QsxT7tQ,1536844501159,5,0,"Very interesting, enjoyed it, thank you.",0,0,Aliona Lyubimova,1774932
23761261~COURSE!~JWd4VXqhEeaDmw5QsxT7tQ,1536795261602,5,0,Best professor ever:  Martin Seligman.  ,0,0,Monica Solorzano Romero,23761261
3932949~COURSE!~JWd4VXqhEeaDmw5QsxT7tQ,1536756944545,5,0,Excellent cous! Thank you,0,0,Luca Schio,3932949
16118993~COURSE!~JWd4VXqhEeaDmw5QsxT7tQ,1536709741967,5,0,Great way to learn about Positive Psychology,0,0,Fabien Cros,16118993
6579772~COURSE!~JWd4VXqhEeaDmw5QsxT7tQ,1536698153053,5,0,"I would like to thank Dr. Seligman and all the course instructors for their valuable insights about positive psychology and how important is it for personal, national and global well being. I have started this personal journey of broadening my understanding about this science and how it could be used to heal myself and others and infuse the concept of hope and seeing goodness in one's own self and others, and building on those strengths. Thanks coursera team for providing me the financial aid to complete this course and i look forward to your support for helping me complete this specialization, which then i can spread to people who i work with and care for.",0,1,Noorudin Merchant,6579772
33330686~COURSE!~JWd4VXqhEeaDmw5QsxT7tQ,1536666139914,5,0,"This is such a wonderful course where I have learned so much.  The more importantly, I am using what I have learned in real life. To be happier.",0,0,Zhao Wu,33330686
35575702~COURSE!~JWd4VXqhEeaDmw5QsxT7tQ,1536610822067,5,0,Very practical and love the pace of the speech.  Very clear.,0,0,Winnie Yip,35575702
29713165~COURSE!~JWd4VXqhEeaDmw5QsxT7tQ,1536274661177,5,0,"Amazing course, really interesting!",0,0,louise hansen,29713165
32361715~COURSE!~JWd4VXqhEeaDmw5QsxT7tQ,1535853574247,5,0,I learned invaluable techniques in this class and recommend it highly. ,0,0,Nancy Mandell,32361715
32935511~COURSE!~JWd4VXqhEeaDmw5QsxT7tQ,1535730417695,5,0,This course is inspiring and I feel encouraged to go ahead developing myself and support people to flourish! ,0,0,Andrea Narja Heberling,32935511
756489~COURSE!~JWd4VXqhEeaDmw5QsxT7tQ,1535486517766,5,0,The course was stimulating - I always looked forward to working on it.  It was in-depth and at the same time enjoyable.  I'm looking forward to the next course in the series.,0,0,Christi Kochifos Caceres,756489
23240944~COURSE!~JWd4VXqhEeaDmw5QsxT7tQ,1535404434725,5,0,"Awesome!  Thank You!  I am Grateful for all of the efforts of the Faculty, Staff and fellow students on this journey.",0,0,Lucinda Dalrymple,23240944
35050279~COURSE!~JWd4VXqhEeaDmw5QsxT7tQ,1535318936547,5,0,I loved the learning part of the course and assignments which enable us to become a better human being ,0,0,Yerling L Rana Oviedo,35050279
9632392~COURSE!~JWd4VXqhEeaDmw5QsxT7tQ,1535262286716,5,0,Glad to learn lot of experimental positive psychology tools to use in day to day life and helped to practice positive psychology coaching through this course. Thank you Coursera for this opportunity.,0,2,Manikanta Kamatam,9632392
35205132~COURSE!~JWd4VXqhEeaDmw5QsxT7tQ,1535050707963,5,0,"This course opened my eyes and gave me in-depth knowledge on positive psychology and its applications. This has helped me help my clients change mindsets, set new goals and see themselves in better light. I cannot wait to finish the specialization.",0,0,Cellie,35205132
885699~COURSE!~JWd4VXqhEeaDmw5QsxT7tQ,1535020977394,5,0,Exceptionally good and usefule course,0,0,pravin Kumar,885699
34228341~COURSE!~JWd4VXqhEeaDmw5QsxT7tQ,1534844821332,5,0,its a great course,0,0,Abigail Siangazi,34228341
8728159~COURSE!~JWd4VXqhEeaDmw5QsxT7tQ,1534816822738,5,0,Great course! I learned so much that I can use with my own life and work,0,0,Carol S Brusca,8728159
6182751~COURSE!~JWd4VXqhEeaDmw5QsxT7tQ,1534775336642,5,0,Really happy with this course. Probably the best I've taken! Great quality of information and amazing teachers. Thanks!,0,0,Aldana Isabel Presser,6182751
35558926~COURSE!~JWd4VXqhEeaDmw5QsxT7tQ,1534738148695,5,0,Great foundations!,0,0,Joanne Bowen,35558926
17888213~COURSE!~JWd4VXqhEeaDmw5QsxT7tQ,1534735665869,5,0,nice,0,0,María José,17888213
29347194~COURSE!~JWd4VXqhEeaDmw5QsxT7tQ,1534673624968,5,0,"This is a fantastic course for anybody who is interested in Positive Psychology, the tools to increase well-being, and the application of Positive Psychology in various disciplines.. It provides a solid research and evidence based approach that shows the benefits of Positive Psychology for individuals, communities, and society at large. ",0,0,Ben,29347194
35094837~COURSE!~JWd4VXqhEeaDmw5QsxT7tQ,1534648521862,5,0,"enjoyed the course, great learning experience, I can already feel the positivity in my life",0,0,Najmul Hassan,35094837
35023567~COURSE!~JWd4VXqhEeaDmw5QsxT7tQ,1534570514032,5,0,"very useful and helpful, both for life and career.",0,0,叶舟,35023567
35246538~COURSE!~JWd4VXqhEeaDmw5QsxT7tQ,1534569238007,5,0,"This is a great course, I highly recommend it! I am a university student and this provided a great overview of what positive psychology is, its roots and history, present practices and research, as well as future goals. It shows how impactful positive psychology and positive education are and how they have successfully been implemented into many different segments. This course should be taught in schools! It really gets people interested and thinking!",0,0,Kaya Reingold,35246538
35485479~COURSE!~JWd4VXqhEeaDmw5QsxT7tQ,1534326300627,5,0,I am riding this so interesting I don't want to close my computer ,0,0,Jodi Livesley,35485479
33368280~COURSE!~JWd4VXqhEeaDmw5QsxT7tQ,1534261036026,5,0,Great overview of science of positive psychology. Can’t wait to delve deeper and apply what we have learnt. ,0,0,Lemuel Ng,33368280
35496068~COURSE!~JWd4VXqhEeaDmw5QsxT7tQ,1534120516941,5,0,"Fast paced, very well explained. Useful for everyday and leaves you with an overall good feeling and hopes for the future. The life that we dream of, is attainable. ",0,0,Paola Rico,35496068
35480302~COURSE!~JWd4VXqhEeaDmw5QsxT7tQ,1534118139110,5,0,Thank you for this excellent course!  It was wonderful to hear from Dr. Seligman and from the researchers applying positive psychology in so many areas of life.,0,0,Jacqueline Pauls,35480302
339986~COURSE!~JWd4VXqhEeaDmw5QsxT7tQ,1533929779038,5,0,Great course. Highly recommended.,0,0,Johnzakour,339986
27258664~COURSE!~JWd4VXqhEeaDmw5QsxT7tQ,1533763037253,5,0,"It is good opportunity to attend this course direct from Mr. Seligman, it is a privilege, I really liked the course and look forward for the next ones about positive psychology.",0,0,Francisco Ortiz Torres,27258664
34994497~COURSE!~JWd4VXqhEeaDmw5QsxT7tQ,1533523104755,5,0,I recommend this course for people that want to change their lives and have new perspectives for Positive Psychology.,0,0,Deleted Account,34994497
5267699~COURSE!~JWd4VXqhEeaDmw5QsxT7tQ,1533481649872,5,0,I feel myself richer and wiser after going through this course. Well structured and interactive,0,0,simona ,5267699
32289503~COURSE!~JWd4VXqhEeaDmw5QsxT7tQ,1533275595100,5,0,"always used to wonder why we always look at the dark side of things why not have a solution centric brighter approach . this course provides all tools to use this strategy , which i m already trying to do in a small way . have formed a group of 30 people and there each montn in a session we work on positive interventions , on a particular emotion",0,0,Manju ,32289503
2049862~COURSE!~JWd4VXqhEeaDmw5QsxT7tQ,1533242175863,5,0,Wonderful course- wonderful material and teachers. I love it! ,0,0,Pleasance,2049862
14093251~COURSE!~JWd4VXqhEeaDmw5QsxT7tQ,1533189771966,5,0,It's a great and wonderful course. ,0,0,Mo Ibrahim,14093251
7253498~COURSE!~JWd4VXqhEeaDmw5QsxT7tQ,1532570976036,5,0,"I highly recommend this course if you are really interesting in know more about Positive Psychology. This is a great course to start, Dr. Seligman and their students know about what they are talking about. So value for me. Thank you so much. ",0,0, Arianna González Arias,7253498
17695906~COURSE!~JWd4VXqhEeaDmw5QsxT7tQ,1532521267777,5,0,This course in such a short time provides a huge amount of knowledge and information. It's not just theory but a lot of techniques and exercises that you can apply in your life. I'm very grateful to the whole team and Prof. Martin Seligman especially for the huge work they've done. It's incredible! ,0,0,Anna Yaremenko,17695906
7201338~COURSE!~JWd4VXqhEeaDmw5QsxT7tQ,1532485183617,5,0,Simplesmente incrível!,0,0,Carina Alice de Oliveira,7201338
12081316~COURSE!~JWd4VXqhEeaDmw5QsxT7tQ,1532348004824,5,0,Amaizing! Thank you everything!,0,0,Dr. Sinkó Erika,12081316
34609440~COURSE!~JWd4VXqhEeaDmw5QsxT7tQ,1532321586149,5,0,"i love this. the knowledge i learnt from this course will stay with me for a very long time. it will help my career, my relationships, myself - strongly recommended",0,0,Wong Ki Yan Carren,34609440
34642759~COURSE!~JWd4VXqhEeaDmw5QsxT7tQ,1532320428908,5,0,Great course. Felt I learned enough to help me understand something about this field and the direction it's going in. It also gave me some wonderfully useful tools for improving my own life.  Well worth it - felt like I learned from the very best - the one and only Martin Seligman! Thank you. ,0,0,Susan McGuire,34642759
21974681~COURSE!~JWd4VXqhEeaDmw5QsxT7tQ,1531883801808,5,0,"An amazing course.Such a privilege to learn from the Dr. Martin Seligman himself, albeit online.",0,0,Regina Grace Pasion,21974681
9169767~COURSE!~JWd4VXqhEeaDmw5QsxT7tQ,1531814241017,5,0,A complex course that is definitely an eye opener. ,0,0,Oana Bogdescu,9169767
5306133~COURSE!~JWd4VXqhEeaDmw5QsxT7tQ,1531787625183,5,0,Thanksfor a great course.  ,0,0,Deleted Account,5306133
34187713~COURSE!~JWd4VXqhEeaDmw5QsxT7tQ,1531786920884,5,0,Fantastic!!!!!!!!,0,0,Adriana Leite de Almeia Souza,34187713
15892552~COURSE!~JWd4VXqhEeaDmw5QsxT7tQ,1531771227443,5,0,"Excelente curso, muy completo y dinámico. Gracias Dc. Seligman , es un honor ser parte de esta nueva ciencia.",0,0,SUSAN MEYLLIN,15892552
10284445~COURSE!~JWd4VXqhEeaDmw5QsxT7tQ,1531662160881,5,0,"Research basted ""Happiness"" metrics is new to me. Will be very useful in my advocation of mentoring under-achieving young people",0,0,Hal Pray,10284445
32702391~COURSE!~JWd4VXqhEeaDmw5QsxT7tQ,1531362287232,5,0,"I like that this course is simple and easy to understand despite how complicated it looks. The lecturers were thorough with the discussions, examples used were easy to understand, as well as the activities.",0,0,marjorie bantilan,32702391
34457526~COURSE!~JWd4VXqhEeaDmw5QsxT7tQ,1531319302964,5,0,very informative and engaging,0,0,oshra cohen,34457526
2033415~COURSE!~JWd4VXqhEeaDmw5QsxT7tQ,1531198423633,5,0,Great overview of the field of Positive Psychology. Really liked the assignments. Video's were informative. Great teachers.,0,0,Marinka Versteeg,2033415
30391129~COURSE!~JWd4VXqhEeaDmw5QsxT7tQ,1531147454198,5,0,"This MOOC, together with the other 4 MOOC of Positive Psychology from the University of Pennsylvania, changed my life. I highly recommend it to everyone regardless whether you are interested or not in psychology.",0,0,Víctor Ocampo,30391129
25513418~COURSE!~JWd4VXqhEeaDmw5QsxT7tQ,1530874068747,5,0,I had an amazing experience in this course.,0,0,Ravina Chowdhary,25513418
2260305~COURSE!~JWd4VXqhEeaDmw5QsxT7tQ,1530713542590,5,0,Great,0,0,yichicai,2260305
4978644~COURSE!~JWd4VXqhEeaDmw5QsxT7tQ,1530661792322,5,0,Amazing and life changing!,0,0,Emanuela Campos,4978644
4265181~COURSE!~JWd4VXqhEeaDmw5QsxT7tQ,1530645053428,5,0,"Really insightful course. Original, innovative and revolutionary. All those 3 factors based on 5 decades of scientific research by one of the most world recognized psychologist.",0,0,Alfonso Cuvi,4265181
19387861~COURSE!~JWd4VXqhEeaDmw5QsxT7tQ,1530566103378,5,0,Thank you Dr.Seligman for bringing this class to me. I can feel I am gradually changing to a positive person,0,0,Deleted Account,19387861
34033431~COURSE!~JWd4VXqhEeaDmw5QsxT7tQ,1530556832862,5,0,"The course was easy to follow, engaging and had great references to very useful books and articles around positive psychology. Most importantly it was acting as a great differentiator in my life to increase well-being.",0,0,Ramachandra Vishnubhatta,34033431
32216108~COURSE!~JWd4VXqhEeaDmw5QsxT7tQ,1530458494019,5,0,"I am so grateful and intrigued by this course, and the possibilities are endless. This I find very exciting.",0,0,Michael John Theron,32216108
8661322~COURSE!~JWd4VXqhEeaDmw5QsxT7tQ,1530089960482,5,0,"This course open my mind for a whole new field of the psychology, actually of the science.",0,0,Mariana Peternelli,8661322
10937403~COURSE!~JWd4VXqhEeaDmw5QsxT7tQ,1530074480880,5,0,This is a MUST TAKE COURSE!,0,0,lorenia arriola,10937403
34411269~COURSE!~JWd4VXqhEeaDmw5QsxT7tQ,1529953088792,5,0,It was a wonderful introduction to Positive Psychology. I will continue on to the other four courses. I wish I would have known I was getting graded I would have tried harder to get 90%. Thanks to all the great instructors. I have my reading material for the next year. Any chance there is a bibliography of all the sited articles and books?,0,0,Tamara B Mendelson,34411269
9544526~COURSE!~JWd4VXqhEeaDmw5QsxT7tQ,1529943456723,5,0,"Really liked this course, I learned a lot about positive psychology and about myself as well. A lot of great material is covered, intersting perspective, great lectures. Would recommend to anyone.",0,0,Kawtar Charif Khalifi,9544526
34359784~COURSE!~JWd4VXqhEeaDmw5QsxT7tQ,1529602526505,5,0,"Engaging,exciting and novel to me. Something to look forward to in education.",0,0,Ma luisa C Castro,34359784
33805356~COURSE!~JWd4VXqhEeaDmw5QsxT7tQ,1529600806687,5,0,Its really excellent course and we will get idea how to deal of life.Thank you so much,0,0,PRAVEEN KUMAR T D,33805356
6105040~COURSE!~JWd4VXqhEeaDmw5QsxT7tQ,1529072982246,5,0,"Positive experiences all round! It contains interesting material that is well presented, strategies that you can implement immediately and assessments that make you engage with the material. I would highly recommend this course.",0,0,Brian Trought,6105040
16012533~COURSE!~JWd4VXqhEeaDmw5QsxT7tQ,1528984399255,5,0,I cannot express how beneficial this course could be to so many of people in the world. A well designed course for those wanting to learn more about thinking more positively and looking after your well being.,0,0,Saira Tanna,16012533
11048181~COURSE!~JWd4VXqhEeaDmw5QsxT7tQ,1528982448891,5,0,"Martin Seligman, father of positive psychology is a genius. I recommend this course to everyone - people working (or even not working) in any field or domain. It provides a basic knowledge of well-being, and if done seriously has the power to completely alter the way you conduct yourself on day-to-day basis.",0,0,Vandana Khatuja,11048181
7609283~COURSE!~JWd4VXqhEeaDmw5QsxT7tQ,1528737013056,5,0,"Originally, I was taking this for only career and educational purposes. However, this course immediately began to support me personally. I have been able to utilize the information I am learning in trials I am experiencing and have experienced in my life. Thank you.",0,0,To Niya M Scott-Smith,7609283
33642793~COURSE!~JWd4VXqhEeaDmw5QsxT7tQ,1528670232091,5,0,Amazing course! I highly recommend it! :),0,0,Heather Dunn,33642793
34391073~COURSE!~JWd4VXqhEeaDmw5QsxT7tQ,1528643924762,5,0,"Excellent presentation and, for me, alternative to searching for a psychologist who practices positive psychology for actual therapy! I am very much in need of exactly this type of therapy and, having been in therapy over the years, and working in the field of medicine for years, I feel like a sponge...this course speaks to me! Thank you, Dr. Seligman!",0,0,Lorraine J Cardillo,34391073
29606633~COURSE!~JWd4VXqhEeaDmw5QsxT7tQ,1528583153521,5,0,A life changing opportunity to understand the science and rational behind the pursuit and application of well-being practices.,0,0,Lucas Del Priore,29606633
27012310~COURSE!~JWd4VXqhEeaDmw5QsxT7tQ,1528542809857,5,0,"Lots of this course is of course the natural of who I am a natural ingredient based on a happy childhood, great friends, long relationships, but it also rewealed a gret deal about new foundings and possibilities, especially at times that has started to appritiate the oppositeMy qoute ""When the world tells you you are a bad boy, tell it like it is not bad not bad at all and with a smile""",0,0,Magnus Karlsson,27012310
32380721~COURSE!~JWd4VXqhEeaDmw5QsxT7tQ,1528453024004,5,0,"
Well
 structured course with scientific foundation and professionals trained 
in several areas of knowledge, dedicated to a more fraternal and 
supportive world.

",0,0,Mônica Quirino,32380721
2112345~COURSE!~JWd4VXqhEeaDmw5QsxT7tQ,1528385514817,5,0,"I have really engaged in this course! I have been applying the apprenticeships in my day to day, sharing them with my wife, in order to improve our relationship and prepare to receive our first daughter. In addition, it has been a very important impulse to continue with my professional development as a teacher and researcher in sports education. I have renewed my commitment to introduce positive psychology in sports education for young people.",0,0,Fede Carreres,2112345
27121040~COURSE!~JWd4VXqhEeaDmw5QsxT7tQ,1528355364344,5,0,Excellent course!,0,0,Charles Sellman,27121040
22728981~COURSE!~JWd4VXqhEeaDmw5QsxT7tQ,1528293506141,5,0,Great course with exposure to lovely positive psychology material. ,0,0,Conroy Fourie,22728981
2275900~COURSE!~JWd4VXqhEeaDmw5QsxT7tQ,1528264014136,5,0,"a very basic and grounded understanding  of what it means to look at the world from a different  lens of positivity , hope and resilience and making it a better place . Insightful for psychologists to make a shift in their perspective . ",0,0,Aditi kaul,2275900
33853351~COURSE!~JWd4VXqhEeaDmw5QsxT7tQ,1528221767304,5,0,I have thoroughly enjoyed all the sessions. It has been vast learning and insight into Positive Psychology and the effect it has on people's lives. ,0,0,Prity Pathak,33853351
33783646~COURSE!~JWd4VXqhEeaDmw5QsxT7tQ,1528147508270,5,0,Great course! Filled with tons of interesting information. I definitely feel like I am taking away integral life lessons and new life-perspectives from this course. Excited to take more of Dr. Seligman's classes!,0,0,Asia Bui,33783646
33244716~COURSE!~JWd4VXqhEeaDmw5QsxT7tQ,1527869632172,5,0,So far excellent!,0,0,Kim Yvette Bates,33244716
34005127~COURSE!~JWd4VXqhEeaDmw5QsxT7tQ,1527278365292,5,0,"I am a professor of social work and took this out of curiosity without expecting to be as excited and challenged by the material as I was. This course really expanded my knowledge and my way of thinking about positive psychology and psychology in general, even though these were areas I had knowledge in already. I highly recommend this to anyone with the slightest interest-- you will be hooked after the first lecture. The course is incredibly well done, steeped in science, offers personal growth experiments, and is of the highest quality. I am impressed and grateful for the opportunity.",0,0,Lydia Ogden,34005127
33336170~COURSE!~JWd4VXqhEeaDmw5QsxT7tQ,1527275940468,5,0,I loved this course. It changed my life and my view of things. Only by listening to the lectures increased my wellbeing. I'm very grateful for this course.,0,0,Geraldine Wackers,33336170
3233223~COURSE!~JWd4VXqhEeaDmw5QsxT7tQ,1527209457941,5,0,"It is a great course. Dr. Seligman started from his own personal experience and offered us a full picture about how he was guided to the theory of positive psychology.  From the learned helplessness to the notion of positive psychology, it is helpful to understand the initial ideal of his theory.",0,0,Lingfei Sun,3233223
33309568~COURSE!~JWd4VXqhEeaDmw5QsxT7tQ,1526811007691,5,0,Wonderful absolutely loved it!,0,0,Jane Wundersitz,33309568
33667389~COURSE!~JWd4VXqhEeaDmw5QsxT7tQ,1526759563232,5,0,I find this course to be both informative and stimulating. I love the topic and hearing about the future applications and possibilities.,0,0,Constance Leach,33667389
33658069~COURSE!~JWd4VXqhEeaDmw5QsxT7tQ,1526662205049,5,0,"I had no idea there was so much to know about this field of positive Psychology. Now I cannot imagine how there are still 4 courses left, but I have no doubt they will blow my mind like this first one did! ",0,0,Kari Kruger,33658069
33504614~COURSE!~JWd4VXqhEeaDmw5QsxT7tQ,1526630538845,5,0,Fantastic course. Thoroughly enjoyable and assisted me on a personal level too.,0,0,Christine Alain Verhoeven,33504614
21977620~COURSE!~JWd4VXqhEeaDmw5QsxT7tQ,1526401670509,5,0,It is very useful for personal life,0,0,Sardar Pritham Singh,21977620
7670711~COURSE!~JWd4VXqhEeaDmw5QsxT7tQ,1526369275039,5,0,"Loved it - great introduction, wonderful re-introduction to Pos' Psych' and many of its off shoots",0,0,Simon Brownlie,7670711
33702165~COURSE!~JWd4VXqhEeaDmw5QsxT7tQ,1526344459392,5,0,Very interesting and informative. I would highly recommend!,0,0,Amanda Schold,33702165
