id,reviewedAt,rating,isMarkedHelpful,reviewText,productCompleted,mostHelpfulVoteCount,users,user_id
82166018~COURSE!~JWd4VXqhEeaDmw5QsxT7tQ,1630026483867,1,0,No peer to review,0,0,Huy Tong,82166018
11399739~COURSE!~JWd4VXqhEeaDmw5QsxT7tQ,1629747616288,1,0,"It all could have been condensed in 10 minutes, really. Instead of telling the stories how successful the methods have worked in different studies, they would have been much better spent actually telling what the methods are. There are really 1.5 methods in the whole 4 week course explained.",0,0,Mikita Piatrouski,11399739
37747161~COURSE!~JWd4VXqhEeaDmw5QsxT7tQ,1604788359772,1,0,Worst lecturer ever! Couldn't go on with the course because of him!,0,1,Dajena Qorllari,37747161
38622843~COURSE!~JWd4VXqhEeaDmw5QsxT7tQ,1549755226959,1,0,"Starts with a very interesting Module that talks about the concept of Positive Psychology and its key elements, but then goes into less interesting and relevant topics such as different experiments over the years and journalism. ",0,2,Sigal Cordeiro,38622843
33383509~COURSE!~JWd4VXqhEeaDmw5QsxT7tQ,1530244214591,1,0,"There is stuff to be learned here, but... The course delivery is dreadful. The lectures are extremely repetitive and you will have to sit through hours of Martin Seligman talking about which VIP he sat next to at a very important function and every other unimportant detail to get to the crux of the information. This course comes across as a sales pitch much of the time, (as do his books). A shame, as his philosophy is indeed very helpful and the strategies he suggests (when you finally get to hear them) can be life changing.",0,5,Anna Sheppard,33383509
16574443~COURSE!~JWd4VXqhEeaDmw5QsxT7tQ,1522271204593,1,0,Positive psychology is about as scientific as Scientology. ,0,1,Jared Emry,16574443
8285989~COURSE!~JWd4VXqhEeaDmw5QsxT7tQ,1499027087061,1,0,"Gag.  This entire course was devoted to Seligman worship (led, as usual, by Seligman).Does the entire UPenn faculty just suck up to him all the time?  Isn't it time credible academics move on from the lazy, unscientific twaddle of PERMA and make your own way, even without the big Templeton Foundation dollars that Uncle Marty still pulls in?",0,2,Bob Richard,8285989
2171278~COURSE!~JWd4VXqhEeaDmw5QsxT7tQ,1497460468407,1,0,"Useless course. Just a bunch of repetitions of anecdotes chopped up in tiny clips with way too many pointless popup questions. Let me save everyone some time and summarize this course: ""Being positive is good for you."" You will have to figure out for yourself how to do that, because this course will not teach you. ",0,2,Japke Zonneveld,2171278
10985383~COURSE!~JWd4VXqhEeaDmw5QsxT7tQ,1497143680098,1,0,"The vedios are not available for the course, only scriptions can't get a feel of the teachers/professor's teaching style.  ",0,1,Shuo Xu,10985383
51353624~COURSE!~JWd4VXqhEeaDmw5QsxT7tQ,1584880819427,2,0,"I dropped this class because it was too self-reflective. I wanted to learn the subject, not analyze myself. ",0,2,"Devon MacEachron, PhD",51353624
32687128~COURSE!~JWd4VXqhEeaDmw5QsxT7tQ,1533587219841,2,0,very theoretical ,0,1,Sara Alshareef,32687128
10938596~COURSE!~JWd4VXqhEeaDmw5QsxT7tQ,1515282793755,2,0,A big jumble and often a ego trip for Seligman who seems to think he is the father of everything and gives no credit to his forefathers in humanistic psychology or the like. The course lacks coherence and substance.,0,5,Andrew Kirtland,10938596
837656~COURSE!~JWd4VXqhEeaDmw5QsxT7tQ,1505659884117,2,0,"I think it would be better to go deeper on the PERMA. The ""RMA part"" was lacking in my opinion. But the VIA survey and the Positive Journalism (I prefer the term Constructive Journalism) was ok for me.",0,1,Guilherme Salgado Braga,837656
26763374~COURSE!~JWd4VXqhEeaDmw5QsxT7tQ,1501561225903,2,0,The first couple lectures were interesting. I had a hard time listening and reading the remainder ones due to being too technical and not as interesting for my field. I am interested in learning practical interventions that I can utilize with my clients. I had difficulties paying attention to some of the lessons due to being not as practical to my client as I expected (information that I did not find it applied to help my clients due to being too theoretical and out of scope).,0,2,Betania Guerra,26763374
4636164~COURSE!~JWd4VXqhEeaDmw5QsxT7tQ,1493582885689,2,0,I honestly thought this course was all over the place and too general. It also seemed to be full of self - congratulations about what UPENN has accomplished with its research.   I wanted more depth in a more targeted approach to improving my life. ,0,2,Andrew Bailey,4636164
121464245~COURSE!~JWd4VXqhEeaDmw5QsxT7tQ,1674718731789,3,0,"The main premise of well-being as a definable, measurable and achievable goal is exciting.  The discussions could have been denser.  The professor was a bit repetitive and too self focused.   ",0,0,Isabell DeAnda,121464245
67912913~COURSE!~JWd4VXqhEeaDmw5QsxT7tQ,1667063380313,3,0,I​t starts good in the first videos but then there are no really interesting information coming. It gets boring. And the connection to religion and the military was too much for me.,0,0,klibidophie,67912913
113715751~COURSE!~JWd4VXqhEeaDmw5QsxT7tQ,1666450240813,3,0,I​t really needs updated for 2022 because the data is getting old and everything has changed after COVID.,0,0,Jennifer Wilmetti,113715751
3410889~COURSE!~JWd4VXqhEeaDmw5QsxT7tQ,1640570699651,3,0,"I enjoyed the content very much.  I give it a 3 instead of a 4 due to the Positive Journalism piece (I was not impressed with the presenter), and the repetetive nature of the articles to read.  ",0,0,Daniel Svoboda,3410889
12172181~COURSE!~JWd4VXqhEeaDmw5QsxT7tQ,1640083982609,3,0,What I would have loved to see more in the course would be deeper context of Positive Psychology. Towards week 3 we just moved to many directions. This might also be because of my limited awareness about the subject which I am committed to improve with each passing day,0,0,anurag sinha,12172181
93889215~COURSE!~JWd4VXqhEeaDmw5QsxT7tQ,1633952410961,3,0,"Interesting, Beginners' course to give you  'glimpse' of this exciting new field in modern psychology. Also takes you to some brief  basic dimensions of Positive Health & Positive constructive Journalism. If seriously interested in the subject, would do further follow-up course/s already provided under Dr. Seligman.",0,0,ABHIJIT ROY,93889215
80939999~COURSE!~JWd4VXqhEeaDmw5QsxT7tQ,1613232983728,3,0,"I am so grateful to be able to hear about this research from the founder of the field and those colleagues who are engaged in taking the field forward into the future. I wish that the readings had been more substantial (even if they were optional) and I wish  that there were more exercise to do. This was an interesting overview of the state of the field, but the readings were journalistic and surface level.",0,2,Leslie Kaplan,80939999
46974349~COURSE!~JWd4VXqhEeaDmw5QsxT7tQ,1611329142016,3,0,"A bit too much of Seligman's person, I was here in this class to learning how positive psychology could be useful and if I get some informations i got more on the professor studies than in the current fields of positive psychology. In someway and ads for his books and to congrats the university ",0,2,Courbe Michollet Nicolas,46974349
64899102~COURSE!~JWd4VXqhEeaDmw5QsxT7tQ,1609779819878,3,0,"very shallow content, seems to me like he is just trying to show off how great he is. It's a pain to listen to Seligman, though the other lecturers are great",0,1,Kim,64899102
70440363~COURSE!~JWd4VXqhEeaDmw5QsxT7tQ,1599973817801,3,0,I thoroughly enjoyed this course and consider it a good induction to Positive Psychology.  It has given me the foundation and interest to pursue further studies and I am particularly interested in the research.,0,1,Janis Frost,70440363
60728684~COURSE!~JWd4VXqhEeaDmw5QsxT7tQ,1593288508858,3,0,I did not receive the support that I required .I believe that the course and the quizzes were translated in French . It is taking me too long to even follow a module . ,0,1,Marie Helene Bijoux,60728684
13968966~COURSE!~JWd4VXqhEeaDmw5QsxT7tQ,1591110051650,3,0,"The course is an easy introduction to positive psychology. I found the addition of post-doc and experts to be disjointed and that they could have been introduced better. Context as to why these experts were part of the course would help. I also feel the course lacked an overall structure, power point slides, and more good quiz questions. The activities were helpful and I have incorporated them into my life.",0,1,Ernie Doherty,13968966
48659716~COURSE!~JWd4VXqhEeaDmw5QsxT7tQ,1582010210456,3,0,I enjoyed the content but really want to know HOW to implement things like learned optimism and mindfulness.,0,3,Sonya Culverwell,48659716
48134548~COURSE!~JWd4VXqhEeaDmw5QsxT7tQ,1581453332489,3,0,"Really good beginning, but then kind of veered off into tangents.  Would have preferred a deeper dive into the practices, research, and applications of Positive Psychology in a therapeutic setting.",0,2,Jim Thomson,48134548
36173140~COURSE!~JWd4VXqhEeaDmw5QsxT7tQ,1577905328065,3,0,The Instructor seemed very knowledgeable in the course materials.  But this course was way over my head.,0,1,Jacques B Campbell II,36173140
9397543~COURSE!~JWd4VXqhEeaDmw5QsxT7tQ,1574417440554,3,0,This course is more an advertisement to Positive psychology.. No practical methods are thought..,0,2,Vladimir Horak,9397543
15598958~COURSE!~JWd4VXqhEeaDmw5QsxT7tQ,1566666547220,3,0,"I think you need more practical information and not so much theorical information, also i would like better use of the audiovisual ressources. ",0,2,María Belén Ugalde,15598958
12725924~COURSE!~JWd4VXqhEeaDmw5QsxT7tQ,1564328265495,3,0,There was a lot of repetition among the speakers on what they covered in their section. ,0,1,a.aidurus,12725924
34552508~COURSE!~JWd4VXqhEeaDmw5QsxT7tQ,1560184562559,3,0,I's a bit slow,0,1,Paula Cristina Monteiro de Carvalho,34552508
38636034~COURSE!~JWd4VXqhEeaDmw5QsxT7tQ,1554741939676,3,0,"Technical issues, and listening to Dr. Seligman gurgle were the problems that I had in this course. If worked out, I would give it a five.",0,1,Steven Fuson,38636034
37865111~COURSE!~JWd4VXqhEeaDmw5QsxT7tQ,1545035189122,3,0,"Easy to follow, but did stray into the theological space in the end.  Overall, I would recommend this course if you are looking for a broad summary of the topic.  Seligman is certainly vibrant and engaging, the other presenters less so. ",0,1,Matthew Wilson,37865111
2208878~COURSE!~JWd4VXqhEeaDmw5QsxT7tQ,1535887074086,3,0,"Starts good ends rather, well, boring",0,2,Dominik Wexenberger,2208878
443353~COURSE!~JWd4VXqhEeaDmw5QsxT7tQ,1522003833396,3,0,"My rating is not for the course but the course price. I had to pay for the entire specialisation to just take this one course. Dr. Seligman should see that his course at least here, is affordable. That would be philanthropy and not force people to pay for the entire specialisation. ",0,2,Subhasis Chattopadhyay,443353
24402103~COURSE!~JWd4VXqhEeaDmw5QsxT7tQ,1509441998685,3,0,"As an introduction to positive psychology, the course material did seem a bit random. The topics covered were certainly interesting, but as they exclusively reflected the interests and activities of Marty Seligman and his Post-Docs at UPenn, the course provided a somewhat skewed sample of information that was a bit odd to present in an introductory course. Also many of the technical details were off. Quiz questions were repeated, sections of videos were cut off at random, and the time estimates were often way off. Having said all of that, I did learn a lot! ",0,3,Micah Kaats,24402103
28725453~COURSE!~JWd4VXqhEeaDmw5QsxT7tQ,1507861137897,3,0,"The first two weeks were excellent because they provided valuable information about the basic concepts of Positive Psychology. As the course continued, I felt it moved away from these basics into related topics that themselves could be specific courses. Additionally, we heard from other speakers but I wanted my teacher to be primarily Martin Seligman.",0,2,Amy Kweskin,28725453
4312503~COURSE!~JWd4VXqhEeaDmw5QsxT7tQ,1503566247747,3,0,"The course was way too basic. Maybe, few more papers, names of books, articles could be shared.I was specially bored of Constructive Journalism and Spirituality bit.I loved all of Seligman's sessions, Big data in Psychology, Resilience and Open Experience bits.May be include more Profs in the course - Barbara Fredrickson, Tal Ben-Shahar, Shaun Achor, Angela Duckworth and the like.",0,1,Yashowardhan Chaturvedi,4312503
787413~COURSE!~JWd4VXqhEeaDmw5QsxT7tQ,1493194217367,3,0,"Advantages:1) I liked the idea of filming the lectures of Dr Seligman in the real class. Watching his videos, I felt like I was sitting is the lecture room with other students.2) I also enjoyed watching different researchers talking about their fields of study. Inviting different speakers makes the course more diverse.Areas of improvement:1) Design. Some of the presentations in the videos were not in the style of the course (e.g. videos on constructive journalism)2) Structure. The overall impression is that different parts of the course were not reconciled with each other, leading to fragmentation of the course. It concerns not only design, but also video lenght (for example videos on constructive journalism were way too long) and lack of a sigle thread going through all the videos and supplementary materials. It seems that the course has been made in a hurry.",0,3,Polina Beloborodova,787413
123621174~COURSE!~JWd4VXqhEeaDmw5QsxT7tQ,1676392944472,4,0,"Good material, glad I did it and glad to find this positive, science-based focus on well-being. Can't give it a full 5 stars because the transcription of lectures is not good. ",0,0,Thomas Harry,123621174
81180714~COURSE!~JWd4VXqhEeaDmw5QsxT7tQ,1673991608787,4,0,Great information and course. ,0,0,Kurt Sigmund,81180714
1689254~COURSE!~JWd4VXqhEeaDmw5QsxT7tQ,1669584897113,4,0,"it was perfect journey with Dr. Martin Seligman, but i wished to know more on how to apply this in my life",0,0,May Hassan,1689254
105811002~COURSE!~JWd4VXqhEeaDmw5QsxT7tQ,1667929179403,4,0,"Overall this was an excellent course - great balance of feedback, videos, and quizzes. Week 4 had long videos which were harder to get through. The journalism video lagged quite a bit. Overall very happy! ",0,0,Mariam Vahradyan,105811002
4362921~COURSE!~JWd4VXqhEeaDmw5QsxT7tQ,1667150644225,4,0,"I​ enjoyed all the material this course offered, it was exiting to pass from material to material, topic to topic. However, it would be very enriching to have a topic of varied and specific examples of how to pracrtice; have some exercises to follow and achieve a positive mindset. ",0,0,Carla Granier,4362921
116629616~COURSE!~JWd4VXqhEeaDmw5QsxT7tQ,1666838857708,4,0,E​s un excelente curso que te permite conocerte internamente y te enseña nuevas estrategías para afrontar de forma positiva las diversas dimensiones de problemas.,0,0,Adán Quispe Abarca,116629616
103389017~COURSE!~JWd4VXqhEeaDmw5QsxT7tQ,1666631347996,4,0,N​ice course,0,0,Angel Ochoa Palomino,103389017
51145695~COURSE!~JWd4VXqhEeaDmw5QsxT7tQ,1661171257857,4,0,A perfect introduction to such an important specialization. ,0,0,Jason Colero,51145695
106231707~COURSE!~JWd4VXqhEeaDmw5QsxT7tQ,1659982967651,4,0,I loved almost all the information but zoned out a bit on the Big Data part. But that's just my own lack of interest in that kind of topic,0,0,Sarah Pedro,106231707
8245910~COURSE!~JWd4VXqhEeaDmw5QsxT7tQ,1659627799847,4,0,"It was a useful, above average course.",0,0,Rex Winkelhake,8245910
22481686~COURSE!~JWd4VXqhEeaDmw5QsxT7tQ,1658948443629,4,0,"I​ really enjoyed doing this course. The course's content, videos and activities were all excellent.  I would have wanted more information about the character strengths, positive psychology interventions and practical activities though. ",0,0,Ama Gav,22481686
55833329~COURSE!~JWd4VXqhEeaDmw5QsxT7tQ,1657935830211,4,0,"If you are curious to learn what Positive Psychology is, especially if this is a field you are considering a career in, this course gives a good overview. It's not overly scientifc so easy to understand for those without a psych background. Dr. Seligman is engaging and it's wonderful to learn directly from the father of Positive Psychology himself!",0,0,Wendy Marcy,55833329
93246506~COURSE!~JWd4VXqhEeaDmw5QsxT7tQ,1656493597757,4,0,"I​t is very good course, just the subjects needs to be continous, I mean to have a link that is more obvious between one model and the other.",0,0,Dr. Taha Basheer,93246506
10366089~COURSE!~JWd4VXqhEeaDmw5QsxT7tQ,1655270877910,4,0,"overall a good experience for me.

but the last part about journalism is a bit boring, feeling of irrelevant to me.",0,0,杨忠礼,10366089
23404038~COURSE!~JWd4VXqhEeaDmw5QsxT7tQ,1652938888206,4,0,"G​ood material. Not totally my cup of tea, but quite interesting nonetheless.",0,0,Paul,23404038
57056166~COURSE!~JWd4VXqhEeaDmw5QsxT7tQ,1652292689341,4,0,T​he start up music was pretty disturbing if you listen to it again and again,0,0,Sohail Ejaz,57056166
11538604~COURSE!~JWd4VXqhEeaDmw5QsxT7tQ,1651386480971,4,0,"I enjoyed this course. I would have liked more case studies and research provided. wtih summary sheets.Also would have liked more  tasks or activities you could apply in real life. I know we had some, but would have liked more. to see how creatively this can be applied. Would also have liked more on the limits of this approach. it's not all perfect. where it fails or what helps frame it in discussions with others. i didn't like how the notes were provided for download. format is terrible.key summary sheets would hlep. top points and take aways. resources from this could be better provided. ",0,0,Dani Sirotic,11538604
51620547~COURSE!~JWd4VXqhEeaDmw5QsxT7tQ,1647565348212,4,0,Positive psychology is not what I expected. It is rooted in science and has the ability to be used in many professions.  ,0,0,MaryLynne Filaccio,51620547
37942696~COURSE!~JWd4VXqhEeaDmw5QsxT7tQ,1641260162072,4,0,​I liked the class but there were not a lot of other students participating. The course itself is good but I didn't learn anything from my classmates. I didn't realize there were four more classes until I completed this one.  I plan to go ahead with the rest of them because I want to apply what I learn to getting a better job.,0,0,Christopher Gregory Woods,37942696
17096988~COURSE!~JWd4VXqhEeaDmw5QsxT7tQ,1639408847416,4,0,I​t will change your perspective on many things. Embrace the impact!,0,0,Mohammad Abdelwahab,17096988
88887070~COURSE!~JWd4VXqhEeaDmw5QsxT7tQ,1636286603896,4,0,C​ontent is well presented and interesting to take in. My other complaint is that some of the links and examples are old (2014 or so). Would be nice to have updates resources. ,0,0,Sara Utecht,88887070
24715847~COURSE!~JWd4VXqhEeaDmw5QsxT7tQ,1634526860223,4,0,"T​he pace and amount of content was just about right for a course like this.  I felt sometimes that the readings were a bit superfluous, but the videos were great.",0,0,Anand Ramachandran,24715847
85595826~COURSE!~JWd4VXqhEeaDmw5QsxT7tQ,1632268651161,4,0,Very insightful course! Glad I got the opportunity to take it. Tons of new information.,0,0,Kimberly Stevens-Johnson,85595826
70504939~COURSE!~JWd4VXqhEeaDmw5QsxT7tQ,1632263101271,4,0,it was a good opportunity for me to upgrade my knowledge in field of positive psychology.,0,0,Parham Mehdian,70504939
88607303~COURSE!~JWd4VXqhEeaDmw5QsxT7tQ,1629965537885,4,0,r​eally helpful,0,0,Jin Ying,88607303
89598848~COURSE!~JWd4VXqhEeaDmw5QsxT7tQ,1629708228203,4,0,Old school,0,0,Rogier Seegers,89598848
23006045~COURSE!~JWd4VXqhEeaDmw5QsxT7tQ,1629279111145,4,0,M​arty and Johannes were very engaging. The other speakers need to spruce up their delivery to be a little more passionate.,0,0,Shariq Khwaja,23006045
6291037~COURSE!~JWd4VXqhEeaDmw5QsxT7tQ,1628478611056,4,0,"I liked it and it has motivated me to know more, I already knew some of the things that were seen and I would have liked there to be more practical exercises but I imagine that as the specialty progresses there will be more.",0,0,Claudia Erika Kuri Saucedo,6291037
88717635~COURSE!~JWd4VXqhEeaDmw5QsxT7tQ,1628347443053,4,0,Lots of great content split up into manageable chunks. It was good to be able to alter the speed of the videos. I find using the notes feature difficult.  ,0,0,Laura Rose-Baker,88717635
88747909~COURSE!~JWd4VXqhEeaDmw5QsxT7tQ,1627887115655,4,0,Great presenters with interesting and thought provoking information.  Thank you one and all.,0,0,Lisa Palmer,88747909
85905857~COURSE!~JWd4VXqhEeaDmw5QsxT7tQ,1627324375656,4,0,Course started off very good but some of the topics / speakers were not engaging.,0,0,Jennifer Harrison,85905857
47112149~COURSE!~JWd4VXqhEeaDmw5QsxT7tQ,1625848152985,4,0,Good course. I will attend the classes of following courses on Positive Psychology to issue a comprehensive report.,0,0,Hercules Celescuekci,47112149
86353180~COURSE!~JWd4VXqhEeaDmw5QsxT7tQ,1625565596005,4,0,"The content and the subject were pretty good. If I have to say my opinion about adding or revising, education can be enriched by giving speeches or examples of people who have changed their lives by applying positive psychology. it was beautiful. thank you.

Kübra",0,0,KÜBRA SÜRÜCÜ,86353180
86675413~COURSE!~JWd4VXqhEeaDmw5QsxT7tQ,1623208683651,4,0,This course have equipped me with many useful tools to be applied for others' and my well-being.,0,0,Patee Poonpanyatawee,86675413
86324776~COURSE!~JWd4VXqhEeaDmw5QsxT7tQ,1621306642293,4,0,very nice course,0,0,Vandana N Revankar,86324776
75352537~COURSE!~JWd4VXqhEeaDmw5QsxT7tQ,1620100182546,4,0,Enjoyable introduction but it seems to be just the tip of the iceberg to Positive Psychology.  I'm looking into learning more to for the knowledge and skills gain.,0,0,Abraham Hill,75352537
5511755~COURSE!~JWd4VXqhEeaDmw5QsxT7tQ,1620080942064,4,0,"Amazing! a bit too much with how Positive psychology is expanded at the end with big data and others, but amazing! Thank you!!!!",0,0,Jorge,5511755
84633157~COURSE!~JWd4VXqhEeaDmw5QsxT7tQ,1619968983234,4,0,Very interesting. Amazing content and good exercises. There are some tech issues with the week 4.,0,0,barbara favre,84633157
80291959~COURSE!~JWd4VXqhEeaDmw5QsxT7tQ,1614011576857,4,0,"Overall easy to follow and logical in most cases. Some information is very superficial, but interesting and can be seen as additional topics. These can be followed by other means in self-supported further study.The course is interesting, as Martin Seligman walks you through the history of the topic and explans the concepts from the side of his story. That makes it very entertaining and explains contexts.",0,0,Nadja Feddermann,80291959
78081596~COURSE!~JWd4VXqhEeaDmw5QsxT7tQ,1613372652844,4,0,"Great course, useful and interactive enough, although there are a few points that could be improved: I miss the personal feedback from lecturers on my assignments. Indeed, only one assignment was peer reviewed, and a peer, although nice and supportive, will not push you to expand your knowledge and improve on your thinking.  Also, it was not easy to find the peer reviews. It would be great if they arrived in your mailbox as soon as done... instead, I had to wait, and then find my way back to the assignment at the end of the course, and discover that, yes, I had been peer reviewed. I am not sure whether any one has left any 'upvote' or 'comment' on the other submissions I have given via the discussion forums. It would be too time consuming to check them all. Again, it would be nice to have one place were all your assignments and submissions and their feedback is gathered (rather than stroll through pages and pages of discussions). Or may be this exists but I do not know about it? Another point: I do not know if the two peer reviewers were other students or staff members (I saw that there were moderators for the course). It would be nice to know.   Last point: in the tests, it would be nice to know if several answers are possible rather than just one, as I often got caught having only one good answer while there were 2 expected. I guess I just picked the best one and did not realise I could add more...Thank you for reading! I am looking forward to the next class. ",0,0,Karine CHAGNE,78081596
8245882~COURSE!~JWd4VXqhEeaDmw5QsxT7tQ,1612463258352,4,0,A good course for an introduction to the subject.,0,0,Pietro Gardi,8245882
80065138~COURSE!~JWd4VXqhEeaDmw5QsxT7tQ,1611961657990,4,0,The section on big data is especially impressive.,0,0,R Brand,80065138
79032855~COURSE!~JWd4VXqhEeaDmw5QsxT7tQ,1610217381749,4,0,I think it would be helpful if there is a chance to ask a trainer,0,0,farah jamal,79032855
16189040~COURSE!~JWd4VXqhEeaDmw5QsxT7tQ,1609610212006,4,0,"Informational course with a lot of experiences and data. I would see a potential improvement in the questions/discussions and quizzes. For especially the quizzes were somewhat incorrect in question/answer correlation. However, I would gladly take the course again and can only recommend it as an introduction to the world of Positive Psychology.",0,0,Ondrej Svec,16189040
22805798~COURSE!~JWd4VXqhEeaDmw5QsxT7tQ,1609263083691,4,0,"It would be nice if the instruction was given in a means more like a Tony Robbins or other motivational speaker, polished, with stories.  The um's and pace of the videos varied in qualities and I found myself running most of the videos in 125% speed.  The content was good and the exercises can be applied to keeping connection with the content.  ",0,0,Tim Dibble,22805798
