id,reviewedAt,rating,isMarkedHelpful,reviewText,productCompleted,mostHelpfulVoteCount,users,user_id
97896613~COURSE!~Ld8dfjBHEeuN1gopiww94Q,1643489177297,1,0,"It is a bad idea to have loud background music playing during language instruction videos. I could not hear the lecturer because of this loud music, so I have unenrolled. A shame, because I really want to learn Korean.",0,1,Lisa Chiong,97896613
80760532~COURSE!~Ld8dfjBHEeuN1gopiww94Q,1620587398052,2,0,It was decent but not that great. Lots of errors in the content and even some quizzes are locked (they want you to pay for quizzes and certificate) which is pretty bad since they never mention it until you reach week 5-6. Quizzes from w. 1-4 are available though...,0,21,William W,80760532
50278760~COURSE!~Ld8dfjBHEeuN1gopiww94Q,1631526611177,3,0,"Overall it was good. Just too bad that have to pay for the last 2 modules graded quiz. The lecture notes/textbooks are too simple. Yet, some of the words in the sentences are note explained (which made me confused: like is this part of the grammar or vocab?)Have to write down a lot of notes and look up to the google on certain words especially the whole course not enough of vocab. The module 1-5 last reading article have TOTALLY not module related articles at all. It would be great if replaced with ""review"" of the modules notes/summary. Overall, the course is very simple and very easy to understand. ",0,8,Kim Kim Ng,50278760
82290065~COURSE!~Ld8dfjBHEeuN1gopiww94Q,1626153277665,3,0,"I​ liked the course, my only problem was that, especially at the end, a lot of the korean words were mistranslated in the videos/",0,4,BTS outsold,82290065
76420917~COURSE!~Ld8dfjBHEeuN1gopiww94Q,1662560068091,4,0,g​ood course,0,0,G M Shakhawat Hossain,76420917
100655555~COURSE!~Ld8dfjBHEeuN1gopiww94Q,1653879966071,4,0,Los videos de práctica de la unidad 6.4 tienen errores de traducción.  El resto del curso perfecto. GRACIAS.-,0,0,Dra. Vanina J. Simon,100655555
84148360~COURSE!~Ld8dfjBHEeuN1gopiww94Q,1646110742192,4,0,There are some english translation errors through out the course but nothing major enough to take away from learning the content. I really liked the speaking parts the most since that is the most important element of learning a language.,0,1,Corrinne Smith,84148360
97126947~COURSE!~Ld8dfjBHEeuN1gopiww94Q,1643977107052,4,0,the material provided is very easy to understand,0,0,sheyllma nabila,97126947
72183816~COURSE!~Ld8dfjBHEeuN1gopiww94Q,1637848015878,4,0,"This course is fun and simple. We can understand every lesson easily, suitable for the beginners as it should. Thank you to the teacher and crews.",0,0,Olivia Ruthmana,72183816
91701054~COURSE!~Ld8dfjBHEeuN1gopiww94Q,1631979413800,4,0,"I​ like this course! The explanation was clear and understandable however some practices had shown different grammar with the lesson. But, it's okay. Thank you!",0,0,Desvy,91701054
58350100~COURSE!~Ld8dfjBHEeuN1gopiww94Q,1626922872327,4,0,"buen curso, algo mas avanzado,  recomiendo aprender el alfabeto coreano a través de otro curso o medio. hay pequeños errores en los subtítulos al ingles por lo tanto ciertas cosas se hacían algo confusas. pero fuera de eso logre aprender mucho.",0,2,israel constanzo,58350100
85437902~COURSE!~Ld8dfjBHEeuN1gopiww94Q,1622930188296,4,0,This course was really good u should also do it they explain so well.,0,0,Fizza Shahid,85437902
121990787~COURSE!~Ld8dfjBHEeuN1gopiww94Q,1677435905682,5,0,"Der Kurs war sehr gut, dynamisch und der kursleiter war sehr nett감사합니다",0,0,Sheila Vollhardt,121990787
110274977~COURSE!~Ld8dfjBHEeuN1gopiww94Q,1676684911191,5,0,Excelente curso,0,0,EvaYliana,110274977
82861347~COURSE!~Ld8dfjBHEeuN1gopiww94Q,1676474807567,5,0,Good,0,0,Adriana Martania,82861347
122313361~COURSE!~Ld8dfjBHEeuN1gopiww94Q,1675717493244,5,0,"This class is very good, it really helps me to improve Korean.  the material provided through videos, exercises, vocabulary and quizzes really helps add insight into daily life in Korean",0,0,Utari Retno Augustin,122313361
118034310~COURSE!~Ld8dfjBHEeuN1gopiww94Q,1675166734159,5,0,"﻿It was so helpful , thank you ",0,0,asmaa yousef,118034310
118583503~COURSE!~Ld8dfjBHEeuN1gopiww94Q,1674460659900,5,0,﻿I'm so glad to learn Korea language from this course. That was amazing experience. The  course video's explain you every small things. I recommend to you all you have to take this course and start your  Korean language journey with this course. ,0,0,Varsha,118583503
110147811~COURSE!~Ld8dfjBHEeuN1gopiww94Q,1674439203510,5,0,﻿excelente ,0,0,Natalia Rincón,110147811
91103426~COURSE!~Ld8dfjBHEeuN1gopiww94Q,1674399268495,5,0,muy lindo el curso <3,0,0,William Matías Vásquez Errickson,91103426
93577538~COURSE!~Ld8dfjBHEeuN1gopiww94Q,1673359178144,5,0,"great course, thank you so much",0,0,Maprang Prawatpattanakul,93577538
108604490~COURSE!~Ld8dfjBHEeuN1gopiww94Q,1672345836117,5,0,"This course really helped me a lot especially from the grammar point of view. I really enjoyed this course while learning basic grammar points and vocabulary.  I would like to thank our professor, ""Won-Sook Hyun,"" for making this course easy and understandable for beginners like me. ",0,0,Naveen Ghani Qureshi,108604490
80098323~COURSE!~Ld8dfjBHEeuN1gopiww94Q,1670799766559,5,0,No pude realizar los ultimos examenes porque estan bloqueados para quienes no estamos interesados en el certificado pero excelente curso. Claro que necesita complementarse con otros cursos pero el contenido es muy bueno,0,0,Vero F,80098323
81496507~COURSE!~Ld8dfjBHEeuN1gopiww94Q,1670620336430,5,0,I learned grammar that help in everyday conversations,0,0,Maryam Magdy,81496507
68398921~COURSE!~Ld8dfjBHEeuN1gopiww94Q,1670472480991,5,0,"thank you very much for giving this opportunity, it was very helpful and useful <3",0,0,Adysti Niken Febrianti,68398921
107554100~COURSE!~Ld8dfjBHEeuN1gopiww94Q,1669556904726,5,0,It is great course,0,0,Muhammad Bachtiar,107554100
86603009~COURSE!~Ld8dfjBHEeuN1gopiww94Q,1668172109595,5,0,"Amei o curso, ótima explicação o que facilita o entendimento e aprendizagem.  Com exercícios de fixação, diálogos fáceis e gramática explicada. Simplesmente maravilhoso",0,0,Julielen Alves Cardoso,86603009
110802453~COURSE!~Ld8dfjBHEeuN1gopiww94Q,1667215765288,5,0,learning materials are easy to understand,0,0,Diana Yap,110802453
111281142~COURSE!~Ld8dfjBHEeuN1gopiww94Q,1666915679117,5,0,"i​t was very FUN and helpful, will be doing the next korean course in 2023",0,0,sthabile majola,111281142
41100857~COURSE!~Ld8dfjBHEeuN1gopiww94Q,1666900512233,5,0,"It is good, but you need have  to have the essentials . It is not the place if you have zero knowlege about Korean. ",0,0,Ali Wajd Harfouch,41100857
29408028~COURSE!~Ld8dfjBHEeuN1gopiww94Q,1666779418342,5,0,"A really enjoyable course, with pleasant video presentations, useful content, and excellent structure (explaining the unit, illustrating necessary grammar points, providing plentiful practice for consolidation).  ",0,0,Iris Papadopoulou,29408028
103081043~COURSE!~Ld8dfjBHEeuN1gopiww94Q,1664764133049,5,0,"Muchas gracias por todo,por el apoyo y todo el conocimiento que brindan a traves de este curso,sería genial si pudieran incluir en cada leccion una lista de nuevo vocabulario.De nuevo muchas gracias,he aprendido mucho y me siento feliz!",0,0,DIANA  OTALVARO,103081043
111714622~COURSE!~Ld8dfjBHEeuN1gopiww94Q,1663305765496,5,0,"S​enang banget bisa ikut kelas di coursera, bahkan dapat sertifikat juga. Coursera yang terbaik, menyediakan berbagai jenis kelas dengan guru profesional. terima kasih coursera...",0,0,Nurliza,111714622
56450038~COURSE!~Ld8dfjBHEeuN1gopiww94Q,1662173205161,5,0,"Es un curso super completo si estás empezando en el idioma y ya entiendes el Hangul, aprendes nuevo vocabulario y muchos ejemplos de la vida cotidiana.",0,0,Linda Amairani Galicia Torres,56450038
111278019~COURSE!~Ld8dfjBHEeuN1gopiww94Q,1661570863648,5,0,"V​ery useful for someone want to try learning Korean, easy to understand with reasonable pace.",0,0,Lam Tuen Chi,111278019
25785138~COURSE!~Ld8dfjBHEeuN1gopiww94Q,1661209724095,5,0,"This was a very complete course for beginners, I really enjoyed it and I want to continue to expand my knowledge of the Korean language, Thank you all for making this vast amount of amazing Korean language material available.",0,0,Marcos “Obel” Silva,25785138
108800076~COURSE!~Ld8dfjBHEeuN1gopiww94Q,1660746082636,5,0,"This course was perfect .thanks,  sungkyunkwan university for  this great opportunity for foreign students .",0,0,Parinaz khansanamy,108800076
109344613~COURSE!~Ld8dfjBHEeuN1gopiww94Q,1660282833489,5,0,Loved the lecture videos and explanations. Overall it's really helpful for me.,0,0,Ishita Sinha,109344613
106220475~COURSE!~Ld8dfjBHEeuN1gopiww94Q,1659081750557,5,0,Excelente curso ,0,0,RITA NACIRA CASTILLO BRACAMONTE,106220475
96579961~COURSE!~Ld8dfjBHEeuN1gopiww94Q,1657726105694,5,0,Such a good course and very easy to understand.Thank you!,0,0,Chaw Hsu Lwin,96579961
101389648~COURSE!~Ld8dfjBHEeuN1gopiww94Q,1657383245192,5,0,"this course is very helpful to improve my korean language, im learned many things in this course. Thank yu so much for this precious opportunity",0,0,Novita Angelica,101389648
104356024~COURSE!~Ld8dfjBHEeuN1gopiww94Q,1656269584900,5,0,"I truly enjoyed it! Everything was fine. I think, the course is just fine for students, who knows alphabet and can read in Korean already. The course provides detailed textbooks for every lesson, so it is easier to revise it later. The lector, Won-Sook Hyun, is such a lovely woman! 감사합니다.",0,0,Гриценко Катерина Владиславівна,104356024
89556~COURSE!~Ld8dfjBHEeuN1gopiww94Q,1655214031657,5,0,"G​reat course. It would be nice to have a beginners course II, prior to the intermediary. Thanks for the shared content.",0,0,Jorge Virgilio,89556
92221205~COURSE!~Ld8dfjBHEeuN1gopiww94Q,1654403645100,5,0,This course is verry helpful for me. And i say thank you very much,0,0,yuli antika,92221205
71941703~COURSE!~Ld8dfjBHEeuN1gopiww94Q,1652233207406,5,0,This course help a foreign learner like me to able understanding the simple pattern of Korean language based on several topics that related to daily activities,0,1,Izam Dwi,71941703
104344693~COURSE!~Ld8dfjBHEeuN1gopiww94Q,1651505054408,5,0,​it was very interesting and I learned a lot from this course. ,0,0,hsu mt,104344693
45180469~COURSE!~Ld8dfjBHEeuN1gopiww94Q,1651093655048,5,0,Great!,0,0,Marcio Silva,45180469
6391583~COURSE!~Ld8dfjBHEeuN1gopiww94Q,1650302631062,5,0,V​ery good¡¡¡¡,0,0,Ysabel Meseguer Serrano,6391583
93081896~COURSE!~Ld8dfjBHEeuN1gopiww94Q,1649524481514,5,0,Thank you sonsaengnim,0,0,Fatiha Fany Anggraeni,93081896
55603319~COURSE!~Ld8dfjBHEeuN1gopiww94Q,1648668730415,5,0,Enjoyed the course and hope to enjoy more of this. The teacher was also nice.,0,0,Adebiyi Adedoyin,55603319
44938940~COURSE!~Ld8dfjBHEeuN1gopiww94Q,1648361292028,5,0,"Thank you. I got a lot of useful knowledge from this course, but there is one thing that I hope can be improved again is that the translation of the learning text is not very good, many are misunderstood  ",0,0,enelsi mariessa,44938940
78602710~COURSE!~Ld8dfjBHEeuN1gopiww94Q,1646928522261,5,0,this course was amazing for everyone who knows the Korean alphabet and wants to start learning grammar and the historical culture of Korea. thanks for this helpful course.,0,0,BAHAREH ERFANIAN OLFATI,78602710
100483752~COURSE!~Ld8dfjBHEeuN1gopiww94Q,1646428649215,5,0,​The structure of the course was very clear and good. I loved the dialog with the prononciation training and the numerous examples given. ,0,0,Ngereso Noëlle,100483752
95322063~COURSE!~Ld8dfjBHEeuN1gopiww94Q,1646145148062,5,0,This is my best step to learn Korean. 고맙습니다.,0,0,Naz Fairy15,95322063
93069640~COURSE!~Ld8dfjBHEeuN1gopiww94Q,1646134681117,5,0,This course help me,0,0,Nasywa Dwiva,93069640
89979202~COURSE!~Ld8dfjBHEeuN1gopiww94Q,1645929634271,5,0,Muchas gracias por dejarme participar en este curso de verdad los materiales y los videos son de gran ayuda. Espero seguir teniendo más  oportunidades de continuar con mi aprendizaje. De ante mano mil gracias. 감사합니다,0,0,Marye. C Romero,89979202
99725025~COURSE!~Ld8dfjBHEeuN1gopiww94Q,1645070078774,5,0,Highly recommended for people who wish to speak Korean in short time !!,0,0,Michelle Soon Hui Shien,99725025
34002279~COURSE!~Ld8dfjBHEeuN1gopiww94Q,1644471321316,5,0,It's a very useful and good course for Korean language learners.,0,0,Thu Zar Win Lwin,34002279
90751474~COURSE!~Ld8dfjBHEeuN1gopiww94Q,1644267607729,5,0,"Amazing, I loved this course ",0,0, ALEJANDRO DANIEL ANTONIO MEZA,90751474
66040826~COURSE!~Ld8dfjBHEeuN1gopiww94Q,1643667636748,5,0,Highly recommend for a level 1B.  Not beginner concepts but super helpful and very well explained.,0,0,방탄 Deb Beebe,66040826
89244122~COURSE!~Ld8dfjBHEeuN1gopiww94Q,1643590171789,5,0,"Un curso muy interesante, emocionante y con ganas de aprender mucho más acerca del idioma.",0,0,NOHORA LOZADA LOZANO,89244122
97072607~COURSE!~Ld8dfjBHEeuN1gopiww94Q,1643117909656,5,0,I learned a lot here and new language for myself,0,0,Siti Anisa Dwi S,97072607
94597296~COURSE!~Ld8dfjBHEeuN1gopiww94Q,1642165513687,5,0,"I enjoying this lesson, thank you so much.",0,0,aniq fadhilah,94597296
81825714~COURSE!~Ld8dfjBHEeuN1gopiww94Q,1641402468052,5,0,I loved the course. It was full of grammar which is helpful for basic needs and travel. Lots of vocabulary. Explanation was good with examples.,0,1,Swa varma,81825714
75404241~COURSE!~Ld8dfjBHEeuN1gopiww94Q,1641262029975,5,0,I jsut want to say thank you for having this course here. All the best!,0,0,Riza Dizon Official,75404241
93540088~COURSE!~Ld8dfjBHEeuN1gopiww94Q,1640663698511,5,0,T​his course is very helpful and easy to understand! Thank You Coursera and Sungkyunkwan University!,0,0,Olivia Gita Amanda Lim,93540088
95781340~COURSE!~Ld8dfjBHEeuN1gopiww94Q,1639896613288,5,0,A really helpful course. My comprehension of the Korean language and Culture is really good now. Thanks for your courses. I look forward to studying your Intermediate and advanced courses.,0,0,Ulugbek Medetov,95781340
94673700~COURSE!~Ld8dfjBHEeuN1gopiww94Q,1637561858390,5,0,It's fun to learn Korean easily in this course. Thank you so much,0,0,Puspha Ningtias,94673700
97332390~COURSE!~Ld8dfjBHEeuN1gopiww94Q,1637419390199,5,0,Thanks but I couldn't find KR for Beginners II or else? Then I will turn to KR for Intermediate I right?,0,0,Yu CHEN,97332390
93288053~COURSE!~Ld8dfjBHEeuN1gopiww94Q,1636297673436,5,0,Thank you so much ..,0,0,FARHATUL MAULA,93288053
35553498~COURSE!~Ld8dfjBHEeuN1gopiww94Q,1636255286460,5,0,"​I found the course structure extremely helpful for learning Korean as a beginner, particularly grammar points, such as when the same examples are elaborated on. They also provide examples of how the same particle can be used in different ways with example sentences. Good at breaking concepts down. Teaches both casual/informal and formal forms. I would recommend this course for learning Korean grammar!",0,0,Mandeline Chan,35553498
92739475~COURSE!~Ld8dfjBHEeuN1gopiww94Q,1636107400221,5,0,"This was a very best course , I enjoy learning from this course. Not only learning the language but also the culture of Korean. This course very suitable for beginner learners that want to learn, in this Korean Language for Beginners I, I can write and read Hangul and slowly but sure will understand the meaning too. Thank so much Coursera for giving me opportunity to join and learn this course.",0,0,Lija Binti Kamli,92739475
92929478~COURSE!~Ld8dfjBHEeuN1gopiww94Q,1635720292492,5,0,kursus ,0,0,Devi arvi Yanti,92929478
94675155~COURSE!~Ld8dfjBHEeuN1gopiww94Q,1635602976239,5,0,very good and very fun,0,0,Iyyanur Sindi Muslimah,94675155
95241999~COURSE!~Ld8dfjBHEeuN1gopiww94Q,1635311798993,5,0,Good lecture. Thank you,0,0,Ocha Darrel,95241999
85929665~COURSE!~Ld8dfjBHEeuN1gopiww94Q,1635244711152,5,0,its really helpful i enjoy the whole course. Thank you for giving this chance to learn Sungkyunkwan University.hwatitng!,0,0,Rediet Temesgen,85929665
92123050~COURSE!~Ld8dfjBHEeuN1gopiww94Q,1634839302943,5,0,I​ feel it's very nice course for beginer to learn Korean Language,0,0,Hoang Phuoc Long,92123050
51776851~COURSE!~Ld8dfjBHEeuN1gopiww94Q,1634778624488,5,0,Excelente curso!!!,0,0,Tatiana Román Espinoza ,51776851
92740421~COURSE!~Ld8dfjBHEeuN1gopiww94Q,1634711490736,5,0,This is my first course in Coursera and I have fun learning the course for 6 weeks. The quizzes are also good and fun. I really enjoyed all the explanations made by the professors. They made it easier for me to understand each grammar points. Those who have learnt hangeul before can enroll to this course. Totally recommended!,0,0,Adrinna Arun,92740421
92365415~COURSE!~Ld8dfjBHEeuN1gopiww94Q,1634697837306,5,0,baguss dan dapet dimengerti,0,0,Kelly Kimberly,92365415
59231177~COURSE!~Ld8dfjBHEeuN1gopiww94Q,1634036384082,5,0,I find this course helpful in my Korena study journey. I will continue to intermediate level. ,0,0,Reno K R,59231177
92364093~COURSE!~Ld8dfjBHEeuN1gopiww94Q,1633171010675,5,0,"This course is an excellent course. Each video and explanation is easy to understand. I thank Sungkyunkwan University for making this course available. In the future I hope that there will be more of the same course that can help students to get to know Korea more deeply. Finally, I really thank you for giving me a chance to study Korean in this course.",0,0,Ruth Rani Simanjuntak,92364093
60005742~COURSE!~Ld8dfjBHEeuN1gopiww94Q,1632118088639,5,0,Very easy to understand and make me want to learn more,0,0,Ghifari Pratama,60005742
89733611~COURSE!~Ld8dfjBHEeuN1gopiww94Q,1631632211384,5,0,good job,0,0,Nur Izza Muttaqin,89733611
92494140~COURSE!~Ld8dfjBHEeuN1gopiww94Q,1631626440682,5,0,GREAT!!!1,0,0,Deswita Arum Dany,92494140
90973752~COURSE!~Ld8dfjBHEeuN1gopiww94Q,1631590583867,5,0,E​XCELLENT COURSE !,0,0,Zahra Zakiah MJ,90973752
53764583~COURSE!~Ld8dfjBHEeuN1gopiww94Q,1631555822449,5,0,Dieser Koreanischkurs (insbesondere Grammatik und kulturelle Kenntnisse) war für mich sehr interessant und nützlich.,0,0,Szilvia Irma Gyócsi,53764583
80773759~COURSE!~Ld8dfjBHEeuN1gopiww94Q,1631347401455,5,0,Thank You,0,0,Yonanda Dera Puspita,80773759
15203327~COURSE!~Ld8dfjBHEeuN1gopiww94Q,1630503752305,5,0,This course is very good for beginners!,0,0,Rachel Sow,15203327
80938763~COURSE!~Ld8dfjBHEeuN1gopiww94Q,1629412717712,5,0,amazing course,0,0,JUANITA PINZON AGUIRRE,80938763
83428750~COURSE!~Ld8dfjBHEeuN1gopiww94Q,1629171139810,5,0,"It was an amazing course! Excellent class/module structures, engaging teaching and activities overall. It was a pleasure to learn through this :)",0,0,Valentina Serón Moris,83428750
88353498~COURSE!~Ld8dfjBHEeuN1gopiww94Q,1628891672163,5,0,very excellent thank you,0,0,Bosy Sojen,88353498
57817690~COURSE!~Ld8dfjBHEeuN1gopiww94Q,1627929673950,5,0,"El curso es muy interesante y completo. La metodología está muy bien elaborada. En verdad disfruté este curso, muchas gracias",0,0,Tatiana Garnica,57817690
67913712~COURSE!~Ld8dfjBHEeuN1gopiww94Q,1627852564060,5,0,Excellent!,0,0,Claudia Díaz,67913712
62795491~COURSE!~Ld8dfjBHEeuN1gopiww94Q,1627431453649,5,0,"So funny, interesting and valuable",0,0,Diana Gabriela Puerres Narvaez,62795491
62485570~COURSE!~Ld8dfjBHEeuN1gopiww94Q,1627399699954,5,0,Excellent course!!!! helped me learn and understand Korean better.,0,0,Sitara Belliappa B,62485570
65289834~COURSE!~Ld8dfjBHEeuN1gopiww94Q,1627330920699,5,0,"I​ was really helpfull and I enjoyed the struture of the course, I just wish the song were a bit less agitated or lower, I found it difficult to concentrate sometimes. Still, thank you very much for the couse!",0,0,Marina de Lemos,65289834
86839708~COURSE!~Ld8dfjBHEeuN1gopiww94Q,1626593469236,5,0,It was a great learning experience for me. Thank you for this opportunity,0,0,Kanishtha Jain,86839708
88013313~COURSE!~Ld8dfjBHEeuN1gopiww94Q,1626371588201,5,0,very good ,0,0,Violaex,88013313
88579558~COURSE!~Ld8dfjBHEeuN1gopiww94Q,1625929090444,5,0,I really like it because the way I explain it is easy for me to understand and I am more interested in learning Korean,0,1,Mutmainnah,88579558
66589089~COURSE!~Ld8dfjBHEeuN1gopiww94Q,1625575949593,5,0,I love that course!!,0,0,zehranur erol,66589089
36538530~COURSE!~Ld8dfjBHEeuN1gopiww94Q,1624866278939,5,0,T​hank you very much i really learned alot from this course . ,0,2,Solo Hossam,36538530
66666473~COURSE!~Ld8dfjBHEeuN1gopiww94Q,1624592053578,5,0,"No es para personas sin conocimiento del letras coreanas sino para empezar a conversar, así que primero recomiendo llevar un curso de hangul y luego este, fuera de eso es muy bueno y me ayudo mucho a poder empezar a entender conversaciones en coreano y  para poder empezar a comunicarme. Muy recomendado.",0,2,steven de jesus rojas madrigal,66666473
76581000~COURSE!~Ld8dfjBHEeuN1gopiww94Q,1623303924015,5,0,This course is really useful for me. I can learn grammar. the lesson is clear and not boring,0,4,BINTARI SISWI,76581000
85481005~COURSE!~Ld8dfjBHEeuN1gopiww94Q,1622997323927,5,0,c​ourses are vrey clear and easy to understand for foreign leaners.thanks ,0,0,daw lamin,85481005
80786050~COURSE!~Ld8dfjBHEeuN1gopiww94Q,1622825398109,5,0,"El curso realmente fue muy interesante y útil, pude aprender fácilmente los conceptos del idioma. Los videos son muy fáciles de entender y el material teórico es muy útil. ",0,2,María José,80786050
70015424~COURSE!~Ld8dfjBHEeuN1gopiww94Q,1621920722073,5,0,"Me gustó que el curso aparte de enseñar el idioma, te enseña sobre la cultura de Corea, lo básico. Es más avanzado de lo que creí, por lo que recomiendo dominar todo el alfabeto primero o tomar otro curso de nivel básico, de esta manera lo que se enseña aquí será mucho más fácil de internalizar.",0,3,Naomi Tiamare Barrientos,70015424
73865612~COURSE!~Ld8dfjBHEeuN1gopiww94Q,1620695309923,5,0,Good for beginners Easy to learn Love Korean language more 👍🏻,0,1,NITCHAON NITHIPATIKHOM,73865612
69260830~COURSE!~Ld8dfjBHEeuN1gopiww94Q,1619456936512,5,0,I had a great experience throughout the entire course. It not only helped me build my language skills in Korean as well as I learnt a lot about the Korean Culture. It was very helpful for me. ,0,4,Roshnee Patnaik,69260830
74136195~COURSE!~Ld8dfjBHEeuN1gopiww94Q,1616651615572,5,0,very knowledgeable course with easy teaching skills  ,0,1,srishti maggon,74136195
55856663~COURSE!~Ld8dfjBHEeuN1gopiww94Q,1616394181464,5,0,Fun class! I love the grammar sections and have learned a lot of honorific form so I am more confident using it now. 감사합니다,0,1,Worraporn Pipatpongpinyo,55856663
79909327~COURSE!~Ld8dfjBHEeuN1gopiww94Q,1615790142186,5,0,good course to review basic korean ,0,2,Vivian Fung,79909327
