id,reviewedAt,rating,isMarkedHelpful,reviewText,productCompleted,mostHelpfulVoteCount,users,user_id
19749914~COURSE!~loAmvxJgEea8fxLSgUgxeQ,1522537949946,5,0,I would have like to seen how to compare models using KNIME.    For example the hands on could have explored a number of classification models and then simplified this KNIME youtube video to demonstrate how to select the best model using ROC ,0,0,David dornan,19749914
8892030~COURSE!~loAmvxJgEea8fxLSgUgxeQ,1522496767751,5,0,Deep and accurate course.Thank you.,0,0,Mohammed Acharki,8892030
2724589~COURSE!~loAmvxJgEea8fxLSgUgxeQ,1522363066490,5,0,Loved the contents and the explanation for using the different tools motivated me to use them more outside!,0,0,Ing. Juan Habib Bendeck Soto,2724589
1101421~COURSE!~loAmvxJgEea8fxLSgUgxeQ,1522071572479,5,0,"Very good blend of Machine learning and BigData. I like KNIME usage during this course, this helped me to practice without getting too much in to coding",0,0,Nishant Jain,1101421
5077560~COURSE!~loAmvxJgEea8fxLSgUgxeQ,1521960982994,5,0,Much helpful for me in my academics.Excellent...,0,0,Tarun Kumar,5077560
27940742~COURSE!~loAmvxJgEea8fxLSgUgxeQ,1521430331490,5,0,Great course for Machine learning with Big Data,0,0,Vinod Sashittal,27940742
11667054~COURSE!~loAmvxJgEea8fxLSgUgxeQ,1521093556845,5,0,"Good contents, interesting topics, hands-on were good but not very confident with those",0,0,Ali Adnan,11667054
53467~COURSE!~loAmvxJgEea8fxLSgUgxeQ,1520699048149,5,0,"Excelente course, I will continue learning and practicing all the concepts that explained in this course. Thank you!!",0,0,Daniela Vergara Osorio,53467
28155200~COURSE!~loAmvxJgEea8fxLSgUgxeQ,1520696347635,5,0,Great course - would recommend further details towards the end of course lectures..more explanation on the graphs.,0,0,Sunil Bhojwani,28155200
17075430~COURSE!~loAmvxJgEea8fxLSgUgxeQ,1518754017991,5,0,It is very effective course to learn machine learning and big data with their relation.,0,0,Asm Imran Hossain Bhuyan,17075430
22206886~COURSE!~loAmvxJgEea8fxLSgUgxeQ,1517684861335,5,0,Very useful introduction in the field!,0,0,YEVHEN KRASNIANSKYI,22206886
25746723~COURSE!~loAmvxJgEea8fxLSgUgxeQ,1517351811003,5,0,"Excellent content, the hands on exercise can be improved and be more detailed.",0,0,Sabawoon Shafaq,25746723
13907229~COURSE!~loAmvxJgEea8fxLSgUgxeQ,1517328033983,5,0,Great to start with big Data,0,0,Manoj Bhat (M3B),13907229
14125505~COURSE!~loAmvxJgEea8fxLSgUgxeQ,1516387818920,5,0,Good for learning the concepts and techniques of Machine Learning with Big,0,0,Aditya Sinha,14125505
20027445~COURSE!~loAmvxJgEea8fxLSgUgxeQ,1516026023192,5,0,Very well structured and clearly presented course! Thank you for putting this together!,0,0,Grissonnanche,20027445
377460~COURSE!~loAmvxJgEea8fxLSgUgxeQ,1515738145705,5,0,The most interesting course of all specialization. What is missing is deeper insight.,0,0,Lukáš Bernat,377460
24096567~COURSE!~loAmvxJgEea8fxLSgUgxeQ,1515075587535,5,0,Very Well Explained and gather a clear concept,0,0,Anurup Borah,24096567
4918816~COURSE!~loAmvxJgEea8fxLSgUgxeQ,1514822122998,5,0,Great course to understand Machine Learning basics and practice with Spark,0,0,Darius Tamašauskas,4918816
24749535~COURSE!~loAmvxJgEea8fxLSgUgxeQ,1514569172647,5,0,A quite knowledge-full course for the beginners. Enough of practical guidance on ML with Apache Spark and KNIME,0,0,Gaurav Sharma,24749535
11373014~COURSE!~loAmvxJgEea8fxLSgUgxeQ,1513563202754,5,0,Very educational course but doable and fun as well.,0,0,Chesed Mercado,11373014
29803860~COURSE!~loAmvxJgEea8fxLSgUgxeQ,1513534106507,5,0,5/5,0,0,KOUSHIK CHOWDHURY,29803860
14158435~COURSE!~loAmvxJgEea8fxLSgUgxeQ,1513283674607,5,0,Excelente curso!,0,0,Carlos Eduardo de Souza,14158435
26785928~COURSE!~loAmvxJgEea8fxLSgUgxeQ,1512949134601,5,0,I will continue with this on my own.  Started a lot of great discussions with a broad variety of approaches,0,0,James Archuleta,26785928
24911026~COURSE!~loAmvxJgEea8fxLSgUgxeQ,1512137618129,5,0,Very good start to learn Machine Learning,0,0,Tandy Susanto,24911026
3509911~COURSE!~loAmvxJgEea8fxLSgUgxeQ,1511672807728,5,0,Very informative and well presented course.  Thank you!,0,0,Steve Zutaut,3509911
17204815~COURSE!~loAmvxJgEea8fxLSgUgxeQ,1510892738025,5,0,"I really liked this course. The way they walk you through the process is very great. Even though i had done the same process due to working in the industry, i was lacking the terminology and the ability to articulate it, this course made it clear me among many other things. Good way to shed some light on what to expect on a daily basis on the job as a data scientist. Thank you for the great work. ",0,1,Omar Kahwaji,17204815
25439742~COURSE!~loAmvxJgEea8fxLSgUgxeQ,1510767209190,5,0,Perfect introduction.,0,0,Michel Racine,25439742
24323381~COURSE!~loAmvxJgEea8fxLSgUgxeQ,1509922136733,5,0,This was an amazing course. Everything was very well explained. Thank you.,0,0,Piotr Białka,24323381
26476763~COURSE!~loAmvxJgEea8fxLSgUgxeQ,1509412601001,5,0,"Excelent course, good machine learning tool",0,0,Nicolas Garcia,26476763
24791482~COURSE!~loAmvxJgEea8fxLSgUgxeQ,1508827215861,5,0,Very good course to machine learning.,0,0,陈洁莉,24791482
22417428~COURSE!~loAmvxJgEea8fxLSgUgxeQ,1508659450353,5,0,"very good course design,  easy to understand",0,0,colin zeng,22417428
29176271~COURSE!~loAmvxJgEea8fxLSgUgxeQ,1508418864813,5,0,"This is by far the most enjoyable course of the big data specialization, i loved the teaching approach and enjoyed all the hands on exercises. Great job!",0,0,Lola Bastos,29176271
24479456~COURSE!~loAmvxJgEea8fxLSgUgxeQ,1507861055222,5,0,a great course,0,0,arnold8968,24479456
13195245~COURSE!~loAmvxJgEea8fxLSgUgxeQ,1506974477176,5,0,Wonderful Course,0,0,Kamran Kausar,13195245
22029493~COURSE!~loAmvxJgEea8fxLSgUgxeQ,1506972248102,5,0,"Yet another high quality course in the Big Data Specialisation track, providing proper theoretical background in combination with hands on material, which are both -as always- very well prepared. I really like the well-balanced, concise approach. As with any course, this is a start allowing you to continue, depending on your personal and professional interests, with one or more of the topics touched over the past few weeks.",0,1,Dieter Bauwens,22029493
28040590~COURSE!~loAmvxJgEea8fxLSgUgxeQ,1506445471262,5,0,  This is a very good course in most aspects.  ,0,0,Assaduzzaman Noor,28040590
8062855~COURSE!~loAmvxJgEea8fxLSgUgxeQ,1506046482058,5,0,Great Course and tools,0,0,Enrique Agredano,8062855
244865~COURSE!~loAmvxJgEea8fxLSgUgxeQ,1505419840151,5,0,"It's been a little difficult but I am happy, I will take a machine learning course with R. I used databricks for processing since my Mac it's old, databricks it's free and nice but I couldn't run the libraries matplotlib parallels plot. ",0,0,Fernando García de León Villaseñor,244865
19708619~COURSE!~loAmvxJgEea8fxLSgUgxeQ,1504831939983,5,0,A very good course to begin with.,0,0,rajat bhati,19708619
16787903~COURSE!~loAmvxJgEea8fxLSgUgxeQ,1504680255120,5,0,That is why I took this coursera speciality,0,0,Monteil Jean-François,16787903
25937885~COURSE!~loAmvxJgEea8fxLSgUgxeQ,1503376615720,5,0,Suitable for beginner.,0,0,viper,25937885
19614251~COURSE!~loAmvxJgEea8fxLSgUgxeQ,1503123375750,5,0,"Love this course , given me good understanding of Machine Learning , Also introduced two tools - KNIME and Spark Mlib with really good hands on",0,0,Ankur Kapoor,19614251
2026469~COURSE!~loAmvxJgEea8fxLSgUgxeQ,1502765802022,5,0,"Amazing course, introduce the basic concepts.",0,0,Renato A. Guimararães,2026469
16572100~COURSE!~loAmvxJgEea8fxLSgUgxeQ,1501240037964,5,0,"Excellent course, funny assignments and good presentations",0,0,Nikos Berdos,16572100
22541150~COURSE!~loAmvxJgEea8fxLSgUgxeQ,1501088619024,5,0,"Wonderful teacher! Excellent course! But if you really want to learn Machine learning with Big Data, you have to work yourself on a project",0,0,Fernando Andrés Sánchez González,22541150
22110947~COURSE!~loAmvxJgEea8fxLSgUgxeQ,1500973504000,5,0,"Great experience, valuable knowledge and encouraging tests.",0,0,Marcin Laskowski,22110947
16501425~COURSE!~loAmvxJgEea8fxLSgUgxeQ,1500810963755,5,0,"Nice overview, I enjoyed the whole content. It  is very basic for ML specialists but definitely a good overview.",0,0,Alper Tutak,16501425
15258724~COURSE!~loAmvxJgEea8fxLSgUgxeQ,1499585949400,5,0,Simply Superb introduction to Machine Learning. ,0,0,PREMAL MEHTA,15258724
26824328~COURSE!~loAmvxJgEea8fxLSgUgxeQ,1499339624908,5,0,very good teacher!!,0,0,ran.yi14,26824328
24331966~COURSE!~loAmvxJgEea8fxLSgUgxeQ,1499325259811,5,0,very good this course special the activity on KNIME prog thank you DR Mai   ,0,0,Hamada Ibrahim Mohamed,24331966
22652795~COURSE!~loAmvxJgEea8fxLSgUgxeQ,1499285405157,5,0,Well taught material that was presented clearly and reinforced.  The material was interesting.,0,0,Keith Badgley,22652795
22027568~COURSE!~loAmvxJgEea8fxLSgUgxeQ,1499195646398,5,0,This is really very useful course to start with machine learning which goes through all terminology and basic algorithms in detail with hands on. More information about Spark would have been little bit more useful.,0,0,Gaurav Datar,22027568
16216076~COURSE!~loAmvxJgEea8fxLSgUgxeQ,1498953549011,5,0,"Excellent course, teacher and practices!",0,0,Fernando Martinez,16216076
24333734~COURSE!~loAmvxJgEea8fxLSgUgxeQ,1498832626205,5,0,Great thanks to every one .It was a good time and fantastic learning.Best Place to learn and Study with easy way .,0,0,Sayed Tarek Sayed,24333734
22737574~COURSE!~loAmvxJgEea8fxLSgUgxeQ,1498163892618,5,0,Excellent,0,0,Marino Gavidia,22737574
19784800~COURSE!~loAmvxJgEea8fxLSgUgxeQ,1498028804699,5,0,Really Really worth course!!,0,0,Jitender Singh Virk,19784800
25291225~COURSE!~loAmvxJgEea8fxLSgUgxeQ,1497927617928,5,0,I loved this course as it explained many of the machine learning algorithms that I was already familiar with with much more clarity than from online videos that I've seen. The equations were also explained very intuitively and with very practical handson exercises. I really recommend this course for anyone who needs a refresher on machine learning or brand new into it as the instructors Mai and Ilkay were so wonderful.,0,0,Dennis Nguyen-Do,25291225
12260460~COURSE!~loAmvxJgEea8fxLSgUgxeQ,1497386941360,5,0,I was really happy to take this course after the last two had really disappointed me. The organization was a lot stronger which led to a better understanding. The hands-on problems were also very thorough. It was a great introduction to machine learning with big data.,0,0,Ryan Honea,12260460
2750617~COURSE!~loAmvxJgEea8fxLSgUgxeQ,1497196781410,5,0,All the topics were explained with a lot of detail. Enjoyed and Learned a lot!!,0,0,Juan C Hidalgo,2750617
24376298~COURSE!~loAmvxJgEea8fxLSgUgxeQ,1496309432871,5,0,Excellent course. Want to dive deeper into the subject :-D,0,0,Mark de Boer,24376298
2873272~COURSE!~loAmvxJgEea8fxLSgUgxeQ,1496174559425,5,0,VERY GOOD,0,0,Juliano Iowa,2873272
22760389~COURSE!~loAmvxJgEea8fxLSgUgxeQ,1495638859064,5,0,very easy to follow and good hand on exercise,0,0,Frank Fan,22760389
1244251~COURSE!~loAmvxJgEea8fxLSgUgxeQ,1495475249491,5,0,One of the best courses in the series with a good mix of theory and hand-on exercise on ML implementation in big data,0,0,Aakarsh Gupta,1244251
19259998~COURSE!~loAmvxJgEea8fxLSgUgxeQ,1494186179698,5,0,Best course so far in this Intro to Big data.,0,0,Martin Lavoie,19259998
2692836~COURSE!~loAmvxJgEea8fxLSgUgxeQ,1493175248115,5,0,This course is a great fit between theory and pratice,0,0,Paul Aan,2692836
18676012~COURSE!~loAmvxJgEea8fxLSgUgxeQ,1492725278703,5,0,"Really fun, glad I finally finished.  I got so distracted running off and learning things.  I got familiar with scala and python along the way too.",0,0,Billy Perez,18676012
428634~COURSE!~loAmvxJgEea8fxLSgUgxeQ,1492322703086,5,0,"This is the best course of this specialization.  Dr. Nguyen describes and teaches the contents of machine learning with clarity and digested knowledge.  I would suggest to add more in-depth contents to each of the machine learning category, especially clustering, classification and association, at least as optional contents in case the number of weeks allocated for course are restricted.",0,0,Jian Song,428634
3960322~COURSE!~loAmvxJgEea8fxLSgUgxeQ,1490770363561,5,0,Very good,0,0,Sudhanshu Sharma,3960322
9991870~COURSE!~loAmvxJgEea8fxLSgUgxeQ,1490560024752,5,0,Very interesting cource! Thank you! I would suggest to advance python tasks,0,0,Сулейкин Александр,9991870
3152514~COURSE!~loAmvxJgEea8fxLSgUgxeQ,1489382914589,5,0,"Nice course, very practical.",0,0,Jose Alejandro Benitez Aragon,3152514
19445399~COURSE!~loAmvxJgEea8fxLSgUgxeQ,1489183203980,5,0,"This course introduces the basic concepts of ML beautifully, the instructor explains everything in a very lucid way. It also teaches modeling with ML in KNIME. I would personally want to know more about spark, but this course gives a good introduction. Overall very good starting point for beginners.",0,0,Aditi DB,19445399
21835041~COURSE!~loAmvxJgEea8fxLSgUgxeQ,1488279447215,5,0,Very well explained course on Machine Learning. I am grateful for the highly insightful course like this. I will recommend this course for all data enthusiasts.,0,0,Lawrence Osei-Wusu,21835041
22835916~COURSE!~loAmvxJgEea8fxLSgUgxeQ,1484070137677,5,0,It is really great.,0,0,Hadi Bitalebi,22835916
242512~COURSE!~loAmvxJgEea8fxLSgUgxeQ,1483921177243,5,0,The course was the best introduction I had for machine learning. Helped me a lot to understand different concepts from people who already know about the subject and I didn't have any idea. ,0,0,Piero Torres,242512
20561926~COURSE!~loAmvxJgEea8fxLSgUgxeQ,1483016938824,5,0,"I really enjoyed the course since it's match with my patience and work, in addition I'd like to highlight the instructor, clear,organized idea and steps, this was 70% of the success of the course I believe.",0,0,Othmane BELHADJER,20561926
12667361~COURSE!~loAmvxJgEea8fxLSgUgxeQ,1482884606744,5,0,Excelent Introductory course to MACHINE LEARNING with Big Data.,0,0,juan antonio castro silva,12667361
20231934~COURSE!~loAmvxJgEea8fxLSgUgxeQ,1482862281594,5,0,Great introduction with great tools. Has definitely inspired me to lean more about 'Machine Learning'!,0,0,Ben Woods,20231934
19093746~COURSE!~loAmvxJgEea8fxLSgUgxeQ,1482664514246,5,0,"The course helped me understand the concepts of the machine learning from the very rudimentary level. It also laid the foundation for understanding and dealing with the practical implementation of the machine learning algorithms and their implementation in big data which eventually elevated my understanding of applications dealing machine learning with Big Data. Thanks to all the mentors and instructors for everything- the teaching materials, quizzes, assignments and hands-on; everything was awesome.",0,0,Akshay Vyas,19093746
8006674~COURSE!~loAmvxJgEea8fxLSgUgxeQ,1482425537386,5,0,thanks so much ,0,0,Amir Ageez,8006674
5825643~COURSE!~loAmvxJgEea8fxLSgUgxeQ,1482351524029,5,0,the course helped understand the machine learning concepts and the hands-on were very comprehensive.,0,0,Sita Ram Prasad Gunturu,5825643
4282000~COURSE!~loAmvxJgEea8fxLSgUgxeQ,1481566284085,5,0,"Both the professors are great , the videos helped alot in understanding lot of core concepts in machine learning.",0,0,Rashmi Uikey,4282000
167352~COURSE!~loAmvxJgEea8fxLSgUgxeQ,1480734866681,5,0,excellent!!,0,0,Víctor Viera Balanta,167352
