id,reviewedAt,rating,isMarkedHelpful,reviewText,productCompleted,mostHelpfulVoteCount,users,user_id
15210170~COURSE!~qoYa6HE8EeWi0g6YoSAL-w,1498444241417,5,0,"This didn't seem like the most exciting course to me, but I'm so glad I invested the time to take it, as the material was very applicable to real-life situations.",0,0,Cassandra Grimm,15210170
25405575~COURSE!~qoYa6HE8EeWi0g6YoSAL-w,1497810517294,5,0,"This was a great class, I thoroughly enjoyed it.",0,0,Crystal Lawrence,25405575
24565363~COURSE!~qoYa6HE8EeWi0g6YoSAL-w,1497767099726,5,0,good,0,0,Eiman Marhoon ALHassani,24565363
24180396~COURSE!~qoYa6HE8EeWi0g6YoSAL-w,1497061552888,5,0,Very simplified and important part of the organization,0,0,KELLEY CARRILLO,24180396
24310308~COURSE!~qoYa6HE8EeWi0g6YoSAL-w,1496959966918,5,0,Very informational and can help you when working on programs for corporations ,0,0,ALEEYA STEWART,24310308
25494403~COURSE!~qoYa6HE8EeWi0g6YoSAL-w,1496659160280,5,0,Awesome :),0,0,Niharika Singh,25494403
12274158~COURSE!~qoYa6HE8EeWi0g6YoSAL-w,1496624024341,5,0,very good learnt alot about compensation & benefit.,0,0,Ehtasham Rafi,12274158
25891142~COURSE!~qoYa6HE8EeWi0g6YoSAL-w,1496173630341,5,0,Great overview of total rewards compensation and related topics. I feel more confident discussing total rewards program with employees.,0,0,Varneet Mehta,25891142
5689458~COURSE!~qoYa6HE8EeWi0g6YoSAL-w,1494751689186,5,0,Was a great learning experience ! ,0,0,Manish,5689458
3897428~COURSE!~qoYa6HE8EeWi0g6YoSAL-w,1493217844549,5,0,Good course,0,0,Lauren Botchey,3897428
24167146~COURSE!~qoYa6HE8EeWi0g6YoSAL-w,1493016216789,5,0,Very Good Course.High,0,0,Saswati Padhee,24167146
24137641~COURSE!~qoYa6HE8EeWi0g6YoSAL-w,1492505007241,5,0,great course,0,0,karan virdi,24137641
25196802~COURSE!~qoYa6HE8EeWi0g6YoSAL-w,1492408380163,5,0,effective course,0,0,suman gautam,25196802
24137755~COURSE!~qoYa6HE8EeWi0g6YoSAL-w,1491841701143,5,0,This course has helped me to understand various aspects of compensation management it is a very great course and it provides very good insights about  the topics related to compensation.,0,0,pothula aditya vardhana,24137755
21694989~COURSE!~qoYa6HE8EeWi0g6YoSAL-w,1486953333296,5,0,Very well explained!,0,0,Priya Mohan,21694989
5038558~COURSE!~qoYa6HE8EeWi0g6YoSAL-w,1482326637120,5,0,Great,0,0,Ademilua Oluwaseun Niyi,5038558
14963373~COURSE!~qoYa6HE8EeWi0g6YoSAL-w,1480587858961,5,0,Very helpfull for those HR partners not linked to C&B and very usefull for HR Generalist which need this including to be promoted or transfered into an organization.,0,0,Igor Hernandez Irahola,14963373
22079042~COURSE!~qoYa6HE8EeWi0g6YoSAL-w,1478792035695,5,0,knowledge sharing and gave a nice chance to learn something new about us economy and trade practices. thank you ,0,0,Venkata Subbaiah Chowdhary Vaddevalli,22079042
8552067~COURSE!~qoYa6HE8EeWi0g6YoSAL-w,1477725308636,5,0,Excellent course! The learning design is very simple and engaging. I would recommend it to anybody who wants to build a solid foundation in compensation and benefits.,0,0,yasir arafat,8552067
14438057~COURSE!~qoYa6HE8EeWi0g6YoSAL-w,1473874698352,5,0,Very comprehensive course. ,0,0,Kiran Sanapala,14438057
20008531~COURSE!~qoYa6HE8EeWi0g6YoSAL-w,1470399610482,5,0,Very detailed explanation and perfect practical examples. Enjoying learning this course.,0,0,Srividya Ivaturi,20008531
20088890~COURSE!~qoYa6HE8EeWi0g6YoSAL-w,1469353780594,5,0,"An engaging introduction to employee compensation, both monetary and non-monetary. Very useful for participants from other HR backgrounds looking to fill gaps in their knowledge.",0,0,Shaun Delaney,20088890
13033809~COURSE!~qoYa6HE8EeWi0g6YoSAL-w,1467249037848,5,0,This course gave me the overview on compensation and benefits I was looking for. The professor explanations are clear and well detailed. I recommend this class for anyone interested on the topic. ,0,2,Antoine LE FLAMANC,13033809
1985230~COURSE!~qoYa6HE8EeWi0g6YoSAL-w,1464006791316,5,0,Great course. Thanks a lot for your time.,0,0,Ricardo Cerceau,1985230
6052395~COURSE!~qoYa6HE8EeWi0g6YoSAL-w,1462799738142,5,0,"This course will give you a good view of how the different components of the pay mix affect employee compensation. The instructors in this course did a great job in reiterating the different aspects so that learning the material is easy and intuitive. While there are references to the other courses in the Specialization, this course can be taken as a stand-alone without missing anything.",0,2,Dorothy L. McGee,6052395
