id,reviewedAt,rating,isMarkedHelpful,reviewText,productCompleted,mostHelpfulVoteCount,users,user_id
117039297~COURSE!~rcUusZepEeuychIu0-l95w,1667881139838,4,0,Lots of great info!,0,0,Tung Le,117039297
56579317~COURSE!~rcUusZepEeuychIu0-l95w,1650047802435,4,0,good course,0,0,Hritik Gupta,56579317
102635468~COURSE!~rcUusZepEeuychIu0-l95w,1647623028672,5,0,really helpful!,0,0,helen Miranda barbosa dos Santos,102635468
99622980~COURSE!~rcUusZepEeuychIu0-l95w,1644059099015,5,0,excellent,0,0,HUSSEIN MOHAMED ABDULRAHMAN,99622980
87507717~COURSE!~rcUusZepEeuychIu0-l95w,1643445416973,5,0,Very informative and has a comprehensive discussion on relevant communication skills that is essential to the engineering industry.,0,0,"HERRERA , AMIEL JANSSEN (CANOZA)",87507717
87424605~COURSE!~rcUusZepEeuychIu0-l95w,1627454835446,5,0,"This is an excellent course. Prof Nicoletta delivers everything comprehensively from the general to specific topics. Moreover, her way of telling stories to introduce into the lectures is attractive and simple.",0,1,Trần Thanh Tâm,87424605
