id,reviewedAt,rating,isMarkedHelpful,reviewText,productCompleted,mostHelpfulVoteCount,users,user_id
119434569~COURSE!~sPepfpkeEemvnQ4fUTFrrA,1675067128228,5,0,"Everything depends on AI & ML now. Before enrolling in Coursera’s IBM AI Engineering Professional Certificate Course, I had zero knowledge about AI & DL. After completing the course, I am able to use these applications properly. It proved to be a total career game-changer.Coursera has proven to be a wonderful experience. I have taken classes from other organizations, but there’s no comparison to  Coursera.Highly relevant examples were given which made me get a clear idea of the concepts explained. Deeply appreciate Coursera & IBM for designing this course very well. Kudos to Instructors Dr Joseph Santarcangelo, Ph.D. for providing such a wonderful learning Journey.",0,0,Ilayaperumal K,119434569
87487845~COURSE!~sPepfpkeEemvnQ4fUTFrrA,1673645305440,5,0,awesome course,0,0,Milad Kamali,87487845
105913609~COURSE!~sPepfpkeEemvnQ4fUTFrrA,1672928942395,5,0,it is the best course that i have taken,0,0, Pudi Abhiram Reddy,105913609
41242928~COURSE!~sPepfpkeEemvnQ4fUTFrrA,1672827578539,5,0,Excellent step-by-step approach with solid python coding examples.,0,0,Stavros Lamprou,41242928
107747820~COURSE!~sPepfpkeEemvnQ4fUTFrrA,1670697596458,5,0,nice,0,0, SHIVAM .,107747820
89377067~COURSE!~sPepfpkeEemvnQ4fUTFrrA,1669925494556,5,0,"Perfect!A balanced combination of video explanation, labs and graded assignment.",0,0,2K20\ME\16\Aditya Kumar,89377067
640096~COURSE!~sPepfpkeEemvnQ4fUTFrrA,1667828519590,5,0,Thank you!,0,1,Mohammad Sayad,640096
79146811~COURSE!~sPepfpkeEemvnQ4fUTFrrA,1667432241916,5,0,"Excelent course, fast and objecive.",0,1,GABRIEL DOS SANTOS,79146811
54385766~COURSE!~sPepfpkeEemvnQ4fUTFrrA,1667207873507,5,0,"V​ery detailed and well organized video lectures (quizzes not so much, just the learning material) w.r.t. fundamental understanding. ",0,1,MATTHIAS TRUXA,54385766
13808146~COURSE!~sPepfpkeEemvnQ4fUTFrrA,1667140288748,5,0,very good course,0,1,wonseok kim,13808146
112789791~COURSE!~sPepfpkeEemvnQ4fUTFrrA,1665975727484,5,0,"W​hile there are some minor technical issues loading out of date libraries, the material and subjects are incredibly useful. This course is very difficult and welcome",0,1,Matt T,112789791
94756151~COURSE!~sPepfpkeEemvnQ4fUTFrrA,1664964653691,5,0,"N​ot only did I gain the basic knowledge of deep learning, but also learned Pytorch. It is a good course, however, there is still a lot more to go in the area of Deep learning, ",0,1,Yixuan,94756151
91139217~COURSE!~sPepfpkeEemvnQ4fUTFrrA,1663792802969,5,0,v​ery understandable,0,1,Sayed Esg,91139217
6469321~COURSE!~sPepfpkeEemvnQ4fUTFrrA,1661612712175,5,0,Excellent!,0,1,Siniša Bubonja,6469321
96394705~COURSE!~sPepfpkeEemvnQ4fUTFrrA,1660917690671,5,0,"Awesome course, cleared all concepts",0,1,Abhishek Selokar,96394705
44055500~COURSE!~sPepfpkeEemvnQ4fUTFrrA,1660762864406,5,0,Excellent Course.,0,1,VIKAS SIROHI,44055500
102399816~COURSE!~sPepfpkeEemvnQ4fUTFrrA,1659734188713,5,0,"SO far, this has been the best designed and most informative of the four courses that I have taken so far in the IBM AI Engineering Certification.",0,1,Steven Welch,102399816
106889662~COURSE!~sPepfpkeEemvnQ4fUTFrrA,1658997305454,5,0,G​reat Course,0,1,Philipp Abele,106889662
64688206~COURSE!~sPepfpkeEemvnQ4fUTFrrA,1658646851984,5,0,It is a very thorough basic introduction to pytorch and deep learning upto convolution..  ,0,1,Doga Siyli,64688206
110069892~COURSE!~sPepfpkeEemvnQ4fUTFrrA,1657555091518,5,0,it systematically gives how to use pytorch doing neural network. explanations are clear and practical,0,1,Yan Guo,110069892
87709922~COURSE!~sPepfpkeEemvnQ4fUTFrrA,1657108456401,5,0,a​wesome,0,1,oyenola philip,87709922
68945946~COURSE!~sPepfpkeEemvnQ4fUTFrrA,1655825019036,5,0,This is what I need for deep learning amazing course.,0,1,ABDULGHANI MAWLOOD A GHANI ABDULGHANI,68945946
39753379~COURSE!~sPepfpkeEemvnQ4fUTFrrA,1654899992588,5,0,The explanation is simple and understandable. They explained deep neural networks so beautifully with PyTorch. Thank you very much for this course IBM.,0,1,Doğu İlmak,39753379
16387584~COURSE!~sPepfpkeEemvnQ4fUTFrrA,1653302936398,5,0,Excellent,0,1,Panos Kafadaris,16387584
74894527~COURSE!~sPepfpkeEemvnQ4fUTFrrA,1652215081623,5,0,Well Paced!! Great Course for the intermediate level,0,1,Charan Bhardhwaj R,74894527
81562543~COURSE!~sPepfpkeEemvnQ4fUTFrrA,1652078651138,5,0,really good,0,1,Manh Doan 199x,81562543
65943978~COURSE!~sPepfpkeEemvnQ4fUTFrrA,1648254804814,5,0,Best course for Neural Network using PyTorch,0,1,Azzam Alhussain,65943978
17209176~COURSE!~sPepfpkeEemvnQ4fUTFrrA,1645490245501,5,0,Really detailed and clear,0,1,Luis Carlos Manrique Ruiz,17209176
98379288~COURSE!~sPepfpkeEemvnQ4fUTFrrA,1644856582976,5,0,Good for beginners,0,1,Sujan Neupane,98379288
88601780~COURSE!~sPepfpkeEemvnQ4fUTFrrA,1643860489901,5,0,Good course to know about neural networks with pytorch,0,1,Shivam Kumar,88601780
82773043~COURSE!~sPepfpkeEemvnQ4fUTFrrA,1638263277226,5,0,perfect course,0,1,arash hemati,82773043
96744096~COURSE!~sPepfpkeEemvnQ4fUTFrrA,1636546986170,5,0,A​ good introduction to deep learning with pytorch. The examples are very clear and the learning rate is not to steep,0,1,jonathan bourne,96744096
72625864~COURSE!~sPepfpkeEemvnQ4fUTFrrA,1632646893974,5,0,AWESOME,0,1,Godwin Muthomi,72625864
89346484~COURSE!~sPepfpkeEemvnQ4fUTFrrA,1628572008581,5,0,easy to understand,0,1,Lixy,89346484
90909723~COURSE!~sPepfpkeEemvnQ4fUTFrrA,1628002768821,5,0,good!,0,1,徐淇,90909723
88997037~COURSE!~sPepfpkeEemvnQ4fUTFrrA,1627665001469,5,0,The teaching of this course is clear and complete,0,1,林靖翰,88997037
31529321~COURSE!~sPepfpkeEemvnQ4fUTFrrA,1624732309985,5,0,One of the best course in the IBM AI Engineer Specialization !,0,0,Sourabh Kumbhar,31529321
61671956~COURSE!~sPepfpkeEemvnQ4fUTFrrA,1623726587751,5,0,"G​reat course. Although some of the material clearly wasn't made by native english speakers, and the language usage could be improved in future.",0,1,Tobias Bilgeri,61671956
46337364~COURSE!~sPepfpkeEemvnQ4fUTFrrA,1622922027148,5,0,"It is an amazing course, I learned a lot, videos and labs everything is amazing, thanks Coursera!",0,1,SUNIL KUMAR NALLAVELLI,46337364
57000951~COURSE!~sPepfpkeEemvnQ4fUTFrrA,1621958996404,5,0,"the course was perfect  goes step by step and keeps reminding the student what he studies in the sections before, I love it",0,1,OMAIMA EL ALAOUI-ELFELS,57000951
84386902~COURSE!~sPepfpkeEemvnQ4fUTFrrA,1621792967192,5,0,Much more understand how deep neural works!!,0,1,Krittamet Kotawong,84386902
80653207~COURSE!~sPepfpkeEemvnQ4fUTFrrA,1620585410432,5,0,"Курс ""Deep Neural Networks with PyTorch"" подходит для новичков, людей с базовым математическим аппаратом, с базовыми знаниями программирования Python и для тех, кого интересует математика нейронных сетей и машинного обучения. Курс делает упор на самостоятельность обучающихся и людей, которые сами заинтересованы в прохождении лабораторных работ. Здесь есть много инструментов для обучения, вычисления метрик, визуализации результатов, которые могут пригодится Вам в проектах. Курс прекрасно подходит для людей со средним знанием английского языка (материал разработан так, что он понятен и глазам, и ушам). Советую пройти данный курс на английском языке или с английскими субтитрами, чтобы погрузиться в изучение PyTorch и профессиональной терминологии разработчиков.",0,1,Анатолий Медведев,80653207
85075179~COURSE!~sPepfpkeEemvnQ4fUTFrrA,1619721638544,5,0,"awesome, this is like 2 courses in one",0,1,ilovecats,85075179
59516083~COURSE!~sPepfpkeEemvnQ4fUTFrrA,1618897904999,5,0,The course content was very well presented and was relatively easy to understand even when the pytorch framework is a bit complex. Thank you!,0,1,Yashwardhan Banta,59516083
74357797~COURSE!~sPepfpkeEemvnQ4fUTFrrA,1615023617429,5,0,Coll!,0,1,Abdullaev Sherzod,74357797
27544099~COURSE!~sPepfpkeEemvnQ4fUTFrrA,1614967087625,5,0,This course is basic and so foundational for begining,0,1,Quốc Huy Phạm,27544099
43666046~COURSE!~sPepfpkeEemvnQ4fUTFrrA,1614519415042,5,0,An excellent introduction to PyTorch.,0,1,Arijit Bose,43666046
80369680~COURSE!~sPepfpkeEemvnQ4fUTFrrA,1614236867879,5,0,It was my first experience programming in PyTorch and I was amazed.,0,0,Theophile Tiesse,80369680
43313886~COURSE!~sPepfpkeEemvnQ4fUTFrrA,1613393393610,5,0,Good.,0,1,Asitha Divisekara,43313886
70322022~COURSE!~sPepfpkeEemvnQ4fUTFrrA,1613246821229,5,0,Gran curso super detallista y explica muy bien los conceptos,0,1,Emanuel Nicolas,70322022
68337766~COURSE!~sPepfpkeEemvnQ4fUTFrrA,1611241694527,5,0,I really enjoy this course. it really helps me to boost my knowledge of PyTorch and deep neural network.,0,1,ayush koirala,68337766
2552139~COURSE!~sPepfpkeEemvnQ4fUTFrrA,1611093186285,5,0,"Good pacing, great examples and the assignments are doable within the time allocated for them. Combines both technical information and applied code.",0,1,Benjamin Pinaya,2552139
78350366~COURSE!~sPepfpkeEemvnQ4fUTFrrA,1610570518992,5,0,Joseph Santarcangelo is one of the best teacher i've seen in data science.  Courses were difficult but his explanations were really clear. ,0,1,THOMONT Billy,78350366
50544874~COURSE!~sPepfpkeEemvnQ4fUTFrrA,1610214681386,5,0,Really good structured with very clear explanation of the math behind the different topics,0,0,Andres Ivan Castro Roa,50544874
77442335~COURSE!~sPepfpkeEemvnQ4fUTFrrA,1608425919234,5,0,it goes through neural network and builds it from scratch. ,0,1,Milad Eghtedari Naeini,77442335
38045398~COURSE!~sPepfpkeEemvnQ4fUTFrrA,1607413410783,5,0,Good Course,0,1,Aditya Mohan Patnaik,38045398
64179671~COURSE!~sPepfpkeEemvnQ4fUTFrrA,1605195443867,5,0,"Excellent course, well put together labs and videos, overall a very dense resource for the topic. ",0,1,Garrett Merrion,64179671
46397719~COURSE!~sPepfpkeEemvnQ4fUTFrrA,1604773187917,5,0,"In-depth course, goes in much more detail than the usual introductory courses, also emphasizes on practical hands on rather than theoretical knowledge",0,1,Kartikey Chauhan,46397719
675453~COURSE!~sPepfpkeEemvnQ4fUTFrrA,1604676831355,5,0,The content was on point.,0,1,Abdoulaye Beavogui Koma,675453
65165312~COURSE!~sPepfpkeEemvnQ4fUTFrrA,1603988004798,5,0,Really good course!! Theres few typos in the video lectures but a good way to see if you really understand things ;) ,0,1,Adil Dahlan,65165312
50067843~COURSE!~sPepfpkeEemvnQ4fUTFrrA,1603469309666,5,0,Really great intro to PyTorch. Well explained the basics of Deep Learning along with PyTorch.,0,1,Vaseekaran Varatharajah,50067843
3176823~COURSE!~sPepfpkeEemvnQ4fUTFrrA,1600683572968,5,0,awesome course,0,1,CHALLA K S N M SANKAR,3176823
69230953~COURSE!~sPepfpkeEemvnQ4fUTFrrA,1598025770511,5,0,I have learned good skills for deep neural networks,0,1,Hasan Gharaibeh,69230953
69253932~COURSE!~sPepfpkeEemvnQ4fUTFrrA,1597669371749,5,0,best introduction course on the subject. ,0,1,Luis Cossio,69253932
3297254~COURSE!~sPepfpkeEemvnQ4fUTFrrA,1597280107520,5,0,Amazing course! ,0,1,amir jalilifard,3297254
42747167~COURSE!~sPepfpkeEemvnQ4fUTFrrA,1597015794680,5,0,this is no doubt THE BEST and the most well thought pytorch and deep learning course so far .,0,1,Aryal Gajbhiye,42747167
34543667~COURSE!~sPepfpkeEemvnQ4fUTFrrA,1596547331094,5,0,Great introduction to deep learning with pytorch. It would help if the notebooks in the labs take shorter to run so that the students can experiment with the code and the models.,0,1,Georgios Chatzis,34543667
46959195~COURSE!~sPepfpkeEemvnQ4fUTFrrA,1595876017464,5,0,Wonderful course!!! Best among all the courses under AI Engineer Certificate by IBM. Deep learning always haunted me with the maths involved but now I get a very good start with this.,0,3,Surya Prasad S ee19b121,46959195
13177355~COURSE!~sPepfpkeEemvnQ4fUTFrrA,1595495766175,5,0,Quiz questions are very easy. Graded Programming Assignments would have been better.,0,3,Siladittya Manna,13177355
11028954~COURSE!~sPepfpkeEemvnQ4fUTFrrA,1595426374769,5,0,"clear instruction, great ilustration and process description. Thank you so much",0,3,Sofyan Tandungan,11028954
28943846~COURSE!~sPepfpkeEemvnQ4fUTFrrA,1595366443457,5,0,"The right level of detail so that you can dive in. I wish there had been a week to cover RNNs as well though, in particular the best way to handle variable length sequences for RNNs :)",0,3,Karishma Dixit,28943846
61898583~COURSE!~sPepfpkeEemvnQ4fUTFrrA,1594604084140,5,0,Excellent Course.  I love the way the course was presented.  There were a lot of practical and visual examples explaining each module.  It is highly recommended!,0,3,Diego Ariel Degese,61898583
50028193~COURSE!~sPepfpkeEemvnQ4fUTFrrA,1594536991294,5,0,Amazing course with brilliant explanation,0,2,Zaheer Ur Rahman,50028193
27411367~COURSE!~sPepfpkeEemvnQ4fUTFrrA,1594115935983,5,0,"This course is really good in explaining the concepts and pytorch. Everything was explained in a detailed way, well structured. However, I found the course too segmented. Some lectures, some quizzes, and some labs can be combined. Example for week 1, I think 1.1 (introduction to tensors), 1.2 (1d tensors) and 1.3 (2d tensors) can be combined to single lecture or all 3 lectures be one after another making it appear like it’s together. The 2 labs can be combined into a single notebook. The 2 quizzes can be combined into 1 quiz of maybe 5 or more questions. Similarly, 1.4 (Simple Datasets) and 1.5 (Datasets) can be combined, and so on. I also think that the honours content about batch normalization should be included as part of normal contents. Maybe more advanced concepts can be put up as honours contents.  ",0,1,A Alkaff Ahamed,27411367
50867454~COURSE!~sPepfpkeEemvnQ4fUTFrrA,1594004110038,5,0,incredible course covering from  basics to a satisfaction level,0,3,AYUSH KARMWAR,50867454
49664811~COURSE!~sPepfpkeEemvnQ4fUTFrrA,1593599990049,5,0,It would be better to add a section explaining the experiment code of the famous paper.,0,3,Zhenzhou Zhang,49664811
49432889~COURSE!~sPepfpkeEemvnQ4fUTFrrA,1592501963835,5,0,By this course I can understand the basic concept for building neural network or deep lerning model using PyTorch. Very Good course to beginner.,0,3,Okta Fajar Suryani,49432889
48949854~COURSE!~sPepfpkeEemvnQ4fUTFrrA,1592391455757,5,0,"even with no mandatory peer graded assignment, for me it was the hardest course to learn in ""IBM AI Engineering"". So many topics and so many codes to check for each week. i liked it. i believe i will revisit the materials in the future.",0,1,Erdem Şen,48949854
46067156~COURSE!~sPepfpkeEemvnQ4fUTFrrA,1592331593484,5,0,It was well structured . Thank you,0,2,Farhad Abdi,46067156
2343290~COURSE!~sPepfpkeEemvnQ4fUTFrrA,1591765974640,5,0,Excellent! Just what I needed.,0,1,Oscar Alberto Chávez Bosquez,2343290
972036~COURSE!~sPepfpkeEemvnQ4fUTFrrA,1591307584838,5,0,"Great course material and explanations, so far the best of the IBM specialization.Great job Joseph!!",0,4,Giorgio Giaretta,972036
6280494~COURSE!~sPepfpkeEemvnQ4fUTFrrA,1591163838179,5,0,Great course !,0,4,Julien VALLET,6280494
30272939~COURSE!~sPepfpkeEemvnQ4fUTFrrA,1590942363806,5,0,Excellent course! Highly recommend to anyone wanting to learn PyTorch.,0,4,Patrick O'Rourke,30272939
28154102~COURSE!~sPepfpkeEemvnQ4fUTFrrA,1590917427835,5,0,Labs were detailed one.,0,3,Irfan Subhani,28154102
49183848~COURSE!~sPepfpkeEemvnQ4fUTFrrA,1590856929030,5,0,Outstanding course...,0,4,Samira Gholizadeh ,49183848
48976235~COURSE!~sPepfpkeEemvnQ4fUTFrrA,1590543903836,5,0,Very complete and challenging course for intermediate level in the creation and applications of neural networks,0,4,Daniel Jesus Baeza Olvera,48976235
32526421~COURSE!~sPepfpkeEemvnQ4fUTFrrA,1590204364552,5,0,"Not to easy , not too shallow, a perfectly comprehensive course with catholic aspects covered.",0,4,Prasad Chaudhari,32526421
55776065~COURSE!~sPepfpkeEemvnQ4fUTFrrA,1590071667549,5,0,Thanks a lot Mr.Joseph Santarcangelo for the wonderful sessions. I could follow all lessons. It was extremelly helpful,0,5,Sreena Raghul,55776065
45256424~COURSE!~sPepfpkeEemvnQ4fUTFrrA,1589722732808,5,0,A very excellent course to get introduced to PyTorch from bottom up.Also the lectures for Neural Networks and CNNs were short but really excellent and highly intuitive.These short lectures are an excellent way to learn concepts of Neural networks.Would have loved to see a week dedicated to sequence models.The instructors have really really done a fantastic job.,0,6,Ravi Paul Bansal,45256424
59543434~COURSE!~sPepfpkeEemvnQ4fUTFrrA,1589669608637,5,0,"This is not a bad course at all. One feedback, however, is making the quizzes longer, and adding difficult questions especially concept-based one in the quiz will be more rewarding and valuable. ",0,14,Robson Adem,59543434
47172358~COURSE!~sPepfpkeEemvnQ4fUTFrrA,1589631344034,5,0,Great course packed with loads of learning. The labs helped reinforce the content of the videos. Thanks!,0,4,Theodore Gaelejwe,47172358
2023089~COURSE!~sPepfpkeEemvnQ4fUTFrrA,1589614865084,5,0,A very thorough introduction to Pytorch. The course is general enough to learn other frameworks like Tensorflow and Keras as well.,0,5,Nishant Parashar,2023089
18859~COURSE!~sPepfpkeEemvnQ4fUTFrrA,1589073885594,5,0,"Excellent course is full of great information.  A bit long.  Since this is part of a series, some of the information is a bit repetitive.",0,5,kenneth Weiner,18859
3982956~COURSE!~sPepfpkeEemvnQ4fUTFrrA,1588608139367,5,0,A very nice course with clear explanations and good examples.,0,4,Evgeniya Ovchinnikova,3982956
29690477~COURSE!~sPepfpkeEemvnQ4fUTFrrA,1588407319051,5,0,very well structured course.,0,3,Shreya Dadhich,29690477
55905967~COURSE!~sPepfpkeEemvnQ4fUTFrrA,1588367753124,5,0,I really enjoyed the course for its diversity and practicality ,0,4,Alexander Mohammed Anyimadu,55905967
26546104~COURSE!~sPepfpkeEemvnQ4fUTFrrA,1588246429795,5,0,An extremely good course for anyone starting to build deep learning models. I am very satisfied at the end of this course as i was able to code models easily using pytorch. Definitely recomended!!,0,5,shanmukha yenneti,26546104
55514285~COURSE!~sPepfpkeEemvnQ4fUTFrrA,1588221193218,5,0,"Very good course only , complete the practical assignments they are important. As for exam the question answers should be based on practical outputs,  say make a model for this dataset or so. Paste the result for the score.",0,4,Ankush Kuwar,55514285
42113862~COURSE!~sPepfpkeEemvnQ4fUTFrrA,1588107245293,5,0,Well prepared course. I got a full overview of working with PyTorch.,0,4,Mevan Ekanayake,42113862
38015934~COURSE!~sPepfpkeEemvnQ4fUTFrrA,1588088778190,5,0,Awesome course,0,4,Aditya Girish Pawate,38015934
9844845~COURSE!~sPepfpkeEemvnQ4fUTFrrA,1588060547036,5,0,Good!,0,2,Krishna Harish,9844845
40713724~COURSE!~sPepfpkeEemvnQ4fUTFrrA,1588016958187,5,0,best course,0,4,Dishit Patel,40713724
47344851~COURSE!~sPepfpkeEemvnQ4fUTFrrA,1587841830858,5,0,Good introductory course! Lots of exercises and samples,0,4,Mateus Nakahata,47344851
23317769~COURSE!~sPepfpkeEemvnQ4fUTFrrA,1587488639277,5,0,"Great class! Easy to follow, teaches all important concepts for using convolutional neural network.",0,4,YEE SENG NG,23317769
1749196~COURSE!~sPepfpkeEemvnQ4fUTFrrA,1586996334381,5,0,"State of the art CourseI was expecting a more challenging project, 5 stars content",0,4,Adolfo Camacho Yague,1749196
32018363~COURSE!~sPepfpkeEemvnQ4fUTFrrA,1586761016232,5,0,The contents are not that hard and best suited as introduction level in deep learning.,0,4,Jessiedee Mark Gingo,32018363
40338415~COURSE!~sPepfpkeEemvnQ4fUTFrrA,1586400733181,5,0,Nice..!!,0,4,Branly F. Lugo,40338415
46334250~COURSE!~sPepfpkeEemvnQ4fUTFrrA,1586368028733,5,0,I really enjoy this course!!!,0,3,Suan Suan Alessandra Chen,46334250
47781059~COURSE!~sPepfpkeEemvnQ4fUTFrrA,1585908307672,5,0,"The main reasons i gave 5 starts: 1 There is simply a lot of content in this course 2 You can tell that the explanations were thought through and that reflects in the quality of the content3 The labs are super helpful and presented in a very understandable waySure the course doens't  cover some topics such as recursive neural networks, but you won't be disappointed unless you are looking for a very very technical course on NNs",0,6,lorenzo alisi,47781059
49993635~COURSE!~sPepfpkeEemvnQ4fUTFrrA,1585626679878,5,0,Good introduction to pytorch.,0,4,Gordon Rios,49993635
865970~COURSE!~sPepfpkeEemvnQ4fUTFrrA,1585604964246,5,0,this course provides a very good and cohesive introduction to Neural Networks. I learned a lot during my journey and I recommend it for anyone interesting in the field.,0,5,Mohamed Elashri,865970
48285597~COURSE!~sPepfpkeEemvnQ4fUTFrrA,1585483157092,5,0,Fantastic explanation,0,3,David Scheinmann,48285597
24083343~COURSE!~sPepfpkeEemvnQ4fUTFrrA,1585429745860,5,0,Well prepared and interesting content taught with a clear voice !,0,4,Alexis bogroff,24083343
17980905~COURSE!~sPepfpkeEemvnQ4fUTFrrA,1585142375627,5,0,It is freeaaakin hard if you take the whole IBM AI ENGINEERING Professional Cert in the duration of a trial period.,0,6,Arct John Zamora,17980905
27438357~COURSE!~sPepfpkeEemvnQ4fUTFrrA,1584685915374,5,0,Great course for beginners in pytorch,0,4,MUKUL KUMAR,27438357
3587355~COURSE!~sPepfpkeEemvnQ4fUTFrrA,1584280212746,5,0,Highly recommended course for students ,0,3,Mohamed Othman Abdelaal,3587355
29414307~COURSE!~sPepfpkeEemvnQ4fUTFrrA,1583638315175,5,0,The course is very complete and the instructor demonstrates a lot of knowledge on the subject.,0,4,Wanderson Souza,29414307
39173582~COURSE!~sPepfpkeEemvnQ4fUTFrrA,1583578691841,5,0,It was a very informative and interesting lecture. I learn a lot about the details when using PyTorch to build and train a deep neural network. I am so thankful.,0,5,Aïssatou NDOYE,39173582
32035446~COURSE!~sPepfpkeEemvnQ4fUTFrrA,1583489239965,5,0,Excellent lecture! I appreciate your great work! Thank you!,0,4,석박통합김한준,32035446
39012355~COURSE!~sPepfpkeEemvnQ4fUTFrrA,1582231186126,5,0,"It was a LONG course, very packed with info.  But, I feel like I certainly learned a lot and have a great foundation for further learning.",0,6,Jeremiah Jette,39012355
3115143~COURSE!~sPepfpkeEemvnQ4fUTFrrA,1582193128730,5,0,"One of the best courses I've taken. Everything was really easy explained, step-by-step, with nice slides and lost of explanations. It is really clear and starts from the very beginning. I'll totally recommend it! ",0,5,Cristina Aledo González,3115143
40980923~COURSE!~sPepfpkeEemvnQ4fUTFrrA,1581995509125,5,0,A good course for people who want to start with pytorch framework. This course start from sample problem to an complex ones help people understand easily.,0,5,Bằng Phạm Cao,40980923
47568109~COURSE!~sPepfpkeEemvnQ4fUTFrrA,1581235228733,5,0,Easy-to-follow course for pytorch,0,3,Lee Yik Yeung,47568109
45322642~COURSE!~sPepfpkeEemvnQ4fUTFrrA,1581005781541,5,0,It was Good !!,0,3,Marvin Lee,45322642
33837308~COURSE!~sPepfpkeEemvnQ4fUTFrrA,1580760534371,5,0,Very well done course! The concepts are pretty clearly explained. Sometimes the labs have instructions that are a bit misleading but it's a very minor issue. I really enjoyed the instructor using colored blocks as a tool to explain codes! ,0,5,Yong Shen,33837308
290720~COURSE!~sPepfpkeEemvnQ4fUTFrrA,1580605378073,5,0,Excellent Course. The Instructor put a lot of work into the content. Thank you for sharing the knowledge,0,5,konutek,290720
47928350~COURSE!~sPepfpkeEemvnQ4fUTFrrA,1580080335157,5,0,Great course with in depth material & hands-on learning.,0,4,Stefan Wroblewski,47928350
43753374~COURSE!~sPepfpkeEemvnQ4fUTFrrA,1577239698478,5,0,very helpful,0,4,ThanhTung,43753374
46613403~COURSE!~sPepfpkeEemvnQ4fUTFrrA,1576560828469,5,0,"A terrific overview of PyTorch. I was especially amazed by the lab notebooks where the author went above and beyond to plot everything in a useful way. This allowed the student to visualize everything that was going on under the hood. In each notebook, there was also multiple ways of showing how to accomplish a task whether it be coding manually or using a PyTorch function to simplify. I appreciate seeing it both ways as it really demystifies the black box of Deep Learning libraries.",0,9,Jordan Willis,46613403
42428360~COURSE!~sPepfpkeEemvnQ4fUTFrrA,1575881255093,5,0,Aprendí muchísimo. Gracias.,0,3,Vittorino Mandujano,42428360
15056747~COURSE!~sPepfpkeEemvnQ4fUTFrrA,1575877818001,5,0,Best course on AI,0,4,Farrukh,15056747
46100127~COURSE!~sPepfpkeEemvnQ4fUTFrrA,1575851185401,5,0,Very Clear explanation and rich labs. The quiz can be more challenging,0,4,RuoxinLi,46100127
4689785~COURSE!~sPepfpkeEemvnQ4fUTFrrA,1574276858670,5,0,"Amazing, really informative and helps a lot !!! really liked this course and would recommend this to anyone interested in Deep learning!",0,6,Daniel Kuznetsov,4689785
22961306~COURSE!~sPepfpkeEemvnQ4fUTFrrA,1574178917832,5,0,very intuitive and in depth,0,4,Pavan Devatha,22961306
