id,reviewedAt,rating,isMarkedHelpful,reviewText,productCompleted,mostHelpfulVoteCount,users,user_id
81718302~COURSE!~sPepfpkeEemvnQ4fUTFrrA,1615711020251,3,0,"I like to feel a human is teaching me, but I felt a robot is teaching instead. Also, many parts of the labs are copied from each other, and that's good, but the sentences and comments are forgotten unchanged and they don't belong to that lab. I preferred if the PowerPoints were designed better. Other than that, I can see that the author tried his best to include everything.",0,0,Gasm Elbary Mohamed M.E,81718302
8907667~COURSE!~sPepfpkeEemvnQ4fUTFrrA,1612592922636,3,0,"Potentially a good course, but due to the very short videos and complete lack of supporting material (not even the slides of the videos), it's hard to follow. You need to watch the videos over and over again and take notes. Not sure why not even the lecture slides are provided.",0,0,Stephan Wolters,8907667
29361036~COURSE!~sPepfpkeEemvnQ4fUTFrrA,1612556197953,3,0,"OK for beginners, superficial exercises and quizzes.",0,0,Liam Alfandary,29361036
69229907~COURSE!~sPepfpkeEemvnQ4fUTFrrA,1603878961553,3,0,the content is definitely overloaded.. i am blowing.. felt like i went to college again. if cut some of the content it will be much more user friendly to learn.. for an online class prespective,0,0,Yi Mei Luo,69229907
61499970~COURSE!~sPepfpkeEemvnQ4fUTFrrA,1602951677736,3,0,"The awful text-to-speech voice in the videos and the ""We do this.... we do this... we do this..."" information dump is poor from a didactic point of view.The redeeming feature of the course are the labs, but like many of these little courses there's little encouragement to play around with the code.",0,1,Simon Prentice,61499970
62671261~COURSE!~sPepfpkeEemvnQ4fUTFrrA,1599603458168,3,0,"Very slow and redundant material with previous courses of the ""IBM AI Engineering Certificat Professionnel""",0,0,Tony Daher,62671261
45515214~COURSE!~sPepfpkeEemvnQ4fUTFrrA,1596545901829,3,0,More useful exmples in labs would be helpful to understand the possibilities with the method and tool,0,0,Mutlu Okumus,45515214
8619281~COURSE!~sPepfpkeEemvnQ4fUTFrrA,1595622570622,3,0,"It is a nice course to get you into Pytorch and with some insightful views of how some ML algorithms work but adding to the most upvoted review, the synth voice dialogue sometimes doesn't make sense, the inflections on the speech are weird at times, it spells things that come from a text based explanation rather than someone speaking (things like spelling ""I E for -for example- and C N N for convolutional neural network among many, many others)... sometimes the voice is talking about one thing and something else is highlighted on the video, time mismatch...Many grammar mistakes, stuff left in the examples and quizes that doesn't make sense... definitely needs a redaction and content check.",0,3,RICARDO HERNANDEZ RAMON,8619281
14748673~COURSE!~sPepfpkeEemvnQ4fUTFrrA,1594835484295,3,0,A number of mistakes were found in the course. ,0,0,谭皓博,14748673
61947169~COURSE!~sPepfpkeEemvnQ4fUTFrrA,1593583104997,3,0,Very Basic course. Would have enjoyed more interesting examples in the notebooks,0,0,Prateeth Nayak,61947169
23743369~COURSE!~sPepfpkeEemvnQ4fUTFrrA,1593099408088,3,0,"The course is quite complete, but it contains to many things already contained in the previous courses within the Specialization. The final honor part could have been much better.",0,0,César Arquero Cabral,23743369
156946~COURSE!~sPepfpkeEemvnQ4fUTFrrA,1592755956358,3,0,"This course was not to the same standard as some others I've taken on Coursera.  I think the concepts would have been very hard to follow if I hadn't already taken the Deep Learning specialization, so it isn't a great conceptual introduction to Deep Learning.  That said, it also doesn't deeply explore the nuances of the PyTorch library, or give very much guidance on best practices or how it differs from other popular frameworks like Keras/TensorFlow.  The quiz questions are fairly shallow (and often frustratingly ambiguous).  Probably the best part of the class are the ungraded lab assignments.",0,0,Michael Higgins,156946
38706117~COURSE!~sPepfpkeEemvnQ4fUTFrrA,1591628377484,3,0,"quality of videos at the beginning of course are low, fells like the machine is reading it",0,0,Miroslav Tomasik,38706117
59290944~COURSE!~sPepfpkeEemvnQ4fUTFrrA,1591063038119,3,0,"The lectures and quizzes are too short to provide much value. The material could be better condensed. The labs were useful, although at times, it felt like the same material from a prior video. In general, it was a good overview. ",0,0,Chaney Ojinnaka,59290944
53657713~COURSE!~sPepfpkeEemvnQ4fUTFrrA,1588961400665,3,0,"Useful if you are already comfortable with deep learning and you want to learn how to use the (great) pytorch package. If you want to learn about deep learning from scratch, the explanations are not very intuitive and skip over some very interesting features.",0,1,Olivier Codol,53657713
8599930~COURSE!~sPepfpkeEemvnQ4fUTFrrA,1588670473363,3,0,There are a lot of mistakes in the slides and video but no updates,0,0,Pakawat NAKWIJIT,8599930
52451745~COURSE!~sPepfpkeEemvnQ4fUTFrrA,1588661446103,3,0,"This course provides a good amount of knowledge of PyTorch. However, the explanation and presentation are really bad. The monotonous voice and the quick changing of slides forces learners to watch the videos again and again.",0,1,Abdus Samee,52451745
5013145~COURSE!~sPepfpkeEemvnQ4fUTFrrA,1588491923369,3,0,The course is too heavy to have just one project. ,0,0,Suman Saurabh,5013145
24342335~COURSE!~sPepfpkeEemvnQ4fUTFrrA,1586005598886,3,0,Found it very difficult to follow some of the content and assignments,0,0,Bhaskar N Subramanian,24342335
30579360~COURSE!~sPepfpkeEemvnQ4fUTFrrA,1583720663511,3,0,"Ok walkthrought of pytorch, a lot of content but slight mismatch between rather basic DS topics and advanced programming skills. Materials need to be reviewed for spelling and grammar, some quiz questions are unclear.",0,0,Sabrina Schoenholzer,30579360
40201978~COURSE!~sPepfpkeEemvnQ4fUTFrrA,1583654737683,3,0,"Presenter is a synthesized computer voice. Slides and exercises are full of spelling errors. Contents is OK, but presentation is not very inspiring.",0,1,Geir Drange,40201978
5572652~COURSE!~sPepfpkeEemvnQ4fUTFrrA,1580405790140,3,0,To focus in the coding but not the underlying structure of the library and how to use it.,0,0,Benhur Ortiz Jaramillo,5572652
117409341~COURSE!~sPepfpkeEemvnQ4fUTFrrA,1677475620486,4,0,"Good PyTorch training course with clear structure and content in general, except that there are some small bugs in the labs.",0,0,Hu Jukai,117409341
80900497~COURSE!~sPepfpkeEemvnQ4fUTFrrA,1675675095521,4,0,"Very useful, although assignations are a little  easy ",0,0,Adil Gambarov,80900497
119092127~COURSE!~sPepfpkeEemvnQ4fUTFrrA,1669972901426,4,0,"Excellent course, works its way through basics to fully fledged machine learning models at a good pace.

A few of the examples used in the lab code throw errors, these should be rectified",0,0,Adam Fahey,119092127
42364960~COURSE!~sPepfpkeEemvnQ4fUTFrrA,1666089618705,4,0,This was a great course and it covers a diverse set of subjects.,0,0,Hani nik soleimani,42364960
53039216~COURSE!~sPepfpkeEemvnQ4fUTFrrA,1652876242244,4,0,Few mistakes of words as an artificial voice was used.,0,0,kiran kumar,53039216
11750488~COURSE!~sPepfpkeEemvnQ4fUTFrrA,1650786258203,4,0,"Despite the irritating computer voice and sloppy slides it is a good course. It is less a PyTorch course but an very nice introduction into ML and deep learning in general. Important concepts are introduced without overboarding the material with too much Math.The labs could be more interesting and challenging. Towards the end the IBM Cloud was not working any more, before it was really convienent to do the labs in the browser. However, there are only a few requirements and anyone with a little Python experience can quickly setup a virtual environment. However, an instruction and a requirements.txt would be nice.",0,0,Benjamin Kloepper,11750488
99702358~COURSE!~sPepfpkeEemvnQ4fUTFrrA,1646834094016,4,0,G​ood knowledge.,0,0,Utkarsh Anant,99702358
72758473~COURSE!~sPepfpkeEemvnQ4fUTFrrA,1646024455390,4,0,"Exceptional course. The lectures were little monotonous and robotic, I like this courses to be instructed by human speakers, but this did not affect the content of this course, the clarity on the topics and how well it was explained, it helped also to improve my knowledge on computer vision.Great course.",0,0,Carlos Ramirez,72758473
57216322~COURSE!~sPepfpkeEemvnQ4fUTFrrA,1644922326530,4,0,A very good course to get started with pytorch,0,0,Rahul Raaghav A,57216322
88069996~COURSE!~sPepfpkeEemvnQ4fUTFrrA,1644568068068,4,0,"some code were written illegible, a lot of the aftercourse quizes had typos",0,0,Will,88069996
91761098~COURSE!~sPepfpkeEemvnQ4fUTFrrA,1636021948919,4,0,Good lecture...,0,0,aditta das,91761098
20203300~COURSE!~sPepfpkeEemvnQ4fUTFrrA,1632968480408,4,0,The material is good.  I found the assignments a bit too easy.  A bit more challenge would be welcome.  I found the artificial voice with the lectures to be distracting.  The AI isn't quite good enough. ,0,0,Richard Desper,20203300
90686102~COURSE!~sPepfpkeEemvnQ4fUTFrrA,1629384345734,4,0,"It's a basic course of using PyTorch to establish CNN or other type of model,useful but kind of simple.",0,0,肖一,90686102
83045058~COURSE!~sPepfpkeEemvnQ4fUTFrrA,1626747353928,4,0,"Explanation was confusing as time, and text-to-speech lecturer made it harder to engage. Lots of typos and unintuitive phrasing. However, taught useful skills, and all the resources were there to do own thinking/research and eventually understand everything.",0,0,Josephine Jefferson,83045058
3769150~COURSE!~sPepfpkeEemvnQ4fUTFrrA,1625788507196,4,0,Good explanation with examples of code in python. The concept of convolution can be elaborated upon further as to it's genesis and how multiple processing techniques such as max pooling impact performance ,0,0,Kaustubh Sapru,3769150
47193684~COURSE!~sPepfpkeEemvnQ4fUTFrrA,1625041958185,4,0,very long! very very long long! very very very long long long. Too long!!!,0,0,Nyaniso Nkubungu,47193684
17865304~COURSE!~sPepfpkeEemvnQ4fUTFrrA,1624226388989,4,0,I​ would like to get more difficult Quizez... The Labs are very detailed and understandable. ,0,0,Vagif Molla,17865304
38598905~COURSE!~sPepfpkeEemvnQ4fUTFrrA,1624139125901,4,0,Should have more content which covers with examples,0,0,Sanju Anupa,38598905
1163235~COURSE!~sPepfpkeEemvnQ4fUTFrrA,1623205768682,4,0,"This is a nice course overall, however quizzes are very easy and course content is not 100% accurate. ",0,0,Pavel Selin,1163235
39338056~COURSE!~sPepfpkeEemvnQ4fUTFrrA,1621069040725,4,0,The course was great! The material and instruction is really nice. But so many typo especially in the quiz. ,0,0,Yosi Pramajaya,39338056
68342742~COURSE!~sPepfpkeEemvnQ4fUTFrrA,1619665034535,4,0,The questions are too simple.,0,0,Tj,68342742
48410151~COURSE!~sPepfpkeEemvnQ4fUTFrrA,1615222175087,4,0,It's the most difficult course in this specialisation..,0,0,Volha H,48410151
26594380~COURSE!~sPepfpkeEemvnQ4fUTFrrA,1614943212282,4,0,Course is good but too long and the instructor may want to slow down his narrative.,0,0,Vincent Hui,26594380
65418762~COURSE!~sPepfpkeEemvnQ4fUTFrrA,1613906688934,4,0,Detailed explanation about pytorch! I expect more examples and harder tests and assignments,0,0,何雪凝,65418762
13645220~COURSE!~sPepfpkeEemvnQ4fUTFrrA,1611300501406,4,0,"Content wise this is very good for beginners, who have basic Numpy, Python, DL understanding. Only issue would be the automated voice of the instructor. That can be changed to make it more human friendly!",0,0,Kishan,13645220
46223878~COURSE!~sPepfpkeEemvnQ4fUTFrrA,1609064669299,4,0,"Very good fundamental course.It will be good if real data is used in lab rather than using virtual data.Also, the notebook's hyperlink of the final assignment isn't work. I can't import the notebook to Watson studio and finish the assignment, please fix it, thank you.",0,0,drygrass,46223878
39285479~COURSE!~sPepfpkeEemvnQ4fUTFrrA,1607944003974,4,0,"Course material is great, although it has some errors, as on the video slides as in the notebooks. This should be rectified. Also, the assessments and quizzes should definitely be harder.",0,0,André Mourato,39285479
30298067~COURSE!~sPepfpkeEemvnQ4fUTFrrA,1605887500722,4,0,"I  appreciate this course. Its really amazing course and if you are a beginner in Deep Learning and want to use and learn Pytorch then this course is really good to start.One thing about this  course is that some important topics like RNN, R-CNN , text and sentiment analysis, time series are not included in this course which I think should be included.",0,3,Divyansh Choubisa,30298067
9342391~COURSE!~sPepfpkeEemvnQ4fUTFrrA,1604389823024,4,0,"Amazing course for a beginner in Deep Learning & Pytorch. I gave 4 stars as I expected it to be more pytorch heavy.Overall, a really good crafted course.",0,0,Ujjwal Jain,9342391
66077330~COURSE!~sPepfpkeEemvnQ4fUTFrrA,1603016338016,4,0,I learned loads in this course. I'm quite familiar with Keras so it was good to use a different package. The instruction was very clear but LONG. I would have liked the labs to have been more involved.,0,0,Edward Jackson,66077330
59265160~COURSE!~sPepfpkeEemvnQ4fUTFrrA,1602634968090,4,0,"Concepts presented in nice bite size chunks.  Labs help reinforce concepts.  BUT, felt like course was just a bunch of pieces with little assembly.  Kinda like finding a box of LEGOs (r) with nothing to really build from them.",0,0,bob nissen,59265160
5097764~COURSE!~sPepfpkeEemvnQ4fUTFrrA,1600618564602,4,0,"Good to dive into Deep Learning and get some PyTorch basics. However, there're sometimes mistakes in the assignments. Also, the explanations can sometimes be a bit confusing.",0,0,Deleted Account,5097764
44497356~COURSE!~sPepfpkeEemvnQ4fUTFrrA,1600096757396,4,0,"The labs are simply taking so much time. I am sure the is a better way to teach students than to make them wait 1 hour. Some people would want to run them locally, but this is not a solution, just a bypass. I learning a lot in this course and would reccomend. The best thing is that it taught me that CNNs are not super tough and with proper techniques can be handled.",0,1,Ali Ahmad,44497356
50639201~COURSE!~sPepfpkeEemvnQ4fUTFrrA,1596385820756,4,0,"Awesome course for learning the basics/fundamentals of Pytorch. However the labs often would not run some of the more complex or CPU-intensive models, so I would suggest downloading the labs to your local machine. Also could have also used more assignments for hands-on experience, but I would recommend this course.",0,0,Mitchell Henschel,50639201
14067289~COURSE!~sPepfpkeEemvnQ4fUTFrrA,1596112529561,4,0,"Positive-A lot of codes for practicing and learning-The quizzes are short and focusedNegative-The videos are too impersonal: it seems that the speaker is just reading the part, after a while I got tired of listening to him. -Please review the texts: there are too many misspelled words-Add more line of comments in the codes provided in lab",0,1,Fabrizio Donzelli,14067289
63768877~COURSE!~sPepfpkeEemvnQ4fUTFrrA,1595989547882,4,0,Great Course for beginners in pytorch,0,0,003 Ashwin Prasad,63768877
30834067~COURSE!~sPepfpkeEemvnQ4fUTFrrA,1595179763852,4,0,"generally, the course is well but tasks too easy for ""intermediate"" level ",0,0,Вадим Новоселов,30834067
43471273~COURSE!~sPepfpkeEemvnQ4fUTFrrA,1594416863775,4,0,The amount of material was surprisingly extensive and the labs were very useful. The tests were not very good. The videos were OK.,0,1,Mateo Periago,43471273
60761047~COURSE!~sPepfpkeEemvnQ4fUTFrrA,1594226912314,4,0,"The course was fantastic for someone like me.  I already knew all the math, and the course gave deep exposure to the needed Python routines and classes.  The labs really help cement the knowledge.Only drawback is that it went a bit too slow for me (NN with one input, NN with two inputs, NN with one output, NN with two outputs, etc.), but others might disagree.I'm giving it a four because there were so many typos and mistakes (i.e. the gradient is perpendicular to countour lines, not parallel), lots of mispellings and wrong data on the slides and the speaker sounded like a computer (he pronounced the variable idx as ""one-dx"" - huh?  I understand that there's going to be mistakes, but this is an one online course made for many people, and you'd expect that kind of stuff to be corrected over time since it is being repeatedly delivered.But - it was a great course and I highly recommend taking it.",0,0,Peter Pupalaikis,60761047
35749177~COURSE!~sPepfpkeEemvnQ4fUTFrrA,1593505938026,4,0,"The course gave a decent and well-structured introduction to PyTorch. However, I would have hoped for less typos (including in the code on the slides), more challenging and instructive quizzes and real exercises (there are instructive labs, but the practice section is usually only a very slight modification of the already given code).",0,0,Felix Hildebrand,35749177
1310967~COURSE!~sPepfpkeEemvnQ4fUTFrrA,1593030870135,4,0,"I think it's a good course if you're coming in with the notion of deep learning pretty much clear and are more interested in learning the PyTorch syntax. I'm not sure how useful the course would be in terms of learning ML or DL from scratch. In particular the conceptual slides could be better.The notebooks are well-prepared. Even though occasional bugs can be found, they aren't much to worry about.",0,0,Farhad Mohsin,1310967
6829666~COURSE!~sPepfpkeEemvnQ4fUTFrrA,1593018233945,4,0,"The courses provides basic knowledge, but I wish that it was a bit more advanced and had more challenging assignments.",0,0,Mehrdad Pourfathi,6829666
54023452~COURSE!~sPepfpkeEemvnQ4fUTFrrA,1592583674803,4,0,"A nice landing on Pytorch and basic Deep Learning concepts. I liked the collection of code and practical examples. If only, I missed having more difficult practical assignments along the course.",0,0,Jesus Gimenez,54023452
63415175~COURSE!~sPepfpkeEemvnQ4fUTFrrA,1592369919138,4,0,"The quizzes are way too easy. The videos are OK (read by computer voice except one). The labs, on the other hand, a really nice.",0,1,Andrey Gromov,63415175
13385490~COURSE!~sPepfpkeEemvnQ4fUTFrrA,1591882383966,4,0,"Here is a list of pros and cons:Pros: great notebooks and many examplesCons: the videos are a bit ""cheap"" (typos and artificial voice) and often miss the intuitions (""To do that, we code like this""). A bit light on the maths. Quizzes are too easy to validate (people may validate with a superficial understanding of what is going on).Summary: The value of this class resides in the notebooks and in the time your are willing to invest in them.",0,0,Julien Pascal,13385490
56096698~COURSE!~sPepfpkeEemvnQ4fUTFrrA,1590898090796,4,0,"Some of the courses are quite harsh, but finally come all togheter and  there's a light at the end of the tunnel.",0,0,Patricio Vera,56096698
7066531~COURSE!~sPepfpkeEemvnQ4fUTFrrA,1589811531455,4,0,good explanation with examples,0,0,harshita bhargava,7066531
40009837~COURSE!~sPepfpkeEemvnQ4fUTFrrA,1589682742173,4,0,Challenging ,0,0,Richard Balbuena,40009837
53931494~COURSE!~sPepfpkeEemvnQ4fUTFrrA,1589473821754,4,0,very practical,0,0,Mohd Nazri Kasuan ,53931494
125989~COURSE!~sPepfpkeEemvnQ4fUTFrrA,1589132013033,4,0,Good introduction of PyTorch. There are some minor code errors and inconsistencies in the material but generally not difficult to figure it out.,0,0,Jian Pan,125989
24520563~COURSE!~sPepfpkeEemvnQ4fUTFrrA,1586945483423,4,0,"Pros:Good intro to PyTorch, great work.Cons:1) typos along the course.2) lab is working too slow - better run locally.",0,1,Vitalii Shevchuk,24520563
49329474~COURSE!~sPepfpkeEemvnQ4fUTFrrA,1586721459550,4,0,"very practical, lack of theory",0,0,Roberto Gonzalez,49329474
33917591~COURSE!~sPepfpkeEemvnQ4fUTFrrA,1586119455690,4,0,"the course is good, detailed, and practical, but the shortcoming is the lab quality, need to be imporved",0,0,Yanjie Tao,33917591
30144772~COURSE!~sPepfpkeEemvnQ4fUTFrrA,1585562349269,4,0,"The course is good and has a nice mixture of theory and practice, which is essential for mastering complex concepts. However, I do have a few observations about the course quality:- Several of the slides in the presentations and even the labs have a lot of grammar mistakes.- The theory is often rushed in the lectures. The course would greatly benefit from a more careful analysis of the maths behind each concept.-In its effort to make the concepts easier to grasp, the lectures keep using coloured boxes to replace mathematical terms. I found that to be more confusing, they use far too many colours and are too liberal with their use.-Lastly, the labs completely broke down in the second half of the course. My understanding from the course staff is that an upgrade was made on the backend which did not go well and thus caused those issues. They should have several backup plans for those occurrences, starting with having the labs available for download so that the students can do them offline.Overall I'm happy with the course and would cautiously recommend it, given the above shortcomings.",0,0,Marco Caballero,30144772
28811731~COURSE!~sPepfpkeEemvnQ4fUTFrrA,1585503217797,4,0,"At the beginning, PyTorch framework seems very hard to understand. At the half of course you begin to have a clear vision of the problems. A negative point is the notebook for every topic. I would suggest one for week with everything inside.",0,1,Luca Riccardi ,28811731
32138672~COURSE!~sPepfpkeEemvnQ4fUTFrrA,1585502066616,4,0,less one star due to the many errors I noticed in the ,0,0,Bilal Ghanem,32138672
46124774~COURSE!~sPepfpkeEemvnQ4fUTFrrA,1584611554422,4,0,"In general, this course is very useful and I have learned a lot.But... A large amount of information has been compressed in a short period of time. The synthesized speech runs too fast. Slides on videos also change too fast. Some of them appear less than a second. A learner has to pause or even rewind a video to catch and explore them for understanding.Multiple errors in lab solutions (I would call them even bugs). Some of the proposed solutions do not follow requirements specified in preceding cells.Wrong information in slides. For example, 'hidden layers' instead of 'neurons in the hidden layer' or 'hidden neurons'.Too many spelling errors in videos, quizzes and descriptions apparently made by non-native English speakers. For example, two instead of too, ture instead of true, supper instead of super, rergresstion instead of regression etc.Technical issues with labs appear too often - cannot start the server or unavailable at all for multiple days, broken conda installation due to outdated or incompatible module versions (in particular, torchvision and pillow).I was expecting much more accuracy from a course led by IBM. An editor would be recommended to thoroughly review all the slides, quizzes and notebooks of this course.",0,32,Janis Slapins,46124774
6867630~COURSE!~sPepfpkeEemvnQ4fUTFrrA,1583851645715,4,0,Very interesting course. Gives a good introduction to pytorch. My only concern is the quality of the quizzes: It is often limited to 2 very simple questions. This does not allow you to validate that you had a good understanding of the said topic.,0,1,Philippe Garnier,6867630
43452062~COURSE!~sPepfpkeEemvnQ4fUTFrrA,1582138418094,4,0,No programming assingments,0,0,Lemikhov Aleksander,43452062
44535835~COURSE!~sPepfpkeEemvnQ4fUTFrrA,1581883797876,4,0,"Well, as there are no sort of exams or real questions to answer in order to pass, it strictly depends on how much attention you put in following this course. IMHO if well studied, it gives you a solid foundation, in order to let you explore the pytorch module.",0,1,Miele Walter,44535835
2291898~COURSE!~sPepfpkeEemvnQ4fUTFrrA,1581567615405,4,0,"More graded coding assignments would have been better, but content is good!",0,1,Paranjape Amey Jaywant,2291898
8523102~COURSE!~sPepfpkeEemvnQ4fUTFrrA,1579532706121,4,0,"Good, thorough course. Does not hold the student to any kind of standard or accountability and quizzes are ridiculously easy to pass.",0,1,Eric,8523102
20338628~COURSE!~sPepfpkeEemvnQ4fUTFrrA,1578766006802,4,0,Very intensive course.  Could do more training labs.  But this is definitely a very dense course.  Extremely helpful to get started on ML/Deep Learning.,0,0,TJ Griesenbrock,20338628
46802793~COURSE!~sPepfpkeEemvnQ4fUTFrrA,1578086237448,4,0,The course is interesting and well organized but the quiz are not challenging and full of typos.,0,2,Pietro Danzi,46802793
15848484~COURSE!~sPepfpkeEemvnQ4fUTFrrA,1577456027083,4,0,It would have been better if graded programming assignments were there.,0,0,Krishna Sandeep Bhogaraju,15848484
30293064~COURSE!~sPepfpkeEemvnQ4fUTFrrA,1576944062228,4,0,There is a number of errors in the courses and in quiz,0,0,Youness EL MARHRAOUI,30293064
48598442~COURSE!~sPepfpkeEemvnQ4fUTFrrA,1675734005248,5,0,Excellent course for learning. ,0,0,Bilal Khan,48598442
118206185~COURSE!~sPepfpkeEemvnQ4fUTFrrA,1675482054025,5,0,"yeah, it was good experiance thank you coursera team",0,0,ASHISH KUMAR PATEL ,118206185
